"DESCRIPTION","DURATION IN MS","NAME","PARENT SUITE","START TIME","STATUS","STOP TIME","SUB SUITE","SUITE","TEST CLASS","TEST METHOD"
"Test cases for TestAddOrderByToNeo4jQuery_WithOrderByClause","0","TestAddOrderByToNeo4jQuery_WithOrderByClause","","Fri Apr 10 18:55:07 UTC 2026","passed","Fri Apr 10 18:55:07 UTC 2026","","Go Test","github.com/specterops/bloodhound/cmd/api/src/api/v2/TestAddOrderByToNeo4jQuery_WithOrderByClause","TestAddOrderByToNeo4jQuery_WithOrderByClause"
"Test cases for TestUnmarshalNonIntegerNumber","0","TestUnmarshalNonIntegerNumber","","Fri Apr 10 18:55:11 UTC 2026","passed","Fri Apr 10 18:55:11 UTC 2026","","Go Test","github.com/specterops/bloodhound/cmd/api/src/database/types/null/TestUnmarshalNonIntegerNumber","TestUnmarshalNonIntegerNumber"
"","283","does fires TagToLabelDialog when the Label option is clicked","TagToZoneLabel","Fri Apr 10 18:56:12 UTC 2026","passed","Fri Apr 10 18:56:12 UTC 2026","","","",""
"","151","onCancel is called when cancel is clicked","Enable2FADialog","Fri Apr 10 18:58:32 UTC 2026","passed","Fri Apr 10 18:58:32 UTC 2026","","","",""
"Test cases for TestNormalizeToUTF8","0","TestNormalizeToUTF8","","Fri Apr 10 18:55:35 UTC 2026","passed","Fri Apr 10 18:55:35 UTC 2026","","Go Test","github.com/specterops/bloodhound/packages/go/bomenc/TestNormalizeToUTF8","TestNormalizeToUTF8"
"","0","uses the correct entity name in the Object ID message","getErrorMessage","Fri Apr 10 18:56:41 UTC 2026","passed","Fri Apr 10 18:56:41 UTC 2026","","","",""
"","15","does not show tooltip text by default","ColumnHeaders","Fri Apr 10 18:58:32 UTC 2026","passed","Fri Apr 10 18:58:32 UTC 2026","","SortableHeader with Tooltip","",""
"","0","handles specific Active Directory properties differently than Azure derived properties","Formatting number properties","Fri Apr 10 18:57:13 UTC 2026","passed","Fri Apr 10 18:57:13 UTC 2026","","","",""
"Test cases for TestManagementResource_GetSelf","3","TestManagementResource_GetSelf","","Fri Apr 10 18:55:31 UTC 2026","passed","Fri Apr 10 18:55:31 UTC 2026","","Go Test","github.com/specterops/bloodhound/cmd/api/src/api/v2/auth/TestManagementResource_GetSelf","TestManagementResource_GetSelf"
"","48","should display a message","CypherSearchMessage","Fri Apr 10 19:00:47 UTC 2026","passed","Fri Apr 10 19:00:47 UTC 2026","","","",""
"","128","Searching for existing node type returns node properties","useFetchEntityInfo","Fri Apr 10 18:58:21 UTC 2026","passed","Fri Apr 10 18:58:21 UTC 2026","","","",""
"","267","should render","Rule Object Select","Fri Apr 10 18:59:15 UTC 2026","passed","Fri Apr 10 18:59:15 UTC 2026","","","",""
"","876","should hide Environmental Targeted Access Control panel when showEnvironmentAccessControls prop is true and power user role is selected","UpdateUserForm","Fri Apr 10 18:56:11 UTC 2026","passed","Fri Apr 10 18:56:12 UTC 2026","","","",""
"","2","stores a string value in localStorage","useLocalStorage","Fri Apr 10 18:57:41 UTC 2026","passed","Fri Apr 10 18:57:41 UTC 2026","","setValue","",""
"Test cases for TestResources_CypherQuery","103","TestResources_CypherQuery","","Fri Apr 10 18:55:07 UTC 2026","passed","Fri Apr 10 18:55:07 UTC 2026","","Go Test","github.com/specterops/bloodhound/cmd/api/src/api/v2/TestResources_CypherQuery","TestResources_CypherQuery"
"","6","should not render a Field when the provided value is """"","Field","Fri Apr 10 19:00:10 UTC 2026","passed","Fri Apr 10 19:00:10 UTC 2026","","","",""
"Test cases for TestQueryParameterFilterParser_ParseQueryParameterFilter","1","TestQueryParameterFilterParser_ParseQueryParameterFilter","","Fri Apr 10 18:55:12 UTC 2026","passed","Fri Apr 10 18:55:12 UTC 2026","","Go Test","github.com/specterops/bloodhound/cmd/api/src/model/TestQueryParameterFilterParser_ParseQueryParameterFilter","TestQueryParameterFilterParser_ParseQueryParameterFilter"
"","6","shows the collection methods for the given job","toCollected","Fri Apr 10 19:00:15 UTC 2026","passed","Fri Apr 10 19:00:15 UTC 2026","","","",""
"","147","should display error message when error prop is provided","UpdateUserDialog","Fri Apr 10 18:56:37 UTC 2026","passed","Fri Apr 10 18:56:38 UTC 2026","","","",""
"Test cases for TestNodeNamePrefix_AppendSuffix","0","TestNodeNamePrefix_AppendSuffix","","Fri Apr 10 18:55:35 UTC 2026","passed","Fri Apr 10 18:55:35 UTC 2026","","Go Test","github.com/specterops/bloodhound/packages/go/analysis/ad/wellknown/TestNodeNamePrefix_AppendSuffix","TestNodeNamePrefix_AppendSuffix"
"Test cases for TestSignRequestTeeFailure","0","TestSignRequestTeeFailure","","Fri Apr 10 18:54:56 UTC 2026","passed","Fri Apr 10 18:54:56 UTC 2026","","Go Test","github.com/specterops/bloodhound/cmd/api/src/api/TestSignRequestTeeFailure","TestSignRequestTeeFailure"
"Test cases for TestResources_GetNTAuthStoreEntityInfo","193","TestResources_GetNTAuthStoreEntityInfo","","Fri Apr 10 18:55:07 UTC 2026","passed","Fri Apr 10 18:55:07 UTC 2026","","Go Test","github.com/specterops/bloodhound/cmd/api/src/api/v2/TestResources_GetNTAuthStoreEntityInfo","TestResources_GetNTAuthStoreEntityInfo"
"Test cases for TestContextMiddlewareBypassDisabled","0","TestContextMiddlewareBypassDisabled","","Fri Apr 10 18:54:58 UTC 2026","passed","Fri Apr 10 18:54:58 UTC 2026","","Go Test","github.com/specterops/bloodhound/cmd/api/src/api/middleware/TestContextMiddlewareBypassDisabled","TestContextMiddlewareBypassDisabled"
"Test cases for TestPasswordValidator","1","TestPasswordValidator","","Fri Apr 10 18:55:34 UTC 2026","passed","Fri Apr 10 18:55:34 UTC 2026","","Go Test","github.com/specterops/bloodhound/cmd/api/src/utils/validation/TestPasswordValidator","TestPasswordValidator"
"TestMigrator_GenerateManifestAfterVersion builds upon the GenerateManifest testby starting from different version points and spot checking migration counts.","0","TestMigrator_GenerateManifestAfterVersion","","Fri Apr 10 18:55:10 UTC 2026","passed","Fri Apr 10 18:55:10 UTC 2026","","Go Test","github.com/specterops/bloodhound/cmd/api/src/database/migration/TestMigrator_GenerateManifestAfterVersion","TestMigrator_GenerateManifestAfterVersion"
"","147","shows the direct object and expanded object list when results are present for both","Seed Selection Results","Fri Apr 10 18:56:56 UTC 2026","passed","Fri Apr 10 18:56:56 UTC 2026","","","",""
"Test cases for TestResources_DeleteAssetGroupTagSelector","3","TestResources_DeleteAssetGroupTagSelector","","Fri Apr 10 18:55:07 UTC 2026","passed","Fri Apr 10 18:55:07 UTC 2026","","Go Test","github.com/specterops/bloodhound/cmd/api/src/api/v2/TestResources_DeleteAssetGroupTagSelector","TestResources_DeleteAssetGroupTagSelector"
"Test cases for TestResources_GetRootCAEntityInfo","200","TestResources_GetRootCAEntityInfo","","Fri Apr 10 18:55:07 UTC 2026","passed","Fri Apr 10 18:55:07 UTC 2026","","Go Test","github.com/specterops/bloodhound/cmd/api/src/api/v2/TestResources_GetRootCAEntityInfo","TestResources_GetRootCAEntityInfo"
"","998","renders asset group edit options with graph write permissions","ContextMenu","Fri Apr 10 18:56:54 UTC 2026","passed","Fri Apr 10 18:56:55 UTC 2026","","","",""
"","87","allows a consumer to swap the values of the two inputs and update the query params accordingly","usePathfindingSearch","Fri Apr 10 18:58:10 UTC 2026","passed","Fri Apr 10 18:58:10 UTC 2026","","","",""
"","0","returns Object ID message when ruleType is SeedTypeObjectId and seeds are required","getErrorMessage","Fri Apr 10 18:56:41 UTC 2026","passed","Fri Apr 10 18:56:41 UTC 2026","","","",""
"Test cases for FuzzFoldr","0","FuzzFoldr","","Fri Apr 10 18:55:50 UTC 2026","passed","Fri Apr 10 18:55:50 UTC 2026","","Go Test","github.com/specterops/bloodhound/packages/go/slicesext/FuzzFoldr","FuzzFoldr"
"","1497","shows an error message when unable to delete a rule","Rule Form","Fri Apr 10 18:56:21 UTC 2026","passed","Fri Apr 10 18:56:22 UTC 2026","","","",""
"","301","Trying to view the edge info does not crash the app when selecting an unrecognized edge","EdgeInfoContent","Fri Apr 10 18:56:20 UTC 2026","passed","Fri Apr 10 18:56:20 UTC 2026","","","",""
"Test cases for TestBHCEStaticHandler","6","TestBHCEStaticHandler","","Fri Apr 10 18:54:59 UTC 2026","passed","Fri Apr 10 18:54:59 UTC 2026","","Go Test","github.com/specterops/bloodhound/cmd/api/src/api/static/TestBHCEStaticHandler","TestBHCEStaticHandler"
"Test cases for TestParseClientVersion","0","TestParseClientVersion","","Fri Apr 10 18:55:34 UTC 2026","passed","Fri Apr 10 18:55:34 UTC 2026","","Go Test","github.com/specterops/bloodhound/cmd/api/src/utils/TestParseClientVersion","TestParseClientVersion"
"","110","continue button is disabled when no SSO provider has been selected","LoginViaSSOForm","Fri Apr 10 18:59:08 UTC 2026","passed","Fri Apr 10 18:59:08 UTC 2026","","","",""
"Test cases for TestCreateUser_Failure","2","TestCreateUser_Failure","","Fri Apr 10 18:55:14 UTC 2026","passed","Fri Apr 10 18:55:14 UTC 2026","","Go Test","github.com/specterops/bloodhound/cmd/api/src/api/v2/auth/TestCreateUser_Failure","TestCreateUser_Failure"
"Test cases for TestCache_Set","4","TestCache_Set","","Fri Apr 10 18:55:35 UTC 2026","passed","Fri Apr 10 18:55:35 UTC 2026","","Go Test","github.com/specterops/bloodhound/packages/go/cache/TestCache_Set","TestCache_Set"
"","277","Selecting an edge that meets ACL inheritance criteria shows the ""ACE Inherited From"" dropdown","EdgeInfoContent","Fri Apr 10 18:56:21 UTC 2026","passed","Fri Apr 10 18:56:21 UTC 2026","","","",""
"Test cases for Test_convertGraphExtensionPayloadToGraphExtension","0","Test_convertGraphExtensionPayloadToGraphExtension","","Fri Apr 10 18:55:07 UTC 2026","passed","Fri Apr 10 18:55:07 UTC 2026","","Go Test","github.com/specterops/bloodhound/cmd/api/src/api/v2/Test_convertGraphExtensionPayloadToGraphExtension","Test_convertGraphExtensionPayloadToGraphExtension"
"Test cases for Test_cacheQueryResult","0","Test_cacheQueryResult","","Fri Apr 10 18:55:13 UTC 2026","passed","Fri Apr 10 18:55:13 UTC 2026","","Go Test","github.com/specterops/bloodhound/cmd/api/src/queries/Test_cacheQueryResult","Test_cacheQueryResult"
"","77","if a hint is given, it show date placeholder on focus, restores hint on blur","ManagedDatePicker - placeholders","Fri Apr 10 18:58:27 UTC 2026","passed","Fri Apr 10 18:58:28 UTC 2026","","","",""
"","0","returns true if value is null","searchParams","Fri Apr 10 18:59:10 UTC 2026","passed","Fri Apr 10 18:59:10 UTC 2026","","isEmptyParam","",""
"Test cases for TestResources_ExportSavedQuery","32","TestResources_ExportSavedQuery","","Fri Apr 10 18:55:07 UTC 2026","passed","Fri Apr 10 18:55:07 UTC 2026","","Go Test","github.com/specterops/bloodhound/cmd/api/src/api/v2/TestResources_ExportSavedQuery","TestResources_ExportSavedQuery"
"Test cases for TestResources_ListADEntityAdminRights","3","TestResources_ListADEntityAdminRights","","Fri Apr 10 18:55:07 UTC 2026","passed","Fri Apr 10 18:55:07 UTC 2026","","Go Test","github.com/specterops/bloodhound/cmd/api/src/api/v2/TestResources_ListADEntityAdminRights","TestResources_ListADEntityAdminRights"
"","2","should compute normal vectors for line segments","bezier","Fri Apr 10 19:01:31 UTC 2026","passed","Fri Apr 10 19:01:31 UTC 2026","","","",""
"Test cases for TestManagementResource_OIDCCallbackHandler","8","TestManagementResource_OIDCCallbackHandler","","Fri Apr 10 18:55:57 UTC 2026","passed","Fri Apr 10 18:55:57 UTC 2026","","Go Test","github.com/specterops/bloodhound/cmd/api/src/api/v2/auth/TestManagementResource_OIDCCallbackHandler","TestManagementResource_OIDCCallbackHandler"
"Test cases for TestManagementResource_ListPermissions","0","TestManagementResource_ListPermissions","","Fri Apr 10 18:55:14 UTC 2026","passed","Fri Apr 10 18:55:14 UTC 2026","","Go Test","github.com/specterops/bloodhound/cmd/api/src/api/v2/auth/TestManagementResource_ListPermissions","TestManagementResource_ListPermissions"
"","229","closes","ListItemActionMenu","Fri Apr 10 18:59:10 UTC 2026","passed","Fri Apr 10 18:59:10 UTC 2026","","","",""
"","175","fires runQuery in context provider","ListItemActionMenu","Fri Apr 10 18:59:10 UTC 2026","passed","Fri Apr 10 18:59:11 UTC 2026","","","",""
"","220","calls onLayoutChange with the selected layout","GraphControls","Fri Apr 10 18:56:46 UTC 2026","passed","Fri Apr 10 18:56:46 UTC 2026","","Selecting a layout","",""
"Test cases for TestGenericMap","0","TestGenericMap","","Fri Apr 10 18:55:34 UTC 2026","passed","Fri Apr 10 18:55:34 UTC 2026","","Go Test","github.com/specterops/bloodhound/cmd/api/src/utils/TestGenericMap","TestGenericMap"
"Test cases for TestHandleDatabaseError","0","TestHandleDatabaseError","","Fri Apr 10 18:54:56 UTC 2026","passed","Fri Apr 10 18:54:56 UTC 2026","","Go Test","github.com/specterops/bloodhound/cmd/api/src/api/TestHandleDatabaseError","TestHandleDatabaseError"
"Test cases for TestUrlValidator","0","TestUrlValidator","","Fri Apr 10 18:55:34 UTC 2026","passed","Fri Apr 10 18:55:34 UTC 2026","","Go Test","github.com/specterops/bloodhound/cmd/api/src/utils/validation/TestUrlValidator","TestUrlValidator"
"Test cases for TestAddOrderByToNeo4jQuery_NoOrderByClause","0","TestAddOrderByToNeo4jQuery_NoOrderByClause","","Fri Apr 10 18:55:07 UTC 2026","passed","Fri Apr 10 18:55:07 UTC 2026","","Go Test","github.com/specterops/bloodhound/cmd/api/src/api/v2/TestAddOrderByToNeo4jQuery_NoOrderByClause","TestAddOrderByToNeo4jQuery_NoOrderByClause"
"Test cases for TestParseAGMembersFromNodes_MissingNodeProperties","2","TestParseAGMembersFromNodes_MissingNodeProperties","","Fri Apr 10 18:55:07 UTC 2026","passed","Fri Apr 10 18:55:07 UTC 2026","","Go Test","github.com/specterops/bloodhound/cmd/api/src/api/v2/TestParseAGMembersFromNodes_MissingNodeProperties","TestParseAGMembersFromNodes_MissingNodeProperties"
"","294","should display correctly","ConfirmationDialog","Fri Apr 10 19:00:28 UTC 2026","passed","Fri Apr 10 19:00:28 UTC 2026","","","",""
"Test cases for TestTextUnmarshalBool","0","TestTextUnmarshalBool","","Fri Apr 10 18:55:11 UTC 2026","passed","Fri Apr 10 18:55:11 UTC 2026","","Go Test","github.com/specterops/bloodhound/cmd/api/src/database/types/null/TestTextUnmarshalBool","TestTextUnmarshalBool"
"","0","returns false if value is {}","searchParams","Fri Apr 10 18:59:10 UTC 2026","passed","Fri Apr 10 18:59:10 UTC 2026","","isEmptyParam","",""
"","417","should disable Cancel and Save buttons while isLoading is true","CreateUserDialog","Fri Apr 10 18:56:37 UTC 2026","passed","Fri Apr 10 18:56:37 UTC 2026","","","",""
"Test cases for TestFillAndPopulateDefaultAdminInfo","0","TestFillAndPopulateDefaultAdminInfo","","Fri Apr 10 18:55:07 UTC 2026","passed","Fri Apr 10 18:55:07 UTC 2026","","Go Test","github.com/specterops/bloodhound/cmd/api/src/bootstrap/TestFillAndPopulateDefaultAdminInfo","TestFillAndPopulateDefaultAdminInfo"
"Test cases for TestEncodingInterface","3","TestEncodingInterface","","Fri Apr 10 18:55:35 UTC 2026","passed","Fri Apr 10 18:55:35 UTC 2026","","Go Test","github.com/specterops/bloodhound/packages/go/bomenc/TestEncodingInterface","TestEncodingInterface"
"Test cases for TestInt64IsZero","0","TestInt64IsZero","","Fri Apr 10 18:55:11 UTC 2026","passed","Fri Apr 10 18:55:11 UTC 2026","","Go Test","github.com/specterops/bloodhound/cmd/api/src/database/types/null/TestInt64IsZero","TestInt64IsZero"
"","0","If for some reason the node size is not defined return 1 as a default","getNodeRadius","Fri Apr 10 19:01:38 UTC 2026","passed","Fri Apr 10 19:01:38 UTC 2026","","","",""
"Test cases for TestManagementResource_ListRoles_Filtered","0","TestManagementResource_ListRoles_Filtered","","Fri Apr 10 18:55:14 UTC 2026","passed","Fri Apr 10 18:55:14 UTC 2026","","Go Test","github.com/specterops/bloodhound/cmd/api/src/api/v2/auth/TestManagementResource_ListRoles_Filtered","TestManagementResource_ListRoles_Filtered"
"","103","calls setSelected with correct data on click","NoteCell component","Fri Apr 10 18:59:20 UTC 2026","passed","Fri Apr 10 18:59:20 UTC 2026","","","",""
"Test cases for TestIsValidEmail","0","TestIsValidEmail","","Fri Apr 10 18:55:34 UTC 2026","passed","Fri Apr 10 18:55:34 UTC 2026","","Go Test","github.com/specterops/bloodhound/cmd/api/src/utils/TestIsValidEmail","TestIsValidEmail"
"","325","should display ""Configure Multi-Factor Authentication"" title","Enable2FADialog","Fri Apr 10 18:58:32 UTC 2026","passed","Fri Apr 10 18:58:32 UTC 2026","","","",""
"","66","renders a link to the documentation","BloodHoundConfiguration","Fri Apr 10 19:01:51 UTC 2026","passed","Fri Apr 10 19:01:51 UTC 2026","","","",""
"","367","Toggles node and edge labels on/off depending on their existing state","GraphControls","Fri Apr 10 18:56:45 UTC 2026","passed","Fri Apr 10 18:56:46 UTC 2026","","Toggling labels","",""
"","361","shows a loading state","AssetGroupMenuItem","Fri Apr 10 18:57:10 UTC 2026","passed","Fri Apr 10 18:57:10 UTC 2026","","","",""
"Test cases for TestPermissionsCheckAtLeastOne","3","TestPermissionsCheckAtLeastOne","","Fri Apr 10 18:54:58 UTC 2026","passed","Fri Apr 10 18:54:58 UTC 2026","","Go Test","github.com/specterops/bloodhound/cmd/api/src/api/middleware/TestPermissionsCheckAtLeastOne","TestPermissionsCheckAtLeastOne"
"Test cases for TestParseHeaderValues","0","TestParseHeaderValues","","Fri Apr 10 18:54:58 UTC 2026","passed","Fri Apr 10 18:54:58 UTC 2026","","Go Test","github.com/specterops/bloodhound/cmd/api/src/api/middleware/TestParseHeaderValues","TestParseHeaderValues"
"Test cases for TestManagementResource_ListAuthTokens_UserIDFilter","0","TestManagementResource_ListAuthTokens_UserIDFilter","","Fri Apr 10 18:55:41 UTC 2026","passed","Fri Apr 10 18:55:41 UTC 2026","","Go Test","github.com/specterops/bloodhound/cmd/api/src/api/v2/auth/TestManagementResource_ListAuthTokens_UserIDFilter","TestManagementResource_ListAuthTokens_UserIDFilter"
"","17","sets autoDisplayTable to false if query type is relationship","useExploreTableAutoDisplay","Fri Apr 10 18:59:39 UTC 2026","passed","Fri Apr 10 18:59:39 UTC 2026","","","",""
"","117","renders when all data is available and rule is not default","Delete Selector Button rendering","Fri Apr 10 19:00:20 UTC 2026","passed","Fri Apr 10 19:00:20 UTC 2026","","","",""
"","415","should call performSearch on keyboard press alt+R","CypherSearch","Fri Apr 10 18:58:20 UTC 2026","passed","Fri Apr 10 18:58:20 UTC 2026","","","",""
"","0","returns false if value is +0","searchParams","Fri Apr 10 18:59:10 UTC 2026","passed","Fri Apr 10 18:59:10 UTC 2026","","isEmptyParam","",""
"Test cases for TestRequestWaitDuration_Negative","0","TestRequestWaitDuration_Negative","","Fri Apr 10 18:54:58 UTC 2026","passed","Fri Apr 10 18:54:58 UTC 2026","","Go Test","github.com/specterops/bloodhound/cmd/api/src/api/middleware/TestRequestWaitDuration_Negative","TestRequestWaitDuration_Negative"
"","134","buttons are disabled while loading","OneTimePasscodeForm","Fri Apr 10 18:59:53 UTC 2026","passed","Fri Apr 10 18:59:54 UTC 2026","","","",""
"","12","will update the selected filters based on the values stored in query params when the initialize function is called","usePathfindingFilters","Fri Apr 10 19:00:05 UTC 2026","passed","Fri Apr 10 19:00:05 UTC 2026","","","",""
"","3","The data is loading","Getting the text for the disabled item display for a search when there are no results","Fri Apr 10 18:59:05 UTC 2026","passed","Fri Apr 10 18:59:05 UTC 2026","","Loading states","",""
"","296","should render the pathfinding search controls when searchType is pathfinding","ExploreSearch rendering per tab","Fri Apr 10 19:01:08 UTC 2026","passed","Fri Apr 10 19:01:09 UTC 2026","","","",""
"","66","should hide Environmental Targeted Access Control panel when showEnvironmentAccessControls prop is false","CreateUserForm","Fri Apr 10 18:56:46 UTC 2026","passed","Fri Apr 10 18:56:46 UTC 2026","","","",""
"","124","renders a filter button","FileIngestFilterDialog","Fri Apr 10 18:56:45 UTC 2026","passed","Fri Apr 10 18:56:45 UTC 2026","","","",""
"Test cases for TestResources_GetEdgeComposition","104","TestResources_GetEdgeComposition","","Fri Apr 10 18:55:07 UTC 2026","passed","Fri Apr 10 18:55:07 UTC 2026","","Go Test","github.com/specterops/bloodhound/cmd/api/src/api/v2/TestResources_GetEdgeComposition","TestResources_GetEdgeComposition"
"Test cases for TestUpdateAssetGroupRequest_AuditData","0","TestUpdateAssetGroupRequest_AuditData","","Fri Apr 10 18:55:07 UTC 2026","passed","Fri Apr 10 18:55:07 UTC 2026","","Go Test","github.com/specterops/bloodhound/cmd/api/src/api/v2/TestUpdateAssetGroupRequest_AuditData","TestUpdateAssetGroupRequest_AuditData"
"Test cases for TestResources_SearchHandler","1","TestResources_SearchHandler","","Fri Apr 10 18:55:07 UTC 2026","passed","Fri Apr 10 18:55:07 UTC 2026","","Go Test","github.com/specterops/bloodhound/cmd/api/src/api/v2/TestResources_SearchHandler","TestResources_SearchHandler"
"Test cases for TestOpenGraphSchemaService_ListExtensions","1","TestOpenGraphSchemaService_ListExtensions","","Fri Apr 10 18:55:16 UTC 2026","passed","Fri Apr 10 18:55:16 UTC 2026","","Go Test","github.com/specterops/bloodhound/cmd/api/src/services/opengraphschema/TestOpenGraphSchemaService_ListExtensions","TestOpenGraphSchemaService_ListExtensions"
"Test cases for TestCache_NewCache","1","TestCache_NewCache","","Fri Apr 10 18:55:35 UTC 2026","passed","Fri Apr 10 18:55:35 UTC 2026","","Go Test","github.com/specterops/bloodhound/packages/go/cache/TestCache_NewCache","TestCache_NewCache"
"","327","should display filter dropwdowns","CommonSearches","Fri Apr 10 18:57:06 UTC 2026","passed","Fri Apr 10 18:57:07 UTC 2026","","","",""
"Test cases for TestResources_ListADEntityRDPRights","0","TestResources_ListADEntityRDPRights","","Fri Apr 10 18:55:07 UTC 2026","passed","Fri Apr 10 18:55:07 UTC 2026","","Go Test","github.com/specterops/bloodhound/cmd/api/src/api/v2/TestResources_ListADEntityRDPRights","TestResources_ListADEntityRDPRights"
"","365","sets exploreSearchTab param to pathfinding when the user clicks the `pathfinding` tab","ExploreSearch sets searchType on tab changing","Fri Apr 10 19:01:10 UTC 2026","passed","Fri Apr 10 19:01:10 UTC 2026","","","",""
"Test cases for TestResources_ListAvailableEnvironments","50","TestResources_ListAvailableEnvironments","","Fri Apr 10 18:55:07 UTC 2026","passed","Fri Apr 10 18:55:07 UTC 2026","","Go Test","github.com/specterops/bloodhound/cmd/api/src/api/v2/TestResources_ListAvailableEnvironments","TestResources_ListAvailableEnvironments"
"Test cases for TestManagementResource_UpdateUser_GetRolesError","1261","TestManagementResource_UpdateUser_GetRolesError","","Fri Apr 10 18:55:25 UTC 2026","passed","Fri Apr 10 18:55:26 UTC 2026","","Go Test","github.com/specterops/bloodhound/cmd/api/src/api/v2/auth/TestManagementResource_UpdateUser_GetRolesError","TestManagementResource_UpdateUser_GetRolesError"
"","68","displays ! icon when one of the Affected Object calls fail","EntityInfoDataTable","Fri Apr 10 18:56:51 UTC 2026","passed","Fri Apr 10 18:56:51 UTC 2026","","Node count for nested table that counts all sections","",""
"","7","updates key in state","useObjectState","Fri Apr 10 18:59:58 UTC 2026","passed","Fri Apr 10 18:59:58 UTC 2026","","","",""
"Test that the digester handles empty property lists gracefully","0","TestCacheEntryDigester_EmptyMatchers","","Fri Apr 10 18:55:16 UTC 2026","passed","Fri Apr 10 18:55:16 UTC 2026","","Go Test","github.com/specterops/bloodhound/cmd/api/src/services/graphify/endpoint/TestCacheEntryDigester_EmptyMatchers","TestCacheEntryDigester_EmptyMatchers"
"","63","enables pulling an ordered list of tags by position ascending","the useAssetGroupTags utilities","Fri Apr 10 18:56:55 UTC 2026","passed","Fri Apr 10 18:56:55 UTC 2026","","","",""
"Test cases for TestParseLimitQueryParameter","0","TestParseLimitQueryParameter","","Fri Apr 10 18:55:07 UTC 2026","passed","Fri Apr 10 18:55:07 UTC 2026","","Go Test","github.com/specterops/bloodhound/cmd/api/src/api/v2/TestParseLimitQueryParameter","TestParseLimitQueryParameter"
"Test cases for TestErrorReadDomainSIDandNameAsString","0","TestErrorReadDomainSIDandNameAsString","","Fri Apr 10 18:55:35 UTC 2026","passed","Fri Apr 10 18:55:35 UTC 2026","","Go Test","github.com/specterops/bloodhound/packages/go/analysis/ad/internal/nodeprops/TestErrorReadDomainSIDandNameAsString","TestErrorReadDomainSIDandNameAsString"
"","0","returns empty array when environments is undefined","filterAndSearchEnvironments","Fri Apr 10 18:56:15 UTC 2026","passed","Fri Apr 10 18:56:15 UTC 2026","","with empty environments","",""
"","310","Expand button causes table to expand to full height","ExploreTable","Fri Apr 10 18:56:00 UTC 2026","passed","Fri Apr 10 18:56:00 UTC 2026","","","",""
"Test cases for TestDatabaseWipe","0","TestDatabaseWipe","","Fri Apr 10 18:55:07 UTC 2026","passed","Fri Apr 10 18:55:07 UTC 2026","","Go Test","github.com/specterops/bloodhound/cmd/api/src/api/v2/TestDatabaseWipe","TestDatabaseWipe"
"","3","returns empty array when environments is empty","filterAndSearchEnvironments","Fri Apr 10 18:56:15 UTC 2026","passed","Fri Apr 10 18:56:15 UTC 2026","","with empty environments","",""
"Test cases for TestResources_ListAcceptedFileUploadTypes","2","TestResources_ListAcceptedFileUploadTypes","","Fri Apr 10 18:55:07 UTC 2026","passed","Fri Apr 10 18:55:07 UTC 2026","","Go Test","github.com/specterops/bloodhound/cmd/api/src/api/v2/TestResources_ListAcceptedFileUploadTypes","TestResources_ListAcceptedFileUploadTypes"
"","217","should render","NoDataDialog","Fri Apr 10 19:00:37 UTC 2026","passed","Fri Apr 10 19:00:37 UTC 2026","","","",""
"Test cases for TestWriteErrorResponse_InvalidFormat","0","TestWriteErrorResponse_InvalidFormat","","Fri Apr 10 18:54:56 UTC 2026","passed","Fri Apr 10 18:54:56 UTC 2026","","Go Test","github.com/specterops/bloodhound/cmd/api/src/api/TestWriteErrorResponse_InvalidFormat","TestWriteErrorResponse_InvalidFormat"
