"DESCRIPTION","DURATION IN MS","NAME","PARENT SUITE","START TIME","STATUS","STOP TIME","SUB SUITE","SUITE","TEST CLASS","TEST METHOD"
"Test cases for TestClearCache_HA","0","TestClearCache_HA","","Fri Apr 10 18:55:09 UTC 2026","passed","Fri Apr 10 18:55:09 UTC 2026","","Go Test","github.com/specterops/bloodhound/cmd/api/src/daemons/changelog/TestClearCache_HA","TestClearCache_HA"
"Test cases for TestResources_GetAssetGroupTagMemberInfo","0","TestResources_GetAssetGroupTagMemberInfo","","Fri Apr 10 18:55:07 UTC 2026","passed","Fri Apr 10 18:55:07 UTC 2026","","Go Test","github.com/specterops/bloodhound/cmd/api/src/api/v2/TestResources_GetAssetGroupTagMemberInfo","TestResources_GetAssetGroupTagMemberInfo"
"Test cases for Test_sortAndSliceResults_sorting","0","Test_sortAndSliceResults_sorting","","Fri Apr 10 18:55:13 UTC 2026","passed","Fri Apr 10 18:55:13 UTC 2026","","Go Test","github.com/specterops/bloodhound/cmd/api/src/queries/Test_sortAndSliceResults_sorting","Test_sortAndSliceResults_sorting"
"","130","returns a nodes array","useEdgeInfoItems","Fri Apr 10 18:58:57 UTC 2026","passed","Fri Apr 10 18:58:57 UTC 2026","","","",""
"Test cases for TestManagementResource_ServeSigningCertificate","9","TestManagementResource_ServeSigningCertificate","","Fri Apr 10 18:55:57 UTC 2026","passed","Fri Apr 10 18:55:57 UTC 2026","","Go Test","github.com/specterops/bloodhound/cmd/api/src/api/v2/auth/TestManagementResource_ServeSigningCertificate","TestManagementResource_ServeSigningCertificate"
"","783","disables the confirm button until user types required text","Tag Form","Fri Apr 10 18:56:04 UTC 2026","passed","Fri Apr 10 18:56:05 UTC 2026","","","",""
"","1","combines platform and risk filters","filterAndSearchEnvironments","Fri Apr 10 18:56:15 UTC 2026","passed","Fri Apr 10 18:56:15 UTC 2026","","combined filters","",""
"","0","should handle an undefined or null entity","Evaluating the entity display name from a given entity","Fri Apr 10 18:57:13 UTC 2026","passed","Fri Apr 10 18:57:13 UTC 2026","","","",""
"Test cases for TestNewManifest","1","TestNewManifest","","Fri Apr 10 18:55:10 UTC 2026","passed","Fri Apr 10 18:55:10 UTC 2026","","Go Test","github.com/specterops/bloodhound/cmd/api/src/database/migration/TestNewManifest","TestNewManifest"
"","113","renders enabled prop when flag is enabled","FeatureFlag","Fri Apr 10 18:59:35 UTC 2026","passed","Fri Apr 10 18:59:35 UTC 2026","","","",""
"Test cases for TestSelfDestructingTempFile","2","TestSelfDestructingTempFile","","Fri Apr 10 18:54:56 UTC 2026","passed","Fri Apr 10 18:54:56 UTC 2026","","Go Test","github.com/specterops/bloodhound/cmd/api/src/api/TestSelfDestructingTempFile","TestSelfDestructingTempFile"
"","445","should not call onSave when Save button is clicked and form input is invalid","CreateUserDialog","Fri Apr 10 18:56:33 UTC 2026","passed","Fri Apr 10 18:56:34 UTC 2026","","","",""
"Test cases for TestTextUnmarshalFloat","0","TestTextUnmarshalFloat","","Fri Apr 10 18:55:11 UTC 2026","passed","Fri Apr 10 18:55:11 UTC 2026","","Go Test","github.com/specterops/bloodhound/cmd/api/src/database/types/null/TestTextUnmarshalFloat","TestTextUnmarshalFloat"
"Test cases for Test_filterAndFormatSearchResults_filterEnvironments","0","Test_filterAndFormatSearchResults_filterEnvironments","","Fri Apr 10 18:55:07 UTC 2026","passed","Fri Apr 10 18:55:07 UTC 2026","","Go Test","github.com/specterops/bloodhound/cmd/api/src/api/v2/Test_filterAndFormatSearchResults_filterEnvironments","Test_filterAndFormatSearchResults_filterEnvironments"
"","248","closes the dialog when the ""Cancel"" button is clicked","SchemaUploadDialog","Fri Apr 10 18:57:14 UTC 2026","passed","Fri Apr 10 18:57:14 UTC 2026","","","",""
"","0","returns false if arrays have different length","areArraysSimilar","Fri Apr 10 19:00:19 UTC 2026","passed","Fri Apr 10 19:00:19 UTC 2026","","","",""
"Test cases for TestInt64Equal","0","TestInt64Equal","","Fri Apr 10 18:55:11 UTC 2026","passed","Fri Apr 10 18:55:11 UTC 2026","","Go Test","github.com/specterops/bloodhound/cmd/api/src/database/types/null/TestInt64Equal","TestInt64Equal"
"","503","should not call onSubmit when expired password is not supplied when reset password button clicked","PasswordResetForm","Fri Apr 10 18:58:16 UTC 2026","passed","Fri Apr 10 18:58:17 UTC 2026","","","",""
"","3","should return true when tag matches term","OperationsFilterPlugin","Fri Apr 10 19:00:44 UTC 2026","passed","Fri Apr 10 19:00:44 UTC 2026","","","",""
"Test cases for TestResources_UpdateAssetGroupTag","1","TestResources_UpdateAssetGroupTag","","Fri Apr 10 18:55:07 UTC 2026","passed","Fri Apr 10 18:55:07 UTC 2026","","Go Test","github.com/specterops/bloodhound/cmd/api/src/api/v2/TestResources_UpdateAssetGroupTag","TestResources_UpdateAssetGroupTag"
"Test cases for TestActivateMFA_Failure","754","TestActivateMFA_Failure","","Fri Apr 10 18:55:56 UTC 2026","passed","Fri Apr 10 18:55:57 UTC 2026","","Go Test","github.com/specterops/bloodhound/cmd/api/src/api/v2/auth/TestActivateMFA_Failure","TestActivateMFA_Failure"
"Test cases for TestRRuleValidator","0","TestRRuleValidator","","Fri Apr 10 18:55:34 UTC 2026","passed","Fri Apr 10 18:55:34 UTC 2026","","Go Test","github.com/specterops/bloodhound/cmd/api/src/utils/validation/TestRRuleValidator","TestRRuleValidator"
"","2","receives the current stored value as the previous state","useLocalStorage","Fri Apr 10 18:57:41 UTC 2026","passed","Fri Apr 10 18:57:41 UTC 2026","","functional updater","",""
"","931","should eventually render previously configured SSO providers","SSOConfiguration","Fri Apr 10 18:57:09 UTC 2026","passed","Fri Apr 10 18:57:10 UTC 2026","","","",""
"","904","renders the form for editing an existing rule","Rule Form","Fri Apr 10 18:56:19 UTC 2026","passed","Fri Apr 10 18:56:20 UTC 2026","","","",""
"","14054","checking a category updates all children and grandchildren","Pathfinding","Fri Apr 10 18:57:33 UTC 2026","passed","Fri Apr 10 18:57:47 UTC 2026","","","",""
"Test cases for TestMarshalIntText","0","TestMarshalIntText","","Fri Apr 10 18:55:11 UTC 2026","passed","Fri Apr 10 18:55:11 UTC 2026","","Go Test","github.com/specterops/bloodhound/cmd/api/src/database/types/null/TestMarshalIntText","TestMarshalIntText"
"","803","should not allow the input to exceed the allowed length","UpdateUserForm","Fri Apr 10 18:56:09 UTC 2026","passed","Fri Apr 10 18:56:09 UTC 2026","","","",""
"Test cases for TestBoolEqual","0","TestBoolEqual","","Fri Apr 10 18:55:11 UTC 2026","passed","Fri Apr 10 18:55:11 UTC 2026","","Go Test","github.com/specterops/bloodhound/cmd/api/src/database/types/null/TestBoolEqual","TestBoolEqual"
"","2","Edge is created with correct structure including points array","copySigmaEdgesToGraphlibGraph","Fri Apr 10 19:01:33 UTC 2026","passed","Fri Apr 10 19:01:33 UTC 2026","","","",""
"","4035","should clear state when logout action is dispatched","redux store","Fri Apr 10 19:01:37 UTC 2026","passed","Fri Apr 10 19:01:41 UTC 2026","","","",""
"","189","will request feature-flags when the user is fully authenticated","app","Fri Apr 10 19:01:37 UTC 2026","passed","Fri Apr 10 19:01:37 UTC 2026","","<Inner />","",""
"Test cases for TestArgon2_Digest","2","TestArgon2_Digest","","Fri Apr 10 18:55:35 UTC 2026","passed","Fri Apr 10 18:55:35 UTC 2026","","Go Test","github.com/specterops/bloodhound/packages/go/crypto/TestArgon2_Digest","TestArgon2_Digest"
"","1","passes ruleType through optionalParams with empty object","handleError","Fri Apr 10 18:56:41 UTC 2026","passed","Fri Apr 10 18:56:41 UTC 2026","","","",""
"Test cases for TestResources_CreateAssetGroupTagSelector","2","TestResources_CreateAssetGroupTagSelector","","Fri Apr 10 18:55:07 UTC 2026","passed","Fri Apr 10 18:55:07 UTC 2026","","Go Test","github.com/specterops/bloodhound/cmd/api/src/api/v2/TestResources_CreateAssetGroupTagSelector","TestResources_CreateAssetGroupTagSelector"
"","0","reports an Object ID-specific error when editing a rule and ruleType is SeedTypeObjectId and seeds are required","handleError","Fri Apr 10 18:56:41 UTC 2026","passed","Fri Apr 10 18:56:41 UTC 2026","","","",""
"","182","renders with a title","BloodHoundConfiguration","Fri Apr 10 19:01:51 UTC 2026","passed","Fri Apr 10 19:01:51 UTC 2026","","","",""
"Test cases for TestResources_UpdateSavedQuery_AdminPrivateQuery_Success","0","TestResources_UpdateSavedQuery_AdminPrivateQuery_Success","","Fri Apr 10 18:55:07 UTC 2026","passed","Fri Apr 10 18:55:07 UTC 2026","","Go Test","github.com/specterops/bloodhound/cmd/api/src/api/v2/TestResources_UpdateSavedQuery_AdminPrivateQuery_Success","TestResources_UpdateSavedQuery_AdminPrivateQuery_Success"
"Test cases for TestMarshalTime","0","TestMarshalTime","","Fri Apr 10 18:55:11 UTC 2026","passed","Fri Apr 10 18:55:11 UTC 2026","","Go Test","github.com/specterops/bloodhound/cmd/api/src/database/types/null/TestMarshalTime","TestMarshalTime"
"","329","clears the applied filter","FileIngestFilterDialog","Fri Apr 10 18:56:50 UTC 2026","passed","Fri Apr 10 18:56:50 UTC 2026","","User Select","",""
"Test cases for TestManagementResource_ListRoles_DBError","0","TestManagementResource_ListRoles_DBError","","Fri Apr 10 18:55:14 UTC 2026","passed","Fri Apr 10 18:55:14 UTC 2026","","Go Test","github.com/specterops/bloodhound/cmd/api/src/api/v2/auth/TestManagementResource_ListRoles_DBError","TestManagementResource_ListRoles_DBError"
"Test cases for TestToolContainer_GetScheduledAnalysisConfiguration_Errors","1","TestToolContainer_GetScheduledAnalysisConfiguration_Errors","","Fri Apr 10 18:54:59 UTC 2026","passed","Fri Apr 10 18:54:59 UTC 2026","","Go Test","github.com/specterops/bloodhound/cmd/api/src/api/tools/TestToolContainer_GetScheduledAnalysisConfiguration_Errors","TestToolContainer_GetScheduledAnalysisConfiguration_Errors"
"","745","dispatches an action to add the associated node","Rule Object Select","Fri Apr 10 18:59:16 UTC 2026","passed","Fri Apr 10 18:59:16 UTC 2026","","","",""
"","8","renders without pulse animation by default","StatusIndicator","Fri Apr 10 19:00:32 UTC 2026","passed","Fri Apr 10 19:00:32 UTC 2026","","","",""
"","170","displays the label for each result","SearchCurrentNodes","Fri Apr 10 18:58:46 UTC 2026","passed","Fri Apr 10 18:58:46 UTC 2026","","","",""
"","70","navigates to the specified route with global params intact","AppNavigate","Fri Apr 10 18:59:27 UTC 2026","passed","Fri Apr 10 18:59:27 UTC 2026","","","",""
"","12","displays CaretDownOutline icon when the sortOrder is undefined","ColumnHeaders","Fri Apr 10 18:58:32 UTC 2026","passed","Fri Apr 10 18:58:32 UTC 2026","","SortableHeader","",""
"Test cases for TestGC_Name","0","TestGC_Name","","Fri Apr 10 18:55:08 UTC 2026","passed","Fri Apr 10 18:55:08 UTC 2026","","Go Test","github.com/specterops/bloodhound/cmd/api/src/daemons/gc/TestGC_Name","TestGC_Name"
"Test cases for TestFloatValueOrZero","0","TestFloatValueOrZero","","Fri Apr 10 18:55:11 UTC 2026","passed","Fri Apr 10 18:55:11 UTC 2026","","Go Test","github.com/specterops/bloodhound/cmd/api/src/database/types/null/TestFloatValueOrZero","TestFloatValueOrZero"
"","62","shows an error notification if there is an error fetching","useFinishedJobs","Fri Apr 10 18:58:06 UTC 2026","passed","Fri Apr 10 18:58:06 UTC 2026","","","",""
"Test cases for TestDummyHA","0","TestDummyHA","","Fri Apr 10 18:55:09 UTC 2026","passed","Fri Apr 10 18:55:09 UTC 2026","","Go Test","github.com/specterops/bloodhound/cmd/api/src/daemons/changelog/TestDummyHA","TestDummyHA"
"Test cases for TestManagementResource_ListPermissions_DBError","0","TestManagementResource_ListPermissions_DBError","","Fri Apr 10 18:55:14 UTC 2026","passed","Fri Apr 10 18:55:14 UTC 2026","","Go Test","github.com/specterops/bloodhound/cmd/api/src/api/v2/auth/TestManagementResource_ListPermissions_DBError","TestManagementResource_ListPermissions_DBError"
"Test cases for TestManagementResource_CreateAuthToken","16155","TestManagementResource_CreateAuthToken","","Fri Apr 10 18:55:41 UTC 2026","passed","Fri Apr 10 18:55:57 UTC 2026","","Go Test","github.com/specterops/bloodhound/cmd/api/src/api/v2/auth/TestManagementResource_CreateAuthToken","TestManagementResource_CreateAuthToken"
"Test cases for TestResources_GetEdgeACLInheritancePath","110","TestResources_GetEdgeACLInheritancePath","","Fri Apr 10 18:55:07 UTC 2026","passed","Fri Apr 10 18:55:07 UTC 2026","","Go Test","github.com/specterops/bloodhound/cmd/api/src/api/v2/TestResources_GetEdgeACLInheritancePath","TestResources_GetEdgeACLInheritancePath"
"","1","should hide/expand search widget when user clicks minus/plus button","ExploreSearch rendering per tab","Fri Apr 10 19:01:52 UTC 2026","unknown","Fri Apr 10 19:01:52 UTC 2026","","","",""
"","293","adds a ""Close"" button that closes the dialog after a failed upload","SchemaUploadDialog","Fri Apr 10 18:57:15 UTC 2026","passed","Fri Apr 10 18:57:16 UTC 2026","","","",""
"Test cases for TestBoolSetValid","0","TestBoolSetValid","","Fri Apr 10 18:55:11 UTC 2026","passed","Fri Apr 10 18:55:11 UTC 2026","","Go Test","github.com/specterops/bloodhound/cmd/api/src/database/types/null/TestBoolSetValid","TestBoolSetValid"
"","53","initializes with the given state","useObjectState","Fri Apr 10 18:59:58 UTC 2026","passed","Fri Apr 10 18:59:58 UTC 2026","","","",""
"Test cases for TestResources_ListPublishedToCAs","1","TestResources_ListPublishedToCAs","","Fri Apr 10 18:55:07 UTC 2026","passed","Fri Apr 10 18:55:07 UTC 2026","","Go Test","github.com/specterops/bloodhound/cmd/api/src/api/v2/TestResources_ListPublishedToCAs","TestResources_ListPublishedToCAs"
"","12","removes key from state","useObjectState","Fri Apr 10 18:59:58 UTC 2026","passed","Fri Apr 10 18:59:58 UTC 2026","","","",""
"Test cases for TestIsValidClientVersion","0","TestIsValidClientVersion","","Fri Apr 10 18:55:34 UTC 2026","passed","Fri Apr 10 18:55:34 UTC 2026","","Go Test","github.com/specterops/bloodhound/cmd/api/src/utils/TestIsValidClientVersion","TestIsValidClientVersion"
"Test cases for TestQueries_BuildEntityQueryParams_InvalidSkip","0","TestQueries_BuildEntityQueryParams_InvalidSkip","","Fri Apr 10 18:55:14 UTC 2026","passed","Fri Apr 10 18:55:14 UTC 2026","","Go Test","github.com/specterops/bloodhound/cmd/api/src/queries/TestQueries_BuildEntityQueryParams_InvalidSkip","TestQueries_BuildEntityQueryParams_InvalidSkip"
"","309","shows all extensions when search is cleared","ActiveExtensionsCard","Fri Apr 10 18:56:21 UTC 2026","passed","Fri Apr 10 18:56:21 UTC 2026","","","",""
"Test cases for TestUnique","0","TestUnique","","Fri Apr 10 18:55:50 UTC 2026","passed","Fri Apr 10 18:55:50 UTC 2026","","Go Test","github.com/specterops/bloodhound/packages/go/slicesext/TestUnique","TestUnique"
"Test cases for TestManagementResource_ListPermissions_PredicateMismatchWithColumn","0","TestManagementResource_ListPermissions_PredicateMismatchWithColumn","","Fri Apr 10 18:55:14 UTC 2026","passed","Fri Apr 10 18:55:14 UTC 2026","","Go Test","github.com/specterops/bloodhound/cmd/api/src/api/v2/auth/TestManagementResource_ListPermissions_PredicateMismatchWithColumn","TestManagementResource_ListPermissions_PredicateMismatchWithColumn"
"","277","should call onClose when the Close button is clicked","UpsertSAMLProviderForm","Fri Apr 10 18:59:30 UTC 2026","passed","Fri Apr 10 18:59:30 UTC 2026","","","",""
"","0","should handle an entity that has an empty name property","Evaluating the entity display name from a given entity","Fri Apr 10 18:57:13 UTC 2026","passed","Fri Apr 10 18:57:13 UTC 2026","","","",""
"","432","renders headers","CommonSearches","Fri Apr 10 18:57:06 UTC 2026","passed","Fri Apr 10 18:57:06 UTC 2026","","","",""
"Test cases for TestHeaderMatches","0","TestHeaderMatches","","Fri Apr 10 18:55:34 UTC 2026","passed","Fri Apr 10 18:55:34 UTC 2026","","Go Test","github.com/specterops/bloodhound/cmd/api/src/utils/TestHeaderMatches","TestHeaderMatches"
"","6","should not render a Field when the provided value is []","Field","Fri Apr 10 19:00:10 UTC 2026","passed","Fri Apr 10 19:00:10 UTC 2026","","","",""
"","14","sets autoDisplayTable to false if query type is pathfinding","useExploreTableAutoDisplay","Fri Apr 10 18:59:39 UTC 2026","passed","Fri Apr 10 18:59:39 UTC 2026","","","",""
"","0","returns undefined if graphData is %s or not a GraphResponse","getExploreTableData","Fri Apr 10 18:58:36 UTC 2026","passed","Fri Apr 10 18:58:36 UTC 2026","","","",""
"","89","renders a button when actor is not BloodHoundString and note exists","NoteCell component","Fri Apr 10 18:59:20 UTC 2026","passed","Fri Apr 10 18:59:20 UTC 2026","","","",""
"","217","removes a node from an asset group tag","AssetGroupMenuItem","Fri Apr 10 18:57:11 UTC 2026","passed","Fri Apr 10 18:57:11 UTC 2026","","","",""
"","122","renders the analysis toggle when multi tier analysis enabled is true and when editing an existing zone","Tag Form","Fri Apr 10 18:56:02 UTC 2026","passed","Fri Apr 10 18:56:02 UTC 2026","","","",""
"","314","sets a primarySearch=id and searchType=node when secondarySearch is falsey","ContextMenu","Fri Apr 10 18:56:56 UTC 2026","passed","Fri Apr 10 18:56:56 UTC 2026","","","",""
"","249","toggles parent from none to all","SourceKindsCheckboxes","Fri Apr 10 18:58:02 UTC 2026","passed","Fri Apr 10 18:58:02 UTC 2026","","","",""
"","129","renders a confirm dialg","ConfirmDeleteQueryDialog","Fri Apr 10 19:00:33 UTC 2026","passed","Fri Apr 10 19:00:33 UTC 2026","","","",""
"","264","should display a searchbox with a placeholder when rendered","AssetGroupEdit","Fri Apr 10 18:58:52 UTC 2026","passed","Fri Apr 10 18:58:52 UTC 2026","","","",""
"","10","uses the discardQueryParams prop to discard all query params on the redirect","AppNavigate","Fri Apr 10 18:59:27 UTC 2026","passed","Fri Apr 10 18:59:27 UTC 2026","","","",""
"","3","isLoading returns as expected based on all queries combined","queriesAreLoadingOrErrored","Fri Apr 10 19:00:39 UTC 2026","passed","Fri Apr 10 19:00:39 UTC 2026","","","",""
"","10","should render when search string is in the middle of the text","HighlightedText","Fri Apr 10 18:59:57 UTC 2026","passed","Fri Apr 10 18:59:57 UTC 2026","","","",""
"Test cases for TestResources_CreateSavedQuery","0","TestResources_CreateSavedQuery","","Fri Apr 10 18:55:07 UTC 2026","passed","Fri Apr 10 18:55:07 UTC 2026","","Go Test","github.com/specterops/bloodhound/cmd/api/src/api/v2/TestResources_CreateSavedQuery","TestResources_CreateSavedQuery"
"","59","fails checks if the user does not have a matching permission","usePermissions","Fri Apr 10 18:57:25 UTC 2026","passed","Fri Apr 10 18:57:25 UTC 2026","","","",""
"","0","returns disabled config when any required param is falsey","useExploreGraph","Fri Apr 10 18:56:38 UTC 2026","passed","Fri Apr 10 18:56:38 UTC 2026","composition search queries","exploreGraphQueryFactory","",""
"Test cases for TestResources_ListADComputerAdmins","0","TestResources_ListADComputerAdmins","","Fri Apr 10 18:55:07 UTC 2026","passed","Fri Apr 10 18:55:07 UTC 2026","","Go Test","github.com/specterops/bloodhound/cmd/api/src/api/v2/TestResources_ListADComputerAdmins","TestResources_ListADComputerAdmins"
"","819","opens and closes the filter","FileIngestFilterDialog","Fri Apr 10 18:56:45 UTC 2026","passed","Fri Apr 10 18:56:46 UTC 2026","","","",""
"","179","shows ""Expired"" in red when the expiration date has already passed","UserTokenManagementDialog - API Expiration Date column","Fri Apr 10 18:57:04 UTC 2026","passed","Fri Apr 10 18:57:05 UTC 2026","","","",""
"","677","should sort by type","SSOProviderTable","Fri Apr 10 18:59:16 UTC 2026","passed","Fri Apr 10 18:59:16 UTC 2026","","","",""
"","166","renders correctly","NodeIcon","Fri Apr 10 19:00:02 UTC 2026","passed","Fri Apr 10 19:00:02 UTC 2026","","","",""
"Test cases for TestMaybeSubmitNodeUpdate","1","TestMaybeSubmitNodeUpdate","","Fri Apr 10 18:55:16 UTC 2026","passed","Fri Apr 10 18:55:16 UTC 2026","","Go Test","github.com/specterops/bloodhound/cmd/api/src/services/graphify/TestMaybeSubmitNodeUpdate","TestMaybeSubmitNodeUpdate"
"Test cases for TestResources_OpenGraphSchemaIngest","0","TestResources_OpenGraphSchemaIngest","","Fri Apr 10 18:55:07 UTC 2026","passed","Fri Apr 10 18:55:07 UTC 2026","","Go Test","github.com/specterops/bloodhound/cmd/api/src/api/v2/TestResources_OpenGraphSchemaIngest","TestResources_OpenGraphSchemaIngest"
"Test cases for Test_SetNodeProperties","0","Test_SetNodeProperties","","Fri Apr 10 18:55:07 UTC 2026","passed","Fri Apr 10 18:55:07 UTC 2026","","Go Test","github.com/specterops/bloodhound/cmd/api/src/api/v2/Test_SetNodeProperties","Test_SetNodeProperties"
"Test cases for TestBuildSQLFilter","2","TestBuildSQLFilter","","Fri Apr 10 18:55:12 UTC 2026","passed","Fri Apr 10 18:55:12 UTC 2026","","Go Test","github.com/specterops/bloodhound/cmd/api/src/model/TestBuildSQLFilter","TestBuildSQLFilter"
"Test cases for TestResources_PreviewSelectors","0","TestResources_PreviewSelectors","","Fri Apr 10 18:55:07 UTC 2026","passed","Fri Apr 10 18:55:07 UTC 2026","","Go Test","github.com/specterops/bloodhound/cmd/api/src/api/v2/TestResources_PreviewSelectors","TestResources_PreviewSelectors"
"","292","should handle click events on apply and cancel","ConfirmUpdateQueryDialog","Fri Apr 10 19:00:17 UTC 2026","passed","Fri Apr 10 19:00:17 UTC 2026","","","",""
"","1225","filling in the name value allows updating the rule and navigates back to the details page","Rule Form","Fri Apr 10 18:56:23 UTC 2026","passed","Fri Apr 10 18:56:24 UTC 2026","","","",""
"Test cases for TestFeatureFlagManager","1","TestFeatureFlagManager","","Fri Apr 10 18:55:08 UTC 2026","passed","Fri Apr 10 18:55:08 UTC 2026","","Go Test","github.com/specterops/bloodhound/cmd/api/src/daemons/changelog/TestFeatureFlagManager","TestFeatureFlagManager"
"Test cases for TestResources_ListADComputerSQLAdmins","0","TestResources_ListADComputerSQLAdmins","","Fri Apr 10 18:55:07 UTC 2026","passed","Fri Apr 10 18:55:07 UTC 2026","","Go Test","github.com/specterops/bloodhound/cmd/api/src/api/v2/TestResources_ListADComputerSQLAdmins","TestResources_ListADComputerSQLAdmins"
"Test cases for TestTextUnmarshalString","0","TestTextUnmarshalString","","Fri Apr 10 18:55:11 UTC 2026","passed","Fri Apr 10 18:55:11 UTC 2026","","Go Test","github.com/specterops/bloodhound/cmd/api/src/database/types/null/TestTextUnmarshalString","TestTextUnmarshalString"
"","0","returns null if paramValue is null","useEnvironmentParams","Fri Apr 10 19:00:39 UTC 2026","passed","Fri Apr 10 19:00:39 UTC 2026","","parseEnvironmentAggregation","",""
"Test cases for TestManagementResource_DeleteUser_UserCannotSelfDelete","1396","TestManagementResource_DeleteUser_UserCannotSelfDelete","","Fri Apr 10 18:55:31 UTC 2026","passed","Fri Apr 10 18:55:32 UTC 2026","","Go Test","github.com/specterops/bloodhound/cmd/api/src/api/v2/auth/TestManagementResource_DeleteUser_UserCannotSelfDelete","TestManagementResource_DeleteUser_UserCannotSelfDelete"
"Test cases for TestManagementResource_ListUsers_InvalidColumn","1","TestManagementResource_ListUsers_InvalidColumn","","Fri Apr 10 18:55:14 UTC 2026","passed","Fri Apr 10 18:55:14 UTC 2026","","Go Test","github.com/specterops/bloodhound/cmd/api/src/api/v2/auth/TestManagementResource_ListUsers_InvalidColumn","TestManagementResource_ListUsers_InvalidColumn"
"Test cases for TestManagementResource_ListRoles_InvalidColumn","0","TestManagementResource_ListRoles_InvalidColumn","","Fri Apr 10 18:55:14 UTC 2026","passed","Fri Apr 10 18:55:14 UTC 2026","","Go Test","github.com/specterops/bloodhound/cmd/api/src/api/v2/auth/TestManagementResource_ListRoles_InvalidColumn","TestManagementResource_ListRoles_InvalidColumn"
"","3","returns bounds for text rendered to canvas","getLabelBoundsFromContext","Fri Apr 10 19:01:38 UTC 2026","passed","Fri Apr 10 19:01:38 UTC 2026","","","",""
"","96","should call onCancel when cancel button clicked","LoginViaSSOForm","Fri Apr 10 18:59:08 UTC 2026","passed","Fri Apr 10 18:59:08 UTC 2026","","","",""
"","711","calls delete mutation when confirm button is clicked with correct input","ActiveExtensionsCard","Fri Apr 10 18:56:24 UTC 2026","passed","Fri Apr 10 18:56:24 UTC 2026","","","",""
"Test cases for TestSortJSONArrayElements","4","TestSortJSONArrayElements","","Fri Apr 10 18:55:34 UTC 2026","passed","Fri Apr 10 18:55:34 UTC 2026","","Go Test","github.com/specterops/bloodhound/cmd/api/src/utils/test/TestSortJSONArrayElements","TestSortJSONArrayElements"
"Test cases for TestDomainSelectors_GetFilterCriteria_Domain","0","TestDomainSelectors_GetFilterCriteria_Domain","","Fri Apr 10 18:55:12 UTC 2026","passed","Fri Apr 10 18:55:12 UTC 2026","","Go Test","github.com/specterops/bloodhound/cmd/api/src/model/TestDomainSelectors_GetFilterCriteria_Domain","TestDomainSelectors_GetFilterCriteria_Domain"
"Test cases for Test_NewRequestSignature","0","Test_NewRequestSignature","","Fri Apr 10 18:54:56 UTC 2026","passed","Fri Apr 10 18:54:56 UTC 2026","","Go Test","github.com/specterops/bloodhound/cmd/api/src/api/Test_NewRequestSignature","Test_NewRequestSignature"
"Test cases for TestStringScan","0","TestStringScan","","Fri Apr 10 18:55:11 UTC 2026","passed","Fri Apr 10 18:55:11 UTC 2026","","Go Test","github.com/specterops/bloodhound/cmd/api/src/database/types/null/TestStringScan","TestStringScan"
"Test cases for TestDatabase_GetAssetGroupTagSelector","4","TestDatabase_GetAssetGroupTagSelector","","Fri Apr 10 18:55:07 UTC 2026","passed","Fri Apr 10 18:55:07 UTC 2026","","Go Test","github.com/specterops/bloodhound/cmd/api/src/api/v2/TestDatabase_GetAssetGroupTagSelector","TestDatabase_GetAssetGroupTagSelector"
"","0","reports an API error when the name for the rule is not unique","handleError","Fri Apr 10 18:56:41 UTC 2026","passed","Fri Apr 10 18:56:41 UTC 2026","","","",""
"Test cases for TestVersion_GreaterThan","0","TestVersion_GreaterThan","","Fri Apr 10 18:55:35 UTC 2026","passed","Fri Apr 10 18:55:35 UTC 2026","","Go Test","github.com/specterops/bloodhound/cmd/api/src/version/TestVersion_GreaterThan","TestVersion_GreaterThan"
