"DESCRIPTION","DURATION IN MS","NAME","PARENT SUITE","START TIME","STATUS","STOP TIME","SUB SUITE","SUITE","TEST CLASS","TEST METHOD"
"Test cases for TestResources_ListADGPOAffectedContainers","0","TestResources_ListADGPOAffectedContainers","","Sat Jan 10 01:11:31 UTC 2026","passed","Sat Jan 10 01:11:31 UTC 2026","","Go Test","github.com/specterops/bloodhound/cmd/api/src/api/v2/TestResources_ListADGPOAffectedContainers","TestResources_ListADGPOAffectedContainers"
"","311","navigates to rule details when clicking a rule row","RulesAccordion","Sat Jan 10 01:23:00 UTC 2026","passed","Sat Jan 10 01:23:00 UTC 2026","","","",""
"Test cases for TestDefineSID","0","TestDefineSID","","Sat Jan 10 01:11:46 UTC 2026","passed","Sat Jan 10 01:11:46 UTC 2026","","Go Test","github.com/specterops/bloodhound/packages/go/analysis/ad/wellknown/TestDefineSID","TestDefineSID"
"Test cases for TestInt64IsZero","0","TestInt64IsZero","","Sat Jan 10 01:11:36 UTC 2026","passed","Sat Jan 10 01:11:36 UTC 2026","","Go Test","github.com/specterops/bloodhound/cmd/api/src/database/types/null/TestInt64IsZero","TestInt64IsZero"
"","0","properly displays bitwise integers","Formatting number properties","Sat Jan 10 01:21:31 UTC 2026","passed","Sat Jan 10 01:21:31 UTC 2026","","","",""
"","1472","Clicking header allows user to sort by column","ExploreTable","Sat Jan 10 01:20:19 UTC 2026","passed","Sat Jan 10 01:20:20 UTC 2026","","","",""
"","293","filling in the name value allows updating the selector and navigates back to the details page","Tag Form","Sat Jan 10 01:20:24 UTC 2026","passed","Sat Jan 10 01:20:24 UTC 2026","","","",""
"Test cases for TestResources_CreateAssetGroupTagSelector","5","TestResources_CreateAssetGroupTagSelector","","Sat Jan 10 01:11:31 UTC 2026","passed","Sat Jan 10 01:11:31 UTC 2026","","Go Test","github.com/specterops/bloodhound/cmd/api/src/api/v2/TestResources_CreateAssetGroupTagSelector","TestResources_CreateAssetGroupTagSelector"
"","134","has the correct value for the links in the breadcrumbs","Create Update pages","Sat Jan 10 01:23:44 UTC 2026","passed","Sat Jan 10 01:23:44 UTC 2026","","","",""
"Test cases for TestUnmarshalInt","1","TestUnmarshalInt","","Sat Jan 10 01:11:36 UTC 2026","passed","Sat Jan 10 01:11:36 UTC 2026","","Go Test","github.com/specterops/bloodhound/cmd/api/src/database/types/null/TestUnmarshalInt","TestUnmarshalInt"
"Test cases for TestResources_GetCollectorManifest","0","TestResources_GetCollectorManifest","","Sat Jan 10 01:11:31 UTC 2026","passed","Sat Jan 10 01:11:31 UTC 2026","","Go Test","github.com/specterops/bloodhound/cmd/api/src/api/v2/TestResources_GetCollectorManifest","TestResources_GetCollectorManifest"
"","167","renders the form for creating a new label","Tag Form","Sat Jan 10 01:20:23 UTC 2026","passed","Sat Jan 10 01:20:23 UTC 2026","","","",""
"","6","safely handles removing nonexistent key","useObjectState","Sat Jan 10 01:23:55 UTC 2026","passed","Sat Jan 10 01:23:55 UTC 2026","","","",""
"Test cases for TestManagementResource_UpdateUser_GetUserError","938","TestManagementResource_UpdateUser_GetUserError","","Sat Jan 10 01:11:48 UTC 2026","passed","Sat Jan 10 01:11:49 UTC 2026","","Go Test","github.com/specterops/bloodhound/cmd/api/src/api/v2/auth/TestManagementResource_UpdateUser_GetUserError","TestManagementResource_UpdateUser_GetUserError"
"Test cases for TestManagementResource_DeleteUser_UserBhCtxNotFound","0","TestManagementResource_DeleteUser_UserBhCtxNotFound","","Sat Jan 10 01:11:53 UTC 2026","passed","Sat Jan 10 01:11:53 UTC 2026","","Go Test","github.com/specterops/bloodhound/cmd/api/src/api/v2/auth/TestManagementResource_DeleteUser_UserBhCtxNotFound","TestManagementResource_DeleteUser_UserBhCtxNotFound"
"Test cases for TestWriteResultJson","0","TestWriteResultJson","","Sat Jan 10 01:11:44 UTC 2026","passed","Sat Jan 10 01:11:44 UTC 2026","","Go Test","github.com/specterops/bloodhound/cmd/api/src/utils/TestWriteResultJson","TestWriteResultJson"
"","0","returns false if value is 'array'","searchParams","Sat Jan 10 01:23:01 UTC 2026","passed","Sat Jan 10 01:23:01 UTC 2026","","isEmptyParam","",""
"","365","displays a Filters button","FileIngest","Sat Jan 10 01:23:40 UTC 2026","passed","Sat Jan 10 01:23:40 UTC 2026","","","",""
"","11","displays CaretUp icon when the sortOrder is asc","ColumnHeaders","Sat Jan 10 01:23:33 UTC 2026","passed","Sat Jan 10 01:23:33 UTC 2026","","SortableHeader","",""
"","317","renders with applied filters","Privilege Zones History Filter Dialog","Sat Jan 10 01:22:02 UTC 2026","passed","Sat Jan 10 01:22:02 UTC 2026","","","",""
"Test cases for TestResources_ListADEntityControllers","2","TestResources_ListADEntityControllers","","Sat Jan 10 01:11:31 UTC 2026","passed","Sat Jan 10 01:11:31 UTC 2026","","Go Test","github.com/specterops/bloodhound/cmd/api/src/api/v2/TestResources_ListADEntityControllers","TestResources_ListADEntityControllers"
"","78","Calls the `Base` endpoint for a LocalGroup type node","EntityObjectInformation","Sat Jan 10 01:22:31 UTC 2026","passed","Sat Jan 10 01:22:31 UTC 2026","","","",""
"Test cases for TestManagementResource_SSOLoginHandler","7","TestManagementResource_SSOLoginHandler","","Sat Jan 10 01:12:08 UTC 2026","passed","Sat Jan 10 01:12:08 UTC 2026","","Go Test","github.com/specterops/bloodhound/cmd/api/src/api/v2/auth/TestManagementResource_SSOLoginHandler","TestManagementResource_SSOLoginHandler"
"","77","should display the logged in user's role","UserProfile","Sat Jan 10 01:22:14 UTC 2026","passed","Sat Jan 10 01:22:14 UTC 2026","","","",""
"Test cases for TestCreateUser_Success","868","TestCreateUser_Success","","Sat Jan 10 01:11:38 UTC 2026","passed","Sat Jan 10 01:11:39 UTC 2026","","Go Test","github.com/specterops/bloodhound/cmd/api/src/api/v2/auth/TestCreateUser_Success","TestCreateUser_Success"
"","924","should call onSubmit with password when reset password button clicked","PasswordResetForm","Sat Jan 10 01:22:08 UTC 2026","passed","Sat Jan 10 01:22:09 UTC 2026","","","",""
"","201","disables checkboxes while loading","SourceKindsCheckboxes","Sat Jan 10 01:21:53 UTC 2026","passed","Sat Jan 10 01:21:53 UTC 2026","","","",""
"Test cases for TestBoolSetValid","0","TestBoolSetValid","","Sat Jan 10 01:11:36 UTC 2026","passed","Sat Jan 10 01:11:36 UTC 2026","","Go Test","github.com/specterops/bloodhound/cmd/api/src/database/types/null/TestBoolSetValid","TestBoolSetValid"
"","208","handles a selection as expected","DropdownSelector","Sat Jan 10 01:23:25 UTC 2026","passed","Sat Jan 10 01:23:25 UTC 2026","","","",""
"","312","should render a TagToZoneLabelDialog component","TagToZoneLabelDialog","Sat Jan 10 01:22:23 UTC 2026","passed","Sat Jan 10 01:22:23 UTC 2026","","","",""
"Test cases for Test_ParseGraphSortParameters_Success","0","Test_ParseGraphSortParameters_Success","","Sat Jan 10 01:11:23 UTC 2026","passed","Sat Jan 10 01:11:23 UTC 2026","","Go Test","github.com/specterops/bloodhound/cmd/api/src/api/Test_ParseGraphSortParameters_Success","Test_ParseGraphSortParameters_Success"
"Test cases for Test_filterNodesToSearchResult_default","0","Test_filterNodesToSearchResult_default","","Sat Jan 10 01:11:38 UTC 2026","passed","Sat Jan 10 01:11:38 UTC 2026","","Go Test","github.com/specterops/bloodhound/cmd/api/src/queries/Test_filterNodesToSearchResult_default","Test_filterNodesToSearchResult_default"
"","937","opens a submenu when user hovers over `Copy`","ContextMenu","Sat Jan 10 01:21:11 UTC 2026","passed","Sat Jan 10 01:21:12 UTC 2026","","","",""
"Test cases for TestResources_UpdateAssetGroupSelectors_PayloadError","0","TestResources_UpdateAssetGroupSelectors_PayloadError","","Sat Jan 10 01:11:31 UTC 2026","passed","Sat Jan 10 01:11:31 UTC 2026","","Go Test","github.com/specterops/bloodhound/cmd/api/src/api/v2/TestResources_UpdateAssetGroupSelectors_PayloadError","TestResources_UpdateAssetGroupSelectors_PayloadError"
"","743","should call onSubmit with email address and password when login button clicked","LoginForm","Sat Jan 10 01:23:52 UTC 2026","passed","Sat Jan 10 01:23:53 UTC 2026","","","",""
"Test cases for TestIsErrorResponse","0","TestIsErrorResponse","","Sat Jan 10 01:11:23 UTC 2026","passed","Sat Jan 10 01:11:23 UTC 2026","","Go Test","github.com/specterops/bloodhound/cmd/api/src/api/TestIsErrorResponse","TestIsErrorResponse"
"","24","tag members refetches on sort change","the useAssetGroupTags utilities","Sat Jan 10 01:21:10 UTC 2026","passed","Sat Jan 10 01:21:10 UTC 2026","","","",""
"Test cases for TestOverwriteQueryParamIfHeaderAndParamExist","3","TestOverwriteQueryParamIfHeaderAndParamExist","","Sat Jan 10 01:11:45 UTC 2026","passed","Sat Jan 10 01:11:45 UTC 2026","","Go Test","github.com/specterops/bloodhound/cmd/api/src/utils/test/TestOverwriteQueryParamIfHeaderAndParamExist","TestOverwriteQueryParamIfHeaderAndParamExist"
"","8","does not render highlight for non-active tag","SelectedHighlight","Sat Jan 10 01:23:37 UTC 2026","passed","Sat Jan 10 01:23:37 UTC 2026","","","",""
"","52","adds a notification - checks values","AppNotifications","Sat Jan 10 01:23:17 UTC 2026","passed","Sat Jan 10 01:23:17 UTC 2026","","","",""
"","262","renders an empty message for the entity panel before a node is selected","GroupManagement","Sat Jan 10 01:25:17 UTC 2026","passed","Sat Jan 10 01:25:18 UTC 2026","","","",""
"Test cases for TestManagementResource_ListPermissions_DBError","0","TestManagementResource_ListPermissions_DBError","","Sat Jan 10 01:11:38 UTC 2026","passed","Sat Jan 10 01:11:38 UTC 2026","","Go Test","github.com/specterops/bloodhound/cmd/api/src/api/v2/auth/TestManagementResource_ListPermissions_DBError","TestManagementResource_ListPermissions_DBError"
"","278","sets a secondary=id and searchType=pathfinding when primary is truethy","ContextMenu","Sat Jan 10 01:21:11 UTC 2026","passed","Sat Jan 10 01:21:11 UTC 2026","","","",""
"Test cases for TestResources_GetGPOEntityInfo","2","TestResources_GetGPOEntityInfo","","Sat Jan 10 01:11:31 UTC 2026","passed","Sat Jan 10 01:11:31 UTC 2026","","Go Test","github.com/specterops/bloodhound/cmd/api/src/api/v2/TestResources_GetGPOEntityInfo","TestResources_GetGPOEntityInfo"
"Test cases for TestParseOptionalBoolMisspelledValue","0","TestParseOptionalBoolMisspelledValue","","Sat Jan 10 01:11:23 UTC 2026","passed","Sat Jan 10 01:11:23 UTC 2026","","Go Test","github.com/specterops/bloodhound/cmd/api/src/api/TestParseOptionalBoolMisspelledValue","TestParseOptionalBoolMisspelledValue"
"Test cases for TestBoolIsZero","0","TestBoolIsZero","","Sat Jan 10 01:11:36 UTC 2026","passed","Sat Jan 10 01:11:36 UTC 2026","","Go Test","github.com/specterops/bloodhound/cmd/api/src/database/types/null/TestBoolIsZero","TestBoolIsZero"
"","0","fails for password shorter than 12 characters","testPassword","Sat Jan 10 01:24:29 UTC 2026","passed","Sat Jan 10 01:24:29 UTC 2026","","","",""
"Test cases for TestLoginResource_Logout","6","TestLoginResource_Logout","","Sat Jan 10 01:12:08 UTC 2026","passed","Sat Jan 10 01:12:08 UTC 2026","","Go Test","github.com/specterops/bloodhound/cmd/api/src/api/v2/auth/TestLoginResource_Logout","TestLoginResource_Logout"
"Test cases for TestDetectBOMEncoding","0","TestDetectBOMEncoding","","Sat Jan 10 01:11:47 UTC 2026","passed","Sat Jan 10 01:11:47 UTC 2026","","Go Test","github.com/specterops/bloodhound/packages/go/bomenc/TestDetectBOMEncoding","TestDetectBOMEncoding"
"","0","A type was provided but no keyword follows the typed filter","Getting the text for the disabled item display for a search when there are no results","Sat Jan 10 01:22:29 UTC 2026","passed","Sat Jan 10 01:22:29 UTC 2026","","Empty data states","",""
"","297","should not render list items for domains that are not collected","Context Selector","Sat Jan 10 01:20:39 UTC 2026","passed","Sat Jan 10 01:20:40 UTC 2026","","","",""
"","29","is disabled if no filters are active","AssetGroupEdit","Sat Jan 10 01:21:19 UTC 2026","passed","Sat Jan 10 01:21:19 UTC 2026","","Clear Filters button","",""
"Test cases for TestTypes_Scan_InvalidInput","1","TestTypes_Scan_InvalidInput","","Sat Jan 10 01:11:36 UTC 2026","passed","Sat Jan 10 01:11:36 UTC 2026","","Go Test","github.com/specterops/bloodhound/cmd/api/src/database/types/TestTypes_Scan_InvalidInput","TestTypes_Scan_InvalidInput"
"","305","renders total rules and accordion sections","RulesAccordion","Sat Jan 10 01:22:59 UTC 2026","passed","Sat Jan 10 01:22:59 UTC 2026","","","",""
"Test cases for TestResources_SearchHandler","0","TestResources_SearchHandler","","Sat Jan 10 01:11:31 UTC 2026","passed","Sat Jan 10 01:11:31 UTC 2026","","Go Test","github.com/specterops/bloodhound/cmd/api/src/api/v2/TestResources_SearchHandler","TestResources_SearchHandler"
"","181","a name value is required to submit the form","Tag Form","Sat Jan 10 01:20:24 UTC 2026","passed","Sat Jan 10 01:20:24 UTC 2026","","","",""
"","209","Expand button causes table to expand to full height","ExploreTable","Sat Jan 10 01:20:20 UTC 2026","passed","Sat Jan 10 01:20:21 UTC 2026","","","",""
"Test cases for TestManagementResource_UpdateUser_DuplicateEmailError","0","TestManagementResource_UpdateUser_DuplicateEmailError","","Sat Jan 10 01:11:50 UTC 2026","passed","Sat Jan 10 01:11:50 UTC 2026","","Go Test","github.com/specterops/bloodhound/cmd/api/src/api/v2/auth/TestManagementResource_UpdateUser_DuplicateEmailError","TestManagementResource_UpdateUser_DuplicateEmailError"
"Test cases for TestResources_ListADGroupSessions","1","TestResources_ListADGroupSessions","","Sat Jan 10 01:11:31 UTC 2026","passed","Sat Jan 10 01:11:31 UTC 2026","","Go Test","github.com/specterops/bloodhound/cmd/api/src/api/v2/TestResources_ListADGroupSessions","TestResources_ListADGroupSessions"
"Test cases for TestDisenrollMFA_Admin_FailureIncorrectPassword","2230","TestDisenrollMFA_Admin_FailureIncorrectPassword","","Sat Jan 10 01:12:04 UTC 2026","passed","Sat Jan 10 01:12:07 UTC 2026","","Go Test","github.com/specterops/bloodhound/cmd/api/src/api/v2/auth/TestDisenrollMFA_Admin_FailureIncorrectPassword","TestDisenrollMFA_Admin_FailureIncorrectPassword"
"Test cases for TestTimeEqual","0","TestTimeEqual","","Sat Jan 10 01:11:36 UTC 2026","passed","Sat Jan 10 01:11:36 UTC 2026","","Go Test","github.com/specterops/bloodhound/cmd/api/src/database/types/null/TestTimeEqual","TestTimeEqual"
"","51","calls openSAMLProviderDialog when create provider button is clicked","CreateMenu","Sat Jan 10 01:21:24 UTC 2026","passed","Sat Jan 10 01:21:24 UTC 2026","","oidc_support feature flag disabled","",""
"Test cases for TestUpdateAssetGroupRequest_AuditData","0","TestUpdateAssetGroupRequest_AuditData","","Sat Jan 10 01:11:31 UTC 2026","passed","Sat Jan 10 01:11:31 UTC 2026","","Go Test","github.com/specterops/bloodhound/cmd/api/src/api/v2/TestUpdateAssetGroupRequest_AuditData","TestUpdateAssetGroupRequest_AuditData"
"","135","does not trigger search for fewer than 3 characters","SearchBar","Sat Jan 10 01:24:26 UTC 2026","passed","Sat Jan 10 01:24:26 UTC 2026","","","",""
"","519","clears the applied filter","FileIngestFilterDialog","Sat Jan 10 01:21:03 UTC 2026","passed","Sat Jan 10 01:21:04 UTC 2026","","Status Select","",""
"","6","renders the LabelSelector when available and on a Label page","TagSelector","Sat Jan 10 01:22:41 UTC 2026","passed","Sat Jan 10 01:22:41 UTC 2026","","","",""
"Test cases for TestResources_DeleteSavedQuery_NotPublicQueryAndUserIsAdmin","0","TestResources_DeleteSavedQuery_NotPublicQueryAndUserIsAdmin","","Sat Jan 10 01:11:31 UTC 2026","passed","Sat Jan 10 01:11:31 UTC 2026","","Go Test","github.com/specterops/bloodhound/cmd/api/src/api/v2/TestResources_DeleteSavedQuery_NotPublicQueryAndUserIsAdmin","TestResources_DeleteSavedQuery_NotPublicQueryAndUserIsAdmin"
"","1071","filling in the name value allows updating the rule and navigates back to the details page","Rule Form","Sat Jan 10 01:20:42 UTC 2026","passed","Sat Jan 10 01:20:43 UTC 2026","","","",""
"","20","the ID value reflects the URL when it is available","usePZQueryParams","Sat Jan 10 01:22:35 UTC 2026","passed","Sat Jan 10 01:22:35 UTC 2026","","","",""
"","4","uses sequentialLayout by default","Explore utils","Sat Jan 10 01:25:10 UTC 2026","passed","Sat Jan 10 01:25:10 UTC 2026","","initGraph","",""
"","1279","should display all available SSO providers","UpdateUserDialog","Sat Jan 10 01:20:54 UTC 2026","passed","Sat Jan 10 01:20:55 UTC 2026","","","",""
"Test cases for TestResources_ImportSavedQuery","9","TestResources_ImportSavedQuery","","Sat Jan 10 01:11:31 UTC 2026","passed","Sat Jan 10 01:11:31 UTC 2026","","Go Test","github.com/specterops/bloodhound/cmd/api/src/api/v2/TestResources_ImportSavedQuery","TestResources_ImportSavedQuery"
"","30","renders a button","CreateMenu","Sat Jan 10 01:21:24 UTC 2026","passed","Sat Jan 10 01:21:24 UTC 2026","","oidc_support feature flag disabled","",""
"Test cases for TestResources_UpdateSavedQuery_GetSavedQueryError","0","TestResources_UpdateSavedQuery_GetSavedQueryError","","Sat Jan 10 01:11:31 UTC 2026","passed","Sat Jan 10 01:11:31 UTC 2026","","Go Test","github.com/specterops/bloodhound/cmd/api/src/api/v2/TestResources_UpdateSavedQuery_GetSavedQueryError","TestResources_UpdateSavedQuery_GetSavedQueryError"
"Test cases for TestManagementResource_DeleteUser_Success","740","TestManagementResource_DeleteUser_Success","","Sat Jan 10 01:11:55 UTC 2026","passed","Sat Jan 10 01:11:55 UTC 2026","","Go Test","github.com/specterops/bloodhound/cmd/api/src/api/v2/auth/TestManagementResource_DeleteUser_Success","TestManagementResource_DeleteUser_Success"
"Test cases for TestRequestWaitDuration_Failure","0","TestRequestWaitDuration_Failure","","Sat Jan 10 01:11:24 UTC 2026","passed","Sat Jan 10 01:11:24 UTC 2026","","Go Test","github.com/specterops/bloodhound/cmd/api/src/api/middleware/TestRequestWaitDuration_Failure","TestRequestWaitDuration_Failure"
"","273","fires click handlers","ConfirmDeleteQueryDialog","Sat Jan 10 01:24:22 UTC 2026","passed","Sat Jan 10 01:24:22 UTC 2026","","","",""
"Test cases for TestTimeScanValue","0","TestTimeScanValue","","Sat Jan 10 01:11:36 UTC 2026","passed","Sat Jan 10 01:11:36 UTC 2026","","Go Test","github.com/specterops/bloodhound/cmd/api/src/database/types/null/TestTimeScanValue","TestTimeScanValue"
"","110","renders enabled Label, Rule and Object tabs","Selected Details Tabs","Sat Jan 10 01:21:42 UTC 2026","passed","Sat Jan 10 01:21:42 UTC 2026","","Selected Details Tabs - Params present","",""
"Test cases for TestWriteErrorResponse_V2","0","TestWriteErrorResponse_V2","","Sat Jan 10 01:11:23 UTC 2026","passed","Sat Jan 10 01:11:23 UTC 2026","","Go Test","github.com/specterops/bloodhound/cmd/api/src/api/TestWriteErrorResponse_V2","TestWriteErrorResponse_V2"
"Test cases for TestResources_ListSavedQueries","24","TestResources_ListSavedQueries","","Sat Jan 10 01:11:31 UTC 2026","passed","Sat Jan 10 01:11:31 UTC 2026","","Go Test","github.com/specterops/bloodhound/cmd/api/src/api/v2/TestResources_ListSavedQueries","TestResources_ListSavedQueries"
"","1","determines glyphs with the tier_managent_engine feature flag enabled","getNodeGlyphs","Sat Jan 10 01:25:10 UTC 2026","passed","Sat Jan 10 01:25:10 UTC 2026","","","",""
"Test cases for TestBoolPointer","0","TestBoolPointer","","Sat Jan 10 01:11:36 UTC 2026","passed","Sat Jan 10 01:11:36 UTC 2026","","Go Test","github.com/specterops/bloodhound/cmd/api/src/database/types/null/TestBoolPointer","TestBoolPointer"
"","705","displays a Upload Files button","FileIngest","Sat Jan 10 01:23:39 UTC 2026","passed","Sat Jan 10 01:23:40 UTC 2026","","","",""
"Test cases for TestBoolFrom","0","TestBoolFrom","","Sat Jan 10 01:11:36 UTC 2026","passed","Sat Jan 10 01:11:36 UTC 2026","","Go Test","github.com/specterops/bloodhound/cmd/api/src/database/types/null/TestBoolFrom","TestBoolFrom"
"Test cases for TestCache_FillFifo","0","TestCache_FillFifo","","Sat Jan 10 01:11:47 UTC 2026","passed","Sat Jan 10 01:11:47 UTC 2026","","Go Test","github.com/specterops/bloodhound/packages/go/cache/TestCache_FillFifo","TestCache_FillFifo"
"","2","returns numbers as strings","numberFormatting","Sat Jan 10 01:24:17 UTC 2026","passed","Sat Jan 10 01:24:17 UTC 2026","","","",""
"","273","should render","Rule Object Select","Sat Jan 10 01:23:14 UTC 2026","passed","Sat Jan 10 01:23:14 UTC 2026","","","",""
"","6","applies animation class to the title","ProcessingIndicator","Sat Jan 10 01:24:31 UTC 2026","passed","Sat Jan 10 01:24:31 UTC 2026","","","",""
"","265","toggles sort order when clicking sortable header","ObjectsAccordion","Sat Jan 10 01:22:27 UTC 2026","passed","Sat Jan 10 01:22:27 UTC 2026","","","",""
"","310","should render an SavedQueryPermissions component","SaveQueryDialog","Sat Jan 10 01:20:25 UTC 2026","passed","Sat Jan 10 01:20:25 UTC 2026","","","",""
"Test cases for TestNodeNamePrefix_String","1","TestNodeNamePrefix_String","","Sat Jan 10 01:11:46 UTC 2026","passed","Sat Jan 10 01:11:46 UTC 2026","","Go Test","github.com/specterops/bloodhound/packages/go/analysis/ad/wellknown/TestNodeNamePrefix_String","TestNodeNamePrefix_String"
"Test cases for TestUnmarshalNonIntegerNumberToInt64","0","TestUnmarshalNonIntegerNumberToInt64","","Sat Jan 10 01:11:36 UTC 2026","passed","Sat Jan 10 01:11:36 UTC 2026","","Go Test","github.com/specterops/bloodhound/cmd/api/src/database/types/null/TestUnmarshalNonIntegerNumberToInt64","TestUnmarshalNonIntegerNumberToInt64"
"","0","returns paramValue as EnvironmentAggregation if paramValue is azure","useEnvironmentParams","Sat Jan 10 01:24:28 UTC 2026","passed","Sat Jan 10 01:24:28 UTC 2026","","parseEnvironmentAggregation","",""
"","152","should fire Cancel once with false","ConfirmationDialog","Sat Jan 10 01:24:18 UTC 2026","passed","Sat Jan 10 01:24:18 UTC 2026","","","",""
"Test cases for TestMarshalBoolText","0","TestMarshalBoolText","","Sat Jan 10 01:11:36 UTC 2026","passed","Sat Jan 10 01:11:36 UTC 2026","","Go Test","github.com/specterops/bloodhound/cmd/api/src/database/types/null/TestMarshalBoolText","TestMarshalBoolText"
"Test cases for TestValidateTOTPSecret","0","TestValidateTOTPSecret","","Sat Jan 10 01:11:31 UTC 2026","passed","Sat Jan 10 01:11:31 UTC 2026","","Go Test","github.com/specterops/bloodhound/cmd/api/src/auth/TestValidateTOTPSecret","TestValidateTOTPSecret"
"","602","should not allow leading or trailing empty spaces","CreateUserForm","Sat Jan 10 01:20:54 UTC 2026","passed","Sat Jan 10 01:20:55 UTC 2026","","","",""
"Test cases for TestResources_DeleteSavedQuery_PublicQueryAndUserIsAdmin","0","TestResources_DeleteSavedQuery_PublicQueryAndUserIsAdmin","","Sat Jan 10 01:11:31 UTC 2026","passed","Sat Jan 10 01:11:31 UTC 2026","","Go Test","github.com/specterops/bloodhound/cmd/api/src/api/v2/TestResources_DeleteSavedQuery_PublicQueryAndUserIsAdmin","TestResources_DeleteSavedQuery_PublicQueryAndUserIsAdmin"
"","317","renders a preview version","Cypher Search component for Zone Management","Sat Jan 10 01:22:43 UTC 2026","passed","Sat Jan 10 01:22:44 UTC 2026","","","",""
"","161","fires editQuery in context provider","ListItemActionMenu","Sat Jan 10 01:23:01 UTC 2026","passed","Sat Jan 10 01:23:02 UTC 2026","","","",""
"Test cases for TestGraphQuery_RawCypherQuery","7","TestGraphQuery_RawCypherQuery","","Sat Jan 10 01:11:38 UTC 2026","passed","Sat Jan 10 01:11:38 UTC 2026","","Go Test","github.com/specterops/bloodhound/cmd/api/src/queries/TestGraphQuery_RawCypherQuery","TestGraphQuery_RawCypherQuery"
"","84","updates value when an invalid date typed","ManagedDatePicker - value","Sat Jan 10 01:22:19 UTC 2026","passed","Sat Jan 10 01:22:19 UTC 2026","","","",""
"","67","should render a label and version number when expanded","MainNav","Sat Jan 10 01:21:05 UTC 2026","passed","Sat Jan 10 01:21:05 UTC 2026","","","",""
"","5878","filter selections are rolled back if user closes modal with the cancel button","EdgeFilter","Sat Jan 10 01:22:19 UTC 2026","passed","Sat Jan 10 01:22:25 UTC 2026","","","",""
"Test cases for TestGetOrderForNeo4jQuery","0","TestGetOrderForNeo4jQuery","","Sat Jan 10 01:11:44 UTC 2026","passed","Sat Jan 10 01:11:44 UTC 2026","","Go Test","github.com/specterops/bloodhound/cmd/api/src/utils/TestGetOrderForNeo4jQuery","TestGetOrderForNeo4jQuery"
"","0","fails for empty password","testPassword","Sat Jan 10 01:24:29 UTC 2026","passed","Sat Jan 10 01:24:29 UTC 2026","","","",""
"Test cases for TestPredefinedSIDSuffixes","0","TestPredefinedSIDSuffixes","","Sat Jan 10 01:11:46 UTC 2026","passed","Sat Jan 10 01:11:46 UTC 2026","","Go Test","github.com/specterops/bloodhound/packages/go/analysis/ad/wellknown/TestPredefinedSIDSuffixes","TestPredefinedSIDSuffixes"
"","658","should display all available roles","CreateUserDialog","Sat Jan 10 01:20:52 UTC 2026","passed","Sat Jan 10 01:20:53 UTC 2026","","","",""
"Test cases for TestManagementResource_SanitizeAndGetRoles","0","TestManagementResource_SanitizeAndGetRoles","","Sat Jan 10 01:12:08 UTC 2026","passed","Sat Jan 10 01:12:08 UTC 2026","","Go Test","github.com/specterops/bloodhound/cmd/api/src/api/v2/auth/TestManagementResource_SanitizeAndGetRoles","TestManagementResource_SanitizeAndGetRoles"
"","2","succeeds for valid password","testPassword","Sat Jan 10 01:24:29 UTC 2026","passed","Sat Jan 10 01:24:29 UTC 2026","","","",""
"","255","Displays a notification when analysis has been requested successfully","AnalyzeNowConfiguration","Sat Jan 10 01:21:35 UTC 2026","passed","Sat Jan 10 01:21:36 UTC 2026","","","",""
"Test cases for TestBuildErrorResponseUnauthorized","0","TestBuildErrorResponseUnauthorized","","Sat Jan 10 01:11:23 UTC 2026","passed","Sat Jan 10 01:11:23 UTC 2026","","Go Test","github.com/specterops/bloodhound/cmd/api/src/api/TestBuildErrorResponseUnauthorized","TestBuildErrorResponseUnauthorized"
