"DESCRIPTION","DURATION IN MS","NAME","PARENT SUITE","START TIME","STATUS","STOP TIME","SUB SUITE","SUITE","TEST CLASS","TEST METHOD"
"","166","calls exportToJson util when valid non a empty object is passed as the jsonData prop","GraphControls","Sat Jan 10 01:21:03 UTC 2026","passed","Sat Jan 10 01:21:03 UTC 2026","","Exporting json","",""
"","9","returns early if there are no 'collected' environments","useInitialEnvironment","Sat Jan 10 01:23:21 UTC 2026","passed","Sat Jan 10 01:23:21 UTC 2026","","","",""
"","13","renders an error fallback when flag is not found","FeatureFlag","Sat Jan 10 01:23:23 UTC 2026","passed","Sat Jan 10 01:23:23 UTC 2026","","","",""
"","84","renders the analysis toggle when multi tier analysis enabled is true and when editing an existing zone","Tag Form","Sat Jan 10 01:20:23 UTC 2026","passed","Sat Jan 10 01:20:23 UTC 2026","","","",""
"Test cases for TestResources_ListADOUContainedComputers","1","TestResources_ListADOUContainedComputers","","Sat Jan 10 01:11:31 UTC 2026","passed","Sat Jan 10 01:11:31 UTC 2026","","Go Test","github.com/specterops/bloodhound/cmd/api/src/api/v2/TestResources_ListADOUContainedComputers","TestResources_ListADOUContainedComputers"
"Test cases for Test_UseFixture","0","Test_UseFixture","","Sat Jan 10 01:11:48 UTC 2026","passed","Sat Jan 10 01:11:48 UTC 2026","","Go Test","github.com/specterops/bloodhound/packages/go/lab/Test_UseFixture","Test_UseFixture"
"Test cases for TestTextUnmarshalInt64","0","TestTextUnmarshalInt64","","Sat Jan 10 01:11:36 UTC 2026","passed","Sat Jan 10 01:11:36 UTC 2026","","Go Test","github.com/specterops/bloodhound/cmd/api/src/database/types/null/TestTextUnmarshalInt64","TestTextUnmarshalInt64"
"","59","composes search params from the search prop and use them in the link","AppLink","Sat Jan 10 01:22:41 UTC 2026","passed","Sat Jan 10 01:22:41 UTC 2026","","","",""
"","0","Input does not contain a type","Parsing the debounced input for type and keyword values","Sat Jan 10 01:22:29 UTC 2026","passed","Sat Jan 10 01:22:29 UTC 2026","","","",""
"Test cases for TestJSONFloat_MarshalJSON_NaN","0","TestJSONFloat_MarshalJSON_NaN","","Sat Jan 10 01:11:36 UTC 2026","passed","Sat Jan 10 01:11:36 UTC 2026","","Go Test","github.com/specterops/bloodhound/cmd/api/src/database/types/nan/TestJSONFloat_MarshalJSON_NaN","TestJSONFloat_MarshalJSON_NaN"
"","268","prevents a user from proceeding if the file is not valid","ImportQueryDialog","Sat Jan 10 01:24:21 UTC 2026","passed","Sat Jan 10 01:24:21 UTC 2026","","","",""
"","1378","should render with a full list of multiple tenants and domains","Simple Environment Selector","Sat Jan 10 01:20:37 UTC 2026","passed","Sat Jan 10 01:20:39 UTC 2026","","","",""
"","5","does not return when label limit is not reached","useTagLimits","Sat Jan 10 01:20:49 UTC 2026","passed","Sat Jan 10 01:20:49 UTC 2026","","","",""
"","23","dedupes edges before adding them to the graph","Explore utils","Sat Jan 10 01:25:10 UTC 2026","passed","Sat Jan 10 01:25:10 UTC 2026","","initGraph","",""
"Test cases for TestResources_GetOUEntityInfo","1","TestResources_GetOUEntityInfo","","Sat Jan 10 01:11:31 UTC 2026","passed","Sat Jan 10 01:11:31 UTC 2026","","Go Test","github.com/specterops/bloodhound/cmd/api/src/api/v2/TestResources_GetOUEntityInfo","TestResources_GetOUEntityInfo"
"Test cases for TestMatches_FailureErrMsg","0","TestMatches_FailureErrMsg","","Sat Jan 10 01:11:37 UTC 2026","passed","Sat Jan 10 01:11:37 UTC 2026","","Go Test","github.com/specterops/bloodhound/cmd/api/src/model/TestMatches_FailureErrMsg","TestMatches_FailureErrMsg"
"Test cases for TestWriteResultRawJson","1","TestWriteResultRawJson","","Sat Jan 10 01:11:44 UTC 2026","passed","Sat Jan 10 01:11:44 UTC 2026","","Go Test","github.com/specterops/bloodhound/cmd/api/src/utils/TestWriteResultRawJson","TestWriteResultRawJson"
"Test cases for TestReadRFC3339","0","TestReadRFC3339","","Sat Jan 10 01:11:44 UTC 2026","passed","Sat Jan 10 01:11:44 UTC 2026","","Go Test","github.com/specterops/bloodhound/cmd/api/src/utils/TestReadRFC3339","TestReadRFC3339"
"","2","should recognize azure properties","validating a node property against the shared generated schema","Sat Jan 10 01:21:31 UTC 2026","passed","Sat Jan 10 01:21:31 UTC 2026","","","",""
"Test cases for TestArgon2Digest_String","0","TestArgon2Digest_String","","Sat Jan 10 01:11:47 UTC 2026","passed","Sat Jan 10 01:11:47 UTC 2026","","Go Test","github.com/specterops/bloodhound/packages/go/crypto/TestArgon2Digest_String","TestArgon2Digest_String"
"Test cases for TestMarshalBool","0","TestMarshalBool","","Sat Jan 10 01:11:36 UTC 2026","passed","Sat Jan 10 01:11:36 UTC 2026","","Go Test","github.com/specterops/bloodhound/cmd/api/src/database/types/null/TestMarshalBool","TestMarshalBool"
"","124","should display the ""My Profile"" title","UserProfile","Sat Jan 10 01:22:14 UTC 2026","passed","Sat Jan 10 01:22:14 UTC 2026","","","",""
"Test cases for TestDisenrollMFA_Admin_Success","2230","TestDisenrollMFA_Admin_Success","","Sat Jan 10 01:12:01 UTC 2026","passed","Sat Jan 10 01:12:04 UTC 2026","","Go Test","github.com/specterops/bloodhound/cmd/api/src/api/v2/auth/TestDisenrollMFA_Admin_Success","TestDisenrollMFA_Admin_Success"
"","322","should render with the correct content","ConfirmUpdateQueryDialog","Sat Jan 10 01:24:08 UTC 2026","passed","Sat Jan 10 01:24:09 UTC 2026","","","",""
"Test cases for TestTextUnmarshalString","0","TestTextUnmarshalString","","Sat Jan 10 01:11:36 UTC 2026","passed","Sat Jan 10 01:11:36 UTC 2026","","Go Test","github.com/specterops/bloodhound/cmd/api/src/database/types/null/TestTextUnmarshalString","TestTextUnmarshalString"
"Test cases for Test_hasCycle","1","Test_hasCycle","","Sat Jan 10 01:11:48 UTC 2026","passed","Sat Jan 10 01:11:48 UTC 2026","","Go Test","github.com/specterops/bloodhound/packages/go/lab/Test_hasCycle","Test_hasCycle"
"Test cases for TestQueries_GetEntityResults","1","TestQueries_GetEntityResults","","Sat Jan 10 01:11:38 UTC 2026","passed","Sat Jan 10 01:11:38 UTC 2026","","Go Test","github.com/specterops/bloodhound/cmd/api/src/queries/TestQueries_GetEntityResults","TestQueries_GetEntityResults"
"Test cases for TestFilter","0","TestFilter","","Sat Jan 10 01:11:49 UTC 2026","passed","Sat Jan 10 01:11:49 UTC 2026","","Go Test","github.com/specterops/bloodhound/packages/go/slicesext/TestFilter","TestFilter"
"","2491","when user performs a pathfinding search, the swap button is disabled until both the start and destination nodes are provided","Pathfinding: interaction","Sat Jan 10 01:21:46 UTC 2026","passed","Sat Jan 10 01:21:49 UTC 2026","","","",""
"","1","floors DateTime objects to the nearest minute","floorToNearestMinute","Sat Jan 10 01:23:49 UTC 2026","passed","Sat Jan 10 01:23:49 UTC 2026","","","",""
"Test cases for TestManagementResource_UpdateUser_LookupActiveSessionsError","744","TestManagementResource_UpdateUser_LookupActiveSessionsError","","Sat Jan 10 01:11:52 UTC 2026","passed","Sat Jan 10 01:11:52 UTC 2026","","Go Test","github.com/specterops/bloodhound/cmd/api/src/api/v2/auth/TestManagementResource_UpdateUser_LookupActiveSessionsError","TestManagementResource_UpdateUser_LookupActiveSessionsError"
"","0","returns paramValue as EnvironmentAggregation if paramValue is active-directory","useEnvironmentParams","Sat Jan 10 01:24:28 UTC 2026","passed","Sat Jan 10 01:24:28 UTC 2026","","parseEnvironmentAggregation","",""
"","386","clears the applied filter","FileIngestFilterDialog","Sat Jan 10 01:21:06 UTC 2026","passed","Sat Jan 10 01:21:06 UTC 2026","","User Select","",""
"","0","returns null if paramValue is null","useEnvironmentParams","Sat Jan 10 01:24:28 UTC 2026","passed","Sat Jan 10 01:24:28 UTC 2026","","parseEnvironmentAggregation","",""
"","23","selector members refetches on envrionment change","the useAssetGroupTags utilities","Sat Jan 10 01:21:10 UTC 2026","passed","Sat Jan 10 01:21:10 UTC 2026","","","",""
"","182","fires runQuery in context provider","ListItemActionMenu","Sat Jan 10 01:23:01 UTC 2026","passed","Sat Jan 10 01:23:01 UTC 2026","","","",""
"Test cases for TestCreateUser_Failure","1","TestCreateUser_Failure","","Sat Jan 10 01:11:38 UTC 2026","passed","Sat Jan 10 01:11:38 UTC 2026","","Go Test","github.com/specterops/bloodhound/cmd/api/src/api/v2/auth/TestCreateUser_Failure","TestCreateUser_Failure"
"Test cases for TestToolContainer_GetScheduledAnalysisConfiguration_Errors","0","TestToolContainer_GetScheduledAnalysisConfiguration_Errors","","Sat Jan 10 01:11:27 UTC 2026","passed","Sat Jan 10 01:11:27 UTC 2026","","Go Test","github.com/specterops/bloodhound/cmd/api/src/api/tools/TestToolContainer_GetScheduledAnalysisConfiguration_Errors","TestToolContainer_GetScheduledAnalysisConfiguration_Errors"
"","219","sets the calendar date to match the valid","ManagedDatePicker - value","Sat Jan 10 01:22:19 UTC 2026","passed","Sat Jan 10 01:22:19 UTC 2026","","","",""
"","15","upon performing a search, updates the url params with the base64-encoded current query and sets searchType to 'cypher'","useCypherSearch","Sat Jan 10 01:24:06 UTC 2026","passed","Sat Jan 10 01:24:06 UTC 2026","","","",""
"Test cases for TestIntValueOrZero","0","TestIntValueOrZero","","Sat Jan 10 01:11:36 UTC 2026","passed","Sat Jan 10 01:11:36 UTC 2026","","Go Test","github.com/specterops/bloodhound/cmd/api/src/database/types/null/TestIntValueOrZero","TestIntValueOrZero"
"Test cases for TestFoldr","0","TestFoldr","","Sat Jan 10 01:11:49 UTC 2026","passed","Sat Jan 10 01:11:49 UTC 2026","","Go Test","github.com/specterops/bloodhound/packages/go/slicesext/TestFoldr","TestFoldr"
"","370","should display a ""Change Password"" modal","UserProfile","Sat Jan 10 01:22:14 UTC 2026","passed","Sat Jan 10 01:22:15 UTC 2026","","""Reset Password"" button is clicked","",""
"","218","should render a nav element with logo, two lists, a version number and a powered by","MainNav","Sat Jan 10 01:21:05 UTC 2026","passed","Sat Jan 10 01:21:05 UTC 2026","","","",""
"","4","returns {enabled: false} if there is not a match on the switch statement","useExploreGraph","Sat Jan 10 01:21:57 UTC 2026","passed","Sat Jan 10 01:21:57 UTC 2026","","exploreGraphQueryFactory","",""
"","0","should return an object denoting that the property is not in the schema when it is unrecognized","validating a node property against the shared generated schema","Sat Jan 10 01:21:31 UTC 2026","passed","Sat Jan 10 01:21:31 UTC 2026","","","",""
"Test cases for TestResources_GetAssetGroupTagHistory","4","TestResources_GetAssetGroupTagHistory","","Sat Jan 10 01:11:31 UTC 2026","passed","Sat Jan 10 01:11:31 UTC 2026","","Go Test","github.com/specterops/bloodhound/cmd/api/src/api/v2/TestResources_GetAssetGroupTagHistory","TestResources_GetAssetGroupTagHistory"
"","1","reports an API error when the name for the rule is not unique","handleError","Sat Jan 10 01:23:03 UTC 2026","passed","Sat Jan 10 01:23:03 UTC 2026","","","",""
"Test cases for TestAddOrderByToNeo4jQuery_NoOrderByClause","0","TestAddOrderByToNeo4jQuery_NoOrderByClause","","Sat Jan 10 01:11:31 UTC 2026","passed","Sat Jan 10 01:11:31 UTC 2026","","Go Test","github.com/specterops/bloodhound/cmd/api/src/api/v2/TestAddOrderByToNeo4jQuery_NoOrderByClause","TestAddOrderByToNeo4jQuery_NoOrderByClause"
"Test cases for TestResources_DeleteSavedQuery_UserNotAdmin","0","TestResources_DeleteSavedQuery_UserNotAdmin","","Sat Jan 10 01:11:31 UTC 2026","passed","Sat Jan 10 01:11:31 UTC 2026","","Go Test","github.com/specterops/bloodhound/cmd/api/src/api/v2/TestResources_DeleteSavedQuery_UserNotAdmin","TestResources_DeleteSavedQuery_UserNotAdmin"
"","0","fails for password without uppercase letters","testPassword","Sat Jan 10 01:24:29 UTC 2026","passed","Sat Jan 10 01:24:29 UTC 2026","","","",""
"","59","shows an error notification if there is an error fetching","useFinishedJobs","Sat Jan 10 01:22:00 UTC 2026","passed","Sat Jan 10 01:22:00 UTC 2026","","","",""
"","2049","hides the password field and removes the requirement when logged in with SSO","Users","Sat Jan 10 01:21:46 UTC 2026","passed","Sat Jan 10 01:21:48 UTC 2026","","","",""
"Test cases for TestParseSkipQueryParameter","0","TestParseSkipQueryParameter","","Sat Jan 10 01:11:31 UTC 2026","passed","Sat Jan 10 01:11:31 UTC 2026","","Go Test","github.com/specterops/bloodhound/cmd/api/src/api/v2/TestParseSkipQueryParameter","TestParseSkipQueryParameter"
"","154","displays Force Password Reset checkbox when showNeedsPasswordReset is true","PasswordDialog","Sat Jan 10 01:20:41 UTC 2026","passed","Sat Jan 10 01:20:41 UTC 2026","","","",""
"","0","takes setSearchParams and availableParams returns a function","searchParams","Sat Jan 10 01:23:01 UTC 2026","passed","Sat Jan 10 01:23:01 UTC 2026","","setParamsFactory","",""
"Test cases for TestResources_ListADDomainForeignAdmins","4","TestResources_ListADDomainForeignAdmins","","Sat Jan 10 01:11:31 UTC 2026","passed","Sat Jan 10 01:11:31 UTC 2026","","Go Test","github.com/specterops/bloodhound/cmd/api/src/api/v2/TestResources_ListADDomainForeignAdmins","TestResources_ListADDomainForeignAdmins"
"Test cases for TestResources_GetDatabaseCompleteness","78","TestResources_GetDatabaseCompleteness","","Sat Jan 10 01:11:31 UTC 2026","passed","Sat Jan 10 01:11:31 UTC 2026","","Go Test","github.com/specterops/bloodhound/cmd/api/src/api/v2/TestResources_GetDatabaseCompleteness","TestResources_GetDatabaseCompleteness"
"Test cases for TestManagementResource_CreateOIDCProvider","0","TestManagementResource_CreateOIDCProvider","","Sat Jan 10 01:12:08 UTC 2026","passed","Sat Jan 10 01:12:08 UTC 2026","","Go Test","github.com/specterops/bloodhound/cmd/api/src/api/v2/auth/TestManagementResource_CreateOIDCProvider","TestManagementResource_CreateOIDCProvider"
"Test cases for TestDurationValidator","0","TestDurationValidator","","Sat Jan 10 01:11:45 UTC 2026","passed","Sat Jan 10 01:11:45 UTC 2026","","Go Test","github.com/specterops/bloodhound/cmd/api/src/utils/validation/TestDurationValidator","TestDurationValidator"
"","23","renders the title passed via title prop","ColumnHeaders","Sat Jan 10 01:23:33 UTC 2026","passed","Sat Jan 10 01:23:33 UTC 2026","","SortableHeader","",""
"","0","should return false when there is no match","OperationsFilterPlugin","Sat Jan 10 01:24:34 UTC 2026","passed","Sat Jan 10 01:24:34 UTC 2026","","","",""
"Test cases for TestResources_ListADDomainForeignGroups","2","TestResources_ListADDomainForeignGroups","","Sat Jan 10 01:11:31 UTC 2026","passed","Sat Jan 10 01:11:31 UTC 2026","","Go Test","github.com/specterops/bloodhound/cmd/api/src/api/v2/TestResources_ListADDomainForeignGroups","TestResources_ListADDomainForeignGroups"
"Test cases for TestParseClientVersion","0","TestParseClientVersion","","Sat Jan 10 01:11:44 UTC 2026","passed","Sat Jan 10 01:11:44 UTC 2026","","Go Test","github.com/specterops/bloodhound/cmd/api/src/utils/TestParseClientVersion","TestParseClientVersion"
"","1016","should disable save button while input is empty","SaveQueryDialog","Sat Jan 10 01:20:23 UTC 2026","passed","Sat Jan 10 01:20:24 UTC 2026","","","",""
"","476","navigates to object details when clicking an object row","ObjectsAccordion","Sat Jan 10 01:22:27 UTC 2026","passed","Sat Jan 10 01:22:27 UTC 2026","","","",""
"","162","calls onClick when toggle button clicked","EarlyAccessFeatureToggle","Sat Jan 10 01:25:32 UTC 2026","passed","Sat Jan 10 01:25:32 UTC 2026","","","",""
"","116","requests finished jobs","useFinishedJobs","Sat Jan 10 01:22:00 UTC 2026","passed","Sat Jan 10 01:22:00 UTC 2026","","","",""
"Test cases for TestUnmarshalBool","0","TestUnmarshalBool","","Sat Jan 10 01:11:36 UTC 2026","passed","Sat Jan 10 01:11:36 UTC 2026","","Go Test","github.com/specterops/bloodhound/cmd/api/src/database/types/null/TestUnmarshalBool","TestUnmarshalBool"
"","220","shows a table with finished jobs","FileIngestTable","Sat Jan 10 01:23:38 UTC 2026","passed","Sat Jan 10 01:23:38 UTC 2026","","","",""
"Test cases for TestResources_ListADComputerPSRemoteUsers","0","TestResources_ListADComputerPSRemoteUsers","","Sat Jan 10 01:11:31 UTC 2026","passed","Sat Jan 10 01:11:31 UTC 2026","","Go Test","github.com/specterops/bloodhound/cmd/api/src/api/v2/TestResources_ListADComputerPSRemoteUsers","TestResources_ListADComputerPSRemoteUsers"
"Test cases for TestResources_GetAssetGroupTagMemberInfo","0","TestResources_GetAssetGroupTagMemberInfo","","Sat Jan 10 01:11:31 UTC 2026","passed","Sat Jan 10 01:11:31 UTC 2026","","Go Test","github.com/specterops/bloodhound/cmd/api/src/api/v2/TestResources_GetAssetGroupTagMemberInfo","TestResources_GetAssetGroupTagMemberInfo"
"","6","does not request finished jobs if lacking permission","useFinishedJobs","Sat Jan 10 01:22:00 UTC 2026","passed","Sat Jan 10 01:22:00 UTC 2026","","","",""
"","0","returns true if arrays have same content in different order","areArraysSimilar","Sat Jan 10 01:24:10 UTC 2026","passed","Sat Jan 10 01:24:10 UTC 2026","","","",""
"Test cases for Test_NewSpecWithHooks","0","Test_NewSpecWithHooks","","Sat Jan 10 01:11:48 UTC 2026","passed","Sat Jan 10 01:11:48 UTC 2026","","Go Test","github.com/specterops/bloodhound/packages/go/lab/Test_NewSpecWithHooks","Test_NewSpecWithHooks"
"","435","should render list of available SSO providers","LoginViaSSOForm","Sat Jan 10 01:22:54 UTC 2026","passed","Sat Jan 10 01:22:55 UTC 2026","","","",""
"Test cases for TestGetPlatformAggregateStats_Success","1","TestGetPlatformAggregateStats_Success","","Sat Jan 10 01:11:31 UTC 2026","passed","Sat Jan 10 01:11:31 UTC 2026","","Go Test","github.com/specterops/bloodhound/cmd/api/src/api/v2/TestGetPlatformAggregateStats_Success","TestGetPlatformAggregateStats_Success"
"","747","renders an edit form for the selected asset group when a user has graph write permissions","GroupManagement","Sat Jan 10 01:25:16 UTC 2026","passed","Sat Jan 10 01:25:17 UTC 2026","","","",""
"","29","the queries in the list only include nodes and edges that are defined in our schema","common search list","Sat Jan 10 01:24:09 UTC 2026","passed","Sat Jan 10 01:24:09 UTC 2026","","","",""
"Test cases for TestEndNodes","0","TestEndNodes","","Sat Jan 10 01:11:46 UTC 2026","passed","Sat Jan 10 01:11:46 UTC 2026","","Go Test","github.com/specterops/bloodhound/packages/go/analysis/azure/TestEndNodes","TestEndNodes"
"Test cases for TestUnmarshalInt64","0","TestUnmarshalInt64","","Sat Jan 10 01:11:36 UTC 2026","passed","Sat Jan 10 01:11:36 UTC 2026","","Go Test","github.com/specterops/bloodhound/cmd/api/src/database/types/null/TestUnmarshalInt64","TestUnmarshalInt64"
"Test cases for TestManagementResource_ListAuthTokens_SortingError","0","TestManagementResource_ListAuthTokens_SortingError","","Sat Jan 10 01:11:58 UTC 2026","passed","Sat Jan 10 01:11:58 UTC 2026","","Go Test","github.com/specterops/bloodhound/cmd/api/src/api/v2/auth/TestManagementResource_ListAuthTokens_SortingError","TestManagementResource_ListAuthTokens_SortingError"
"Test cases for TestFloatFrom","0","TestFloatFrom","","Sat Jan 10 01:11:36 UTC 2026","passed","Sat Jan 10 01:11:36 UTC 2026","","Go Test","github.com/specterops/bloodhound/cmd/api/src/database/types/null/TestFloatFrom","TestFloatFrom"
"","134","renders an interactive version when preview is set to false","Cypher Search component for Zone Management","Sat Jan 10 01:22:44 UTC 2026","passed","Sat Jan 10 01:22:45 UTC 2026","","","",""
"","3","formats the date string","toFormatted","Sat Jan 10 01:23:49 UTC 2026","passed","Sat Jan 10 01:23:49 UTC 2026","","","",""
"","362","should render an SavedQueryPermissions component","SavedQueryPermissions","Sat Jan 10 01:22:50 UTC 2026","passed","Sat Jan 10 01:22:50 UTC 2026","","","",""
"","100","properly encodes + sign into the ""View in Explore"" link","Cypher Search component for Zone Management","Sat Jan 10 01:22:44 UTC 2026","passed","Sat Jan 10 01:22:44 UTC 2026","","","",""
"Test cases for TestWriteAndValidateJSON","6","TestWriteAndValidateJSON","","Sat Jan 10 01:11:42 UTC 2026","passed","Sat Jan 10 01:11:42 UTC 2026","","Go Test","github.com/specterops/bloodhound/cmd/api/src/services/upload/TestWriteAndValidateJSON","TestWriteAndValidateJSON"
"","12","should handle special characters","HighlightedText","Sat Jan 10 01:23:47 UTC 2026","passed","Sat Jan 10 01:23:47 UTC 2026","","","",""
"","1","returns undefined if paramValue is not an expected value","useExploreParams","Sat Jan 10 01:24:35 UTC 2026","passed","Sat Jan 10 01:24:35 UTC 2026","","parseSearchType","",""
"","1","returns a function that takes a key found in updatedParams and updates the searchParams with that matching value from updatedParams","searchParams","Sat Jan 10 01:23:01 UTC 2026","passed","Sat Jan 10 01:23:01 UTC 2026","","setSingleParamFactory","",""
"Test cases for TestManagementResource_ListRoles_InvalidColumn","0","TestManagementResource_ListRoles_InvalidColumn","","Sat Jan 10 01:11:38 UTC 2026","passed","Sat Jan 10 01:11:38 UTC 2026","","Go Test","github.com/specterops/bloodhound/cmd/api/src/api/v2/auth/TestManagementResource_ListRoles_InvalidColumn","TestManagementResource_ListRoles_InvalidColumn"
"","839","should render a create user form","CreateUserDialog","Sat Jan 10 01:20:50 UTC 2026","passed","Sat Jan 10 01:20:51 UTC 2026","","","",""
"","0","fails for password without lowercase letters","testPassword","Sat Jan 10 01:24:29 UTC 2026","passed","Sat Jan 10 01:24:29 UTC 2026","","","",""
"Test cases for TestIntPointer","0","TestIntPointer","","Sat Jan 10 01:11:36 UTC 2026","passed","Sat Jan 10 01:11:36 UTC 2026","","Go Test","github.com/specterops/bloodhound/cmd/api/src/database/types/null/TestIntPointer","TestIntPointer"
"","56","renders highlight for the active tag","SelectedHighlight","Sat Jan 10 01:23:36 UTC 2026","passed","Sat Jan 10 01:23:37 UTC 2026","","","",""
"","509","clear validation error on input","ManagedDatePicker - date validation","Sat Jan 10 01:22:18 UTC 2026","passed","Sat Jan 10 01:22:18 UTC 2026","","","",""
"","220","Selecting an edge with a Computer target node that does not have haslaps enabled shows correct Windows Abuse text","EdgeInfoContent","Sat Jan 10 01:20:45 UTC 2026","passed","Sat Jan 10 01:20:45 UTC 2026","","","",""
"","2","reports when API error response has errors array","handleError","Sat Jan 10 01:23:03 UTC 2026","passed","Sat Jan 10 01:23:03 UTC 2026","","","",""
"","8","displays lastlogon cell as NEVER when the value is -1","ExploreTableDataCell","Sat Jan 10 01:23:48 UTC 2026","passed","Sat Jan 10 01:23:48 UTC 2026","","","",""
"Test cases for TestNormalizeToUTF8_ReaderError","0","TestNormalizeToUTF8_ReaderError","","Sat Jan 10 01:11:47 UTC 2026","passed","Sat Jan 10 01:11:47 UTC 2026","","Go Test","github.com/specterops/bloodhound/packages/go/bomenc/TestNormalizeToUTF8_ReaderError","TestNormalizeToUTF8_ReaderError"
"","60","does not render count for a selected zone if prop is not set","DynamicDetails","Sat Jan 10 01:21:35 UTC 2026","passed","Sat Jan 10 01:21:35 UTC 2026","","","",""
"Test cases for TestCreateUser_ResetPassword","1703","TestCreateUser_ResetPassword","","Sat Jan 10 01:11:45 UTC 2026","passed","Sat Jan 10 01:11:47 UTC 2026","","Go Test","github.com/specterops/bloodhound/cmd/api/src/api/v2/auth/TestCreateUser_ResetPassword","TestCreateUser_ResetPassword"
"","665","displays correct content based on platform filter AD","CommonSearches","Sat Jan 10 01:21:18 UTC 2026","passed","Sat Jan 10 01:21:18 UTC 2026","","","",""
"","64","displays ! icon when one of the Affected Object calls fail","EntityInfoDataTable","Sat Jan 10 01:21:32 UTC 2026","passed","Sat Jan 10 01:21:32 UTC 2026","","Node count for nested table that counts all sections","",""
"","1","returns graphData as is if it doesnt match the GraphResponse interface","normalizeGraphDataForSigma","Sat Jan 10 01:25:34 UTC 2026","passed","Sat Jan 10 01:25:34 UTC 2026","","","",""
"Test cases for TestURLJoinPathEscapesSlashes","0","TestURLJoinPathEscapesSlashes","","Sat Jan 10 01:11:23 UTC 2026","passed","Sat Jan 10 01:11:23 UTC 2026","","Go Test","github.com/specterops/bloodhound/cmd/api/src/api/TestURLJoinPathEscapesSlashes","TestURLJoinPathEscapesSlashes"
"","5","returns the remaining amount of zones available for creation","useTagLimits","Sat Jan 10 01:20:49 UTC 2026","passed","Sat Jan 10 01:20:49 UTC 2026","","","",""
"","222","onCancel is called when cancel is clicked","Enable2FADialog","Sat Jan 10 01:22:19 UTC 2026","passed","Sat Jan 10 01:22:20 UTC 2026","","","",""
"","432","calls onSave without current password when requireCurrentPassword is false","PasswordDialog","Sat Jan 10 01:20:46 UTC 2026","passed","Sat Jan 10 01:20:46 UTC 2026","","","",""
"","1298","should display all available SSO providers","CreateUserDialog","Sat Jan 10 01:20:53 UTC 2026","passed","Sat Jan 10 01:20:54 UTC 2026","","","",""
"Test cases for TestGetVersion","0","TestGetVersion","","Sat Jan 10 01:11:31 UTC 2026","passed","Sat Jan 10 01:11:31 UTC 2026","","Go Test","github.com/specterops/bloodhound/cmd/api/src/api/v2/TestGetVersion","TestGetVersion"
"Test cases for TestManagementResource_EnrollMFA","2295","TestManagementResource_EnrollMFA","","Sat Jan 10 01:11:58 UTC 2026","passed","Sat Jan 10 01:12:01 UTC 2026","","Go Test","github.com/specterops/bloodhound/cmd/api/src/api/v2/auth/TestManagementResource_EnrollMFA","TestManagementResource_EnrollMFA"
"","464","calls handleFilterChange when a node type is selected","AssetGroupEdit","Sat Jan 10 01:21:18 UTC 2026","passed","Sat Jan 10 01:21:18 UTC 2026","","Node Type dropdown filter","",""
"Test cases for TestResources_DeleteSavedQuery_DBError","0","TestResources_DeleteSavedQuery_DBError","","Sat Jan 10 01:11:31 UTC 2026","passed","Sat Jan 10 01:11:31 UTC 2026","","Go Test","github.com/specterops/bloodhound/cmd/api/src/api/v2/TestResources_DeleteSavedQuery_DBError","TestResources_DeleteSavedQuery_DBError"
"","41","should display an error message if data does not return from the API","Context Selector Error","Sat Jan 10 01:20:40 UTC 2026","passed","Sat Jan 10 01:20:40 UTC 2026","","","",""
