"DESCRIPTION","DURATION IN MS","NAME","PARENT SUITE","START TIME","STATUS","STOP TIME","SUB SUITE","SUITE","TEST CLASS","TEST METHOD"
"Test cases for TestManagementResource_UpdateOIDCProvider","0","TestManagementResource_UpdateOIDCProvider","","Mon Mar 30 18:55:48 UTC 2026","passed","Mon Mar 30 18:55:48 UTC 2026","","Go Test","github.com/specterops/bloodhound/cmd/api/src/api/v2/auth/TestManagementResource_UpdateOIDCProvider","TestManagementResource_UpdateOIDCProvider"
"","642","displays correct content based on platform filter Azure","CommonSearches","Mon Mar 30 18:57:09 UTC 2026","passed","Mon Mar 30 18:57:09 UTC 2026","","","",""
"","67","should navigate to the correct page on alt + digit keydown","Keyboard shortcuts","Mon Mar 30 18:56:48 UTC 2026","passed","Mon Mar 30 18:56:48 UTC 2026","","","",""
"","1308","renders asset group edit options with graph write permissions","ContextMenu","Mon Mar 30 18:56:54 UTC 2026","passed","Mon Mar 30 18:56:55 UTC 2026","","","",""
"","274","a name value is required to submit the form","Rule Form","Mon Mar 30 18:56:25 UTC 2026","passed","Mon Mar 30 18:56:25 UTC 2026","","","",""
"Test cases for TestUnmarshalInt64OverflowToInt64","0","TestUnmarshalInt64OverflowToInt64","","Mon Mar 30 18:55:07 UTC 2026","passed","Mon Mar 30 18:55:07 UTC 2026","","Go Test","github.com/specterops/bloodhound/cmd/api/src/database/types/null/TestUnmarshalInt64OverflowToInt64","TestUnmarshalInt64OverflowToInt64"
"","342","should render an SavedQueryPermissions component","SaveQueryDialog","Mon Mar 30 18:56:08 UTC 2026","passed","Mon Mar 30 18:56:08 UTC 2026","","","",""
"","748","opens and closes the filter","FileIngestFilterDialog","Mon Mar 30 18:56:53 UTC 2026","passed","Mon Mar 30 18:56:54 UTC 2026","","","",""
"","0","should appropriately handle edges that contain underscores","getEdgeDataFromKey","Mon Mar 30 19:01:50 UTC 2026","passed","Mon Mar 30 19:01:50 UTC 2026","","","",""
"","335","sets a primarySearch=id and searchType=node when secondarySearch is falsey","ContextMenu","Mon Mar 30 19:01:21 UTC 2026","passed","Mon Mar 30 19:01:21 UTC 2026","","","",""
"","69","excludes API edges that are associated with one of our built-in schema types","useEdgeCategories","Mon Mar 30 18:57:22 UTC 2026","passed","Mon Mar 30 18:57:22 UTC 2026","","","",""
"","1","handles unix time values by converting them to our standard date display format","Formatting number properties","Mon Mar 30 18:57:13 UTC 2026","passed","Mon Mar 30 18:57:13 UTC 2026","","","",""
"","381","navigates to rule details when clicking a rule row","RulesAccordion","Mon Mar 30 18:58:44 UTC 2026","passed","Mon Mar 30 18:58:45 UTC 2026","","","",""
"Test cases for TestResources_ListADGPOAffectedUsers","3","TestResources_ListADGPOAffectedUsers","","Mon Mar 30 18:55:03 UTC 2026","passed","Mon Mar 30 18:55:03 UTC 2026","","Go Test","github.com/specterops/bloodhound/cmd/api/src/api/v2/TestResources_ListADGPOAffectedUsers","TestResources_ListADGPOAffectedUsers"
"","353","should display a ""Configure Multi-Factor Authentication"" modal","UserProfile","Mon Mar 30 18:57:30 UTC 2026","passed","Mon Mar 30 18:57:30 UTC 2026","","""Multi-Factor Authentication Enabled"" switch is enabled","",""
"Test cases for TestFoldl","2","TestFoldl","","Mon Mar 30 18:55:42 UTC 2026","passed","Mon Mar 30 18:55:42 UTC 2026","","Go Test","github.com/specterops/bloodhound/packages/go/slicesext/TestFoldl","TestFoldl"
"","1","returns a comma separated number when provided with a number > 999","numberFormatting","Mon Mar 30 18:58:34 UTC 2026","passed","Mon Mar 30 18:58:34 UTC 2026","","","",""
"Test cases for TestParseUserIP_XForwardedFor_RemoteAddr","0","TestParseUserIP_XForwardedFor_RemoteAddr","","Mon Mar 30 18:54:55 UTC 2026","passed","Mon Mar 30 18:54:55 UTC 2026","","Go Test","github.com/specterops/bloodhound/cmd/api/src/api/middleware/TestParseUserIP_XForwardedFor_RemoteAddr","TestParseUserIP_XForwardedFor_RemoteAddr"
"","0","shows some collection methods for the given job","toCollected","Mon Mar 30 19:00:18 UTC 2026","passed","Mon Mar 30 19:00:18 UTC 2026","","","",""
"","64","renders three animated dots","ProcessingIndicator","Mon Mar 30 19:00:45 UTC 2026","passed","Mon Mar 30 19:00:45 UTC 2026","","","",""
"","133","calls onConfirm when confirm button clicked","EarlyAccessFeaturesWarningDialog","Mon Mar 30 19:01:53 UTC 2026","passed","Mon Mar 30 19:01:53 UTC 2026","","","",""
"","150","shows the empty form message when Object Rule Form is empty","Seed Selection Results","Mon Mar 30 18:56:57 UTC 2026","passed","Mon Mar 30 18:56:58 UTC 2026","","","",""
"","0","returns the distance between two coordinates","getDistanceBetween","Mon Mar 30 19:01:50 UTC 2026","passed","Mon Mar 30 19:01:50 UTC 2026","","","",""
"","547","shows success notification after successful deletion","ActiveExtensionsCard","Mon Mar 30 18:56:27 UTC 2026","passed","Mon Mar 30 18:56:28 UTC 2026","","","",""
"Test cases for TestCache_NewCache","2","TestCache_NewCache","","Mon Mar 30 18:55:29 UTC 2026","passed","Mon Mar 30 18:55:29 UTC 2026","","Go Test","github.com/specterops/bloodhound/packages/go/cache/TestCache_NewCache","TestCache_NewCache"
"","0","returns false if value is 'string'","searchParams","Mon Mar 30 18:59:11 UTC 2026","passed","Mon Mar 30 18:59:11 UTC 2026","","isEmptyParam","",""
"","152","renders correctly","NodeIcon","Mon Mar 30 19:00:06 UTC 2026","passed","Mon Mar 30 19:00:06 UTC 2026","","","",""
"Test cases for TestBoolScan","0","TestBoolScan","","Mon Mar 30 18:55:07 UTC 2026","passed","Mon Mar 30 18:55:07 UTC 2026","","Go Test","github.com/specterops/bloodhound/cmd/api/src/database/types/null/TestBoolScan","TestBoolScan"
"","563","should display Environmental Targeted Access Control panel when showEnvironmentAccessControls prop is true and user role is selected","UpdateUserForm","Mon Mar 30 18:56:14 UTC 2026","passed","Mon Mar 30 18:56:15 UTC 2026","","","",""
"","264","sets a primarySearch=id and searchType=pathfinding when secondarySearch is truthy","ContextMenu","Mon Mar 30 19:01:21 UTC 2026","passed","Mon Mar 30 19:01:21 UTC 2026","","","",""
"","8","should render a Field when the provided value is -0","Field","Mon Mar 30 19:00:13 UTC 2026","passed","Mon Mar 30 19:00:13 UTC 2026","","","",""
"Test cases for TestResources_GetAssetGroup","0","TestResources_GetAssetGroup","","Mon Mar 30 18:55:03 UTC 2026","passed","Mon Mar 30 18:55:03 UTC 2026","","Go Test","github.com/specterops/bloodhound/cmd/api/src/api/v2/TestResources_GetAssetGroup","TestResources_GetAssetGroup"
"","840","should render many sections with many navigation items","SubNav","Mon Mar 30 18:59:38 UTC 2026","passed","Mon Mar 30 18:59:39 UTC 2026","","","",""
"","159","returns false when no nodes are available","useGraphHasData","Mon Mar 30 19:00:09 UTC 2026","passed","Mon Mar 30 19:00:09 UTC 2026","","","",""
"","194","toggles parent from some to all","SourceKindsCheckboxes","Mon Mar 30 18:58:01 UTC 2026","passed","Mon Mar 30 18:58:01 UTC 2026","","","",""
"TestCacheEntryDigester_DigestEndpoint_MatchByProperty tests the sorting and hashinglogic when MatchBy is set to MatchByProperty.","0","TestCacheEntryDigester_DigestEndpoint_MatchByProperty","","Mon Mar 30 18:55:10 UTC 2026","passed","Mon Mar 30 18:55:10 UTC 2026","","Go Test","github.com/specterops/bloodhound/cmd/api/src/services/graphify/endpoint/TestCacheEntryDigester_DigestEndpoint_MatchByProperty","TestCacheEntryDigester_DigestEndpoint_MatchByProperty"
"Test cases for Test_GetAssetGroupMembersBySelector","4","Test_GetAssetGroupMembersBySelector","","Mon Mar 30 18:55:03 UTC 2026","passed","Mon Mar 30 18:55:03 UTC 2026","","Go Test","github.com/specterops/bloodhound/cmd/api/src/api/v2/Test_GetAssetGroupMembersBySelector","Test_GetAssetGroupMembersBySelector"
"","905","should hide Environmental Targeted Access Control panel when showEnvironmentAccessControls prop is true and power user role is selected","UpdateUserForm","Mon Mar 30 18:56:15 UTC 2026","passed","Mon Mar 30 18:56:16 UTC 2026","","","",""
"","1","should handle an undefined or null entity","Evaluating the entity display name from a given entity","Mon Mar 30 18:57:13 UTC 2026","passed","Mon Mar 30 18:57:13 UTC 2026","","","",""
"","63","enables correctly returning the tag associated with Tier Zero (position value of 1) from the list of tags","the useAssetGroupTags utilities","Mon Mar 30 18:57:01 UTC 2026","passed","Mon Mar 30 18:57:01 UTC 2026","","","",""
"Test cases for TestResources_ShareSavedQueriesPermissions_Admin","8","TestResources_ShareSavedQueriesPermissions_Admin","","Mon Mar 30 18:55:03 UTC 2026","passed","Mon Mar 30 18:55:03 UTC 2026","","Go Test","github.com/specterops/bloodhound/cmd/api/src/api/v2/TestResources_ShareSavedQueriesPermissions_Admin","TestResources_ShareSavedQueriesPermissions_Admin"
"Test cases for TestEncodingEquality","0","TestEncodingEquality","","Mon Mar 30 18:55:29 UTC 2026","passed","Mon Mar 30 18:55:29 UTC 2026","","Go Test","github.com/specterops/bloodhound/packages/go/bomenc/TestEncodingEquality","TestEncodingEquality"
"","587","should render","ExploreTable","Mon Mar 30 18:55:59 UTC 2026","passed","Mon Mar 30 18:55:59 UTC 2026","","","",""
"Test cases for TestResources_CreateCustomNodeKindsTest","109","TestResources_CreateCustomNodeKindsTest","","Mon Mar 30 18:55:03 UTC 2026","passed","Mon Mar 30 18:55:03 UTC 2026","","Go Test","github.com/specterops/bloodhound/cmd/api/src/api/v2/TestResources_CreateCustomNodeKindsTest","TestResources_CreateCustomNodeKindsTest"
"Test cases for TestUnmarshalFloat","0","TestUnmarshalFloat","","Mon Mar 30 18:55:07 UTC 2026","passed","Mon Mar 30 18:55:07 UTC 2026","","Go Test","github.com/specterops/bloodhound/cmd/api/src/database/types/null/TestUnmarshalFloat","TestUnmarshalFloat"
"Test cases for Test_filterNodesToSearchResult_filterEnvironments","0","Test_filterNodesToSearchResult_filterEnvironments","","Mon Mar 30 18:55:08 UTC 2026","passed","Mon Mar 30 18:55:08 UTC 2026","","Go Test","github.com/specterops/bloodhound/cmd/api/src/queries/Test_filterNodesToSearchResult_filterEnvironments","Test_filterNodesToSearchResult_filterEnvironments"
"","171","a timeout response from the server is handled","ExploreSearchCombobox with search timeout","Mon Mar 30 18:57:24 UTC 2026","passed","Mon Mar 30 18:57:24 UTC 2026","","","",""
"Test cases for TestMarshalIntText","0","TestMarshalIntText","","Mon Mar 30 18:55:07 UTC 2026","passed","Mon Mar 30 18:55:07 UTC 2026","","Go Test","github.com/specterops/bloodhound/cmd/api/src/database/types/null/TestMarshalIntText","TestMarshalIntText"
"Test cases for TestResources_GetPermissionsForSavedQuery","46","TestResources_GetPermissionsForSavedQuery","","Mon Mar 30 18:55:03 UTC 2026","passed","Mon Mar 30 18:55:03 UTC 2026","","Go Test","github.com/specterops/bloodhound/cmd/api/src/api/v2/TestResources_GetPermissionsForSavedQuery","TestResources_GetPermissionsForSavedQuery"
"","583","handles creating a new rule","Rule Form","Mon Mar 30 18:56:26 UTC 2026","passed","Mon Mar 30 18:56:27 UTC 2026","","","",""
"Test cases for TestPermissionsCheckAll","0","TestPermissionsCheckAll","","Mon Mar 30 18:54:55 UTC 2026","passed","Mon Mar 30 18:54:55 UTC 2026","","Go Test","github.com/specterops/bloodhound/cmd/api/src/api/middleware/TestPermissionsCheckAll","TestPermissionsCheckAll"
"","0","handles empty search string","filterAndSearchEnvironments","Mon Mar 30 18:56:18 UTC 2026","passed","Mon Mar 30 18:56:18 UTC 2026","","search filter","",""
"","206","shows Popper when isCurrentSearchOpen is true","GraphControls","Mon Mar 30 18:56:48 UTC 2026","passed","Mon Mar 30 18:56:49 UTC 2026","","Searching current results","",""
"Test cases for TestParseAGMembersFromNodes_MissingNodeProperties","0","TestParseAGMembersFromNodes_MissingNodeProperties","","Mon Mar 30 18:55:02 UTC 2026","passed","Mon Mar 30 18:55:02 UTC 2026","","Go Test","github.com/specterops/bloodhound/cmd/api/src/api/v2/TestParseAGMembersFromNodes_MissingNodeProperties","TestParseAGMembersFromNodes_MissingNodeProperties"
"Test cases for TestStringScan","0","TestStringScan","","Mon Mar 30 18:55:07 UTC 2026","passed","Mon Mar 30 18:55:07 UTC 2026","","Go Test","github.com/specterops/bloodhound/cmd/api/src/database/types/null/TestStringScan","TestStringScan"
"","14","removes key from state","useObjectState","Mon Mar 30 18:59:58 UTC 2026","passed","Mon Mar 30 18:59:58 UTC 2026","","","",""
"","1974","should clear out the SSO Provider id from submission data when the authentication method is changed","CreateUserDialog","Mon Mar 30 18:56:39 UTC 2026","passed","Mon Mar 30 18:56:41 UTC 2026","","","",""
"Test cases for TestFlatMap","0","TestFlatMap","","Mon Mar 30 18:55:42 UTC 2026","passed","Mon Mar 30 18:55:42 UTC 2026","","Go Test","github.com/specterops/bloodhound/packages/go/slicesext/TestFlatMap","TestFlatMap"
"","0","The user has yet to type into the search (for OU and Domain searches that have hard coded types)","Getting the text for the disabled item display for a search when there are no results","Mon Mar 30 18:58:40 UTC 2026","passed","Mon Mar 30 18:58:40 UTC 2026","","Empty data states","",""
"","1320","when user performs a pathfinding search, the selection for the start node is carried over to the `search` tab","ExploreSearch interaction","Mon Mar 30 19:01:16 UTC 2026","passed","Mon Mar 30 19:01:17 UTC 2026","","","",""
"","136","should display an error when error prop is truthy","SaveQueryDialog","Mon Mar 30 18:56:08 UTC 2026","passed","Mon Mar 30 18:56:08 UTC 2026","","","",""
"","71","List Display Roles Hook is Loading","useListDisplayRoles","Mon Mar 30 18:56:53 UTC 2026","passed","Mon Mar 30 18:56:53 UTC 2026","","","",""
"","8","displays lastlogontimestamp cell as NEVER when the value is -1","ExploreTableDataCell","Mon Mar 30 19:00:01 UTC 2026","passed","Mon Mar 30 19:00:01 UTC 2026","","","",""
"Test cases for TestExpireUserAuthSecret_Failure","0","TestExpireUserAuthSecret_Failure","","Mon Mar 30 18:55:09 UTC 2026","passed","Mon Mar 30 18:55:09 UTC 2026","","Go Test","github.com/specterops/bloodhound/cmd/api/src/api/v2/auth/TestExpireUserAuthSecret_Failure","TestExpireUserAuthSecret_Failure"
"","0","handles percent values by multiplying by 100, truncating to an integer, and adding a ""%"" to the end","Formatting number properties","Mon Mar 30 18:57:13 UTC 2026","passed","Mon Mar 30 18:57:13 UTC 2026","","","",""
"","424","toggles sort order when clicking sortable header","ObjectsAccordion","Mon Mar 30 18:59:42 UTC 2026","passed","Mon Mar 30 18:59:43 UTC 2026","","","",""
"Test cases for TestParseOptionalBoolEmptyValue","0","TestParseOptionalBoolEmptyValue","","Mon Mar 30 18:54:51 UTC 2026","passed","Mon Mar 30 18:54:51 UTC 2026","","Go Test","github.com/specterops/bloodhound/cmd/api/src/api/TestParseOptionalBoolEmptyValue","TestParseOptionalBoolEmptyValue"
"","50","Error handling for fetching edge information","EdgeObjectInformation","Mon Mar 30 18:58:49 UTC 2026","passed","Mon Mar 30 18:58:49 UTC 2026","","","",""
"Test cases for TestCreateUser_FailureDuplicateEmail","1071","TestCreateUser_FailureDuplicateEmail","","Mon Mar 30 18:55:09 UTC 2026","passed","Mon Mar 30 18:55:10 UTC 2026","","Go Test","github.com/specterops/bloodhound/cmd/api/src/api/v2/auth/TestCreateUser_FailureDuplicateEmail","TestCreateUser_FailureDuplicateEmail"
"Test cases for TestBoolSetValid","0","TestBoolSetValid","","Mon Mar 30 18:55:07 UTC 2026","passed","Mon Mar 30 18:55:07 UTC 2026","","Go Test","github.com/specterops/bloodhound/cmd/api/src/database/types/null/TestBoolSetValid","TestBoolSetValid"
"","329","should display filter dropwdowns","CommonSearches","Mon Mar 30 18:57:07 UTC 2026","passed","Mon Mar 30 18:57:08 UTC 2026","","","",""
"Test cases for TestResources_ShareSavedQueriesPermissions_NonAdmin","4","TestResources_ShareSavedQueriesPermissions_NonAdmin","","Mon Mar 30 18:55:03 UTC 2026","passed","Mon Mar 30 18:55:03 UTC 2026","","Go Test","github.com/specterops/bloodhound/cmd/api/src/api/v2/TestResources_ShareSavedQueriesPermissions_NonAdmin","TestResources_ShareSavedQueriesPermissions_NonAdmin"
"","68","fetches new information when a different databaseId is passed","useFetchEntityInfo","Mon Mar 30 18:58:23 UTC 2026","passed","Mon Mar 30 18:58:23 UTC 2026","","","",""
"Test cases for TestAddWhereClauseToNeo4jQuery_WithWhereClause","0","TestAddWhereClauseToNeo4jQuery_WithWhereClause","","Mon Mar 30 18:55:03 UTC 2026","passed","Mon Mar 30 18:55:03 UTC 2026","","Go Test","github.com/specterops/bloodhound/cmd/api/src/api/v2/TestAddWhereClauseToNeo4jQuery_WithWhereClause","TestAddWhereClauseToNeo4jQuery_WithWhereClause"
"Test cases for TestResources_ListAuditLogs_SortingError","0","TestResources_ListAuditLogs_SortingError","","Mon Mar 30 18:55:03 UTC 2026","passed","Mon Mar 30 18:55:03 UTC 2026","","Go Test","github.com/specterops/bloodhound/cmd/api/src/api/v2/TestResources_ListAuditLogs_SortingError","TestResources_ListAuditLogs_SortingError"
"Test cases for TestResources_GetAssetGroupTagHistory","1","TestResources_GetAssetGroupTagHistory","","Mon Mar 30 18:55:03 UTC 2026","passed","Mon Mar 30 18:55:03 UTC 2026","","Go Test","github.com/specterops/bloodhound/cmd/api/src/api/v2/TestResources_GetAssetGroupTagHistory","TestResources_GetAssetGroupTagHistory"
"Test cases for TestHeaderMatches","0","TestHeaderMatches","","Mon Mar 30 18:55:28 UTC 2026","passed","Mon Mar 30 18:55:28 UTC 2026","","Go Test","github.com/specterops/bloodhound/cmd/api/src/utils/TestHeaderMatches","TestHeaderMatches"
"","0","isError returns as expected based on all queries combined","queriesAreLoadingOrErrored","Mon Mar 30 19:00:42 UTC 2026","passed","Mon Mar 30 19:00:42 UTC 2026","","","",""
"Test cases for TestParseLimitQueryParameter_BadFormat","0","TestParseLimitQueryParameter_BadFormat","","Mon Mar 30 18:55:03 UTC 2026","passed","Mon Mar 30 18:55:03 UTC 2026","","Go Test","github.com/specterops/bloodhound/cmd/api/src/api/v2/TestParseLimitQueryParameter_BadFormat","TestParseLimitQueryParameter_BadFormat"
"","62","returns the full environment of the environmentId found in the search params","useAvailableEnvironments","Mon Mar 30 18:59:47 UTC 2026","passed","Mon Mar 30 18:59:47 UTC 2026","","useSelectedEnvironment","",""
"Test cases for TestResources_DeleteSavedQuery_DeleteError","0","TestResources_DeleteSavedQuery_DeleteError","","Mon Mar 30 18:55:03 UTC 2026","passed","Mon Mar 30 18:55:03 UTC 2026","","Go Test","github.com/specterops/bloodhound/cmd/api/src/api/v2/TestResources_DeleteSavedQuery_DeleteError","TestResources_DeleteSavedQuery_DeleteError"
"Test cases for TestInt64ValueOrZero","0","TestInt64ValueOrZero","","Mon Mar 30 18:55:07 UTC 2026","passed","Mon Mar 30 18:55:07 UTC 2026","","Go Test","github.com/specterops/bloodhound/cmd/api/src/database/types/null/TestInt64ValueOrZero","TestInt64ValueOrZero"
"","0","filters by collected=false when ""no"" filter is active","filterAndSearchEnvironments","Mon Mar 30 18:56:18 UTC 2026","passed","Mon Mar 30 18:56:18 UTC 2026","","collected filters","",""
"","262","adds a ""Close"" button that closes the dialog after a failed upload","SchemaUploadDialog","Mon Mar 30 18:57:16 UTC 2026","passed","Mon Mar 30 18:57:17 UTC 2026","","","",""
"","3","shows no collection methods","toCollected","Mon Mar 30 19:00:18 UTC 2026","passed","Mon Mar 30 19:00:18 UTC 2026","","","",""
"","0","returns paramValue as EnvironmentAggregation if paramValue is active-directory","useEnvironmentParams","Mon Mar 30 19:00:42 UTC 2026","passed","Mon Mar 30 19:00:42 UTC 2026","","parseEnvironmentAggregation","",""
"","4","returns true if arrays are referentially equal","areArraysSimilar","Mon Mar 30 19:00:22 UTC 2026","passed","Mon Mar 30 19:00:22 UTC 2026","","","",""
"","14","Input contains an invalid type","Parsing the debounced input for type and keyword values","Mon Mar 30 18:58:40 UTC 2026","passed","Mon Mar 30 18:58:40 UTC 2026","","","",""
"Test cases for TestResources_SearchHandler_ETAC","12","TestResources_SearchHandler_ETAC","","Mon Mar 30 18:55:03 UTC 2026","passed","Mon Mar 30 18:55:03 UTC 2026","","Go Test","github.com/specterops/bloodhound/cmd/api/src/api/v2/TestResources_SearchHandler_ETAC","TestResources_SearchHandler_ETAC"
"","219","should display ""Cancel"" button","Enable2FADialog","Mon Mar 30 18:59:21 UTC 2026","passed","Mon Mar 30 18:59:21 UTC 2026","","","",""
"Test cases for TestAssetGroupMembers_SortBy","0","TestAssetGroupMembers_SortBy","","Mon Mar 30 18:54:51 UTC 2026","passed","Mon Mar 30 18:54:51 UTC 2026","","Go Test","github.com/specterops/bloodhound/cmd/api/src/api/TestAssetGroupMembers_SortBy","TestAssetGroupMembers_SortBy"
"","11","should render when search string is in the middle of the text","HighlightedText","Mon Mar 30 18:59:58 UTC 2026","passed","Mon Mar 30 18:59:58 UTC 2026","","","",""
"","1880","should open edge filtering dialog","EdgeFilter","Mon Mar 30 18:58:22 UTC 2026","passed","Mon Mar 30 18:58:24 UTC 2026","","","",""
"Test cases for Test_ConvertAppFederatedIdentityCredential","0","Test_ConvertAppFederatedIdentityCredential","","Mon Mar 30 18:55:29 UTC 2026","passed","Mon Mar 30 18:55:29 UTC 2026","","Go Test","github.com/specterops/bloodhound/packages/go/ein/Test_ConvertAppFederatedIdentityCredential","Test_ConvertAppFederatedIdentityCredential"
"","232","should display a toggle switch to enable multi-factor authentication","UserProfile","Mon Mar 30 18:57:30 UTC 2026","passed","Mon Mar 30 18:57:30 UTC 2026","","","",""
"","384","renders","ObjectsAccordion","Mon Mar 30 18:58:44 UTC 2026","passed","Mon Mar 30 18:58:44 UTC 2026","","","",""
"","323","AZRole information panel will not display a section for PIM Assignments","EntityInfoContent","Mon Mar 30 18:58:27 UTC 2026","passed","Mon Mar 30 18:58:27 UTC 2026","","","",""
"Test cases for TestManagementResource_CreateOIDCProvider","1","TestManagementResource_CreateOIDCProvider","","Mon Mar 30 18:55:48 UTC 2026","passed","Mon Mar 30 18:55:48 UTC 2026","","Go Test","github.com/specterops/bloodhound/cmd/api/src/api/v2/auth/TestManagementResource_CreateOIDCProvider","TestManagementResource_CreateOIDCProvider"
"Test cases for TestManagementResource_ListPermissions","0","TestManagementResource_ListPermissions","","Mon Mar 30 18:55:09 UTC 2026","passed","Mon Mar 30 18:55:09 UTC 2026","","Go Test","github.com/specterops/bloodhound/cmd/api/src/api/v2/auth/TestManagementResource_ListPermissions","TestManagementResource_ListPermissions"
"","0","returns null if paramValue is ''","useEnvironmentParams","Mon Mar 30 19:00:42 UTC 2026","passed","Mon Mar 30 19:00:42 UTC 2026","","parseEnvironmentAggregation","",""
"Test cases for TestActivateMFA_Failure","642","TestActivateMFA_Failure","","Mon Mar 30 18:55:47 UTC 2026","passed","Mon Mar 30 18:55:47 UTC 2026","","Go Test","github.com/specterops/bloodhound/cmd/api/src/api/v2/auth/TestActivateMFA_Failure","TestActivateMFA_Failure"
"","14","makes no count request when neither a Tag or Rule is selected (tagId and ruleId are undefined from path params","useObjectCounts","Mon Mar 30 19:00:16 UTC 2026","passed","Mon Mar 30 19:00:16 UTC 2026","","","",""
"Test cases for TestURLJoinPathEscapesSlashes","0","TestURLJoinPathEscapesSlashes","","Mon Mar 30 18:54:52 UTC 2026","passed","Mon Mar 30 18:54:52 UTC 2026","","Go Test","github.com/specterops/bloodhound/cmd/api/src/api/TestURLJoinPathEscapesSlashes","TestURLJoinPathEscapesSlashes"
"","108","requests finished jobs","useFinishedJobs","Mon Mar 30 18:58:05 UTC 2026","passed","Mon Mar 30 18:58:05 UTC 2026","","","",""
"Test cases for TestManagementResource_OIDCCallbackHandler","7","TestManagementResource_OIDCCallbackHandler","","Mon Mar 30 18:55:48 UTC 2026","passed","Mon Mar 30 18:55:48 UTC 2026","","Go Test","github.com/specterops/bloodhound/cmd/api/src/api/v2/auth/TestManagementResource_OIDCCallbackHandler","TestManagementResource_OIDCCallbackHandler"
"","141","shows ""<10 Days to Expire"" warning when token expires within 10 days","UserTokenManagementDialog - API Expiration Date column","Mon Mar 30 18:57:05 UTC 2026","passed","Mon Mar 30 18:57:05 UTC 2026","","","",""
"","256","sets a secondary=id and searchType=pathfinding when primary is truthy","ContextMenu","Mon Mar 30 19:01:22 UTC 2026","passed","Mon Mar 30 19:01:22 UTC 2026","","","",""
"","302","navigates to all rules when clicking ""All Rules""","RulesAccordion","Mon Mar 30 18:58:44 UTC 2026","passed","Mon Mar 30 18:58:44 UTC 2026","","","",""
"","20","renders Owned text by default when no Label Selector is available and on a Label page","TagSelector","Mon Mar 30 18:58:56 UTC 2026","passed","Mon Mar 30 18:58:56 UTC 2026","","","",""
"Test cases for TestBHCEStaticHandler","16","TestBHCEStaticHandler","","Mon Mar 30 18:54:55 UTC 2026","passed","Mon Mar 30 18:54:55 UTC 2026","","Go Test","github.com/specterops/bloodhound/cmd/api/src/api/static/TestBHCEStaticHandler","TestBHCEStaticHandler"
"","495","should render list of available SSO providers","LoginViaSSOForm","Mon Mar 30 18:59:08 UTC 2026","passed","Mon Mar 30 18:59:08 UTC 2026","","","",""
"","751","should not allow the input to exceed the allowed length","UpdateUserForm","Mon Mar 30 18:56:12 UTC 2026","passed","Mon Mar 30 18:56:13 UTC 2026","","","",""
"","442","renders correctly with requiresCurrentPassword false","PasswordDialog","Mon Mar 30 18:56:31 UTC 2026","passed","Mon Mar 30 18:56:31 UTC 2026","","","",""
"","50","has a button with text Clear Filters","AssetGroupEdit","Mon Mar 30 18:57:18 UTC 2026","passed","Mon Mar 30 18:57:19 UTC 2026","","Clear Filters button","",""
"Test cases for TestContextMiddleware","0","TestContextMiddleware","","Mon Mar 30 18:54:55 UTC 2026","passed","Mon Mar 30 18:54:55 UTC 2026","","Go Test","github.com/specterops/bloodhound/cmd/api/src/api/middleware/TestContextMiddleware","TestContextMiddleware"
