"DESCRIPTION","DURATION IN MS","NAME","PARENT SUITE","START TIME","STATUS","STOP TIME","SUB SUITE","SUITE","TEST CLASS","TEST METHOD"
"Test cases for TestFloatValueOrZero","0","TestFloatValueOrZero","","Mon Mar 30 18:55:07 UTC 2026","passed","Mon Mar 30 18:55:07 UTC 2026","","Go Test","github.com/specterops/bloodhound/cmd/api/src/database/types/null/TestFloatValueOrZero","TestFloatValueOrZero"
"","1425","handles posting a mutation","DatabaseManagement","Mon Mar 30 19:01:23 UTC 2026","passed","Mon Mar 30 19:01:24 UTC 2026","","","",""
"Test cases for TestResources_GetGPOEntityInfo","3","TestResources_GetGPOEntityInfo","","Mon Mar 30 18:55:02 UTC 2026","passed","Mon Mar 30 18:55:02 UTC 2026","","Go Test","github.com/specterops/bloodhound/cmd/api/src/api/v2/TestResources_GetGPOEntityInfo","TestResources_GetGPOEntityInfo"
"Test cases for TestResources_ListADDomainInboundTrusts","1","TestResources_ListADDomainInboundTrusts","","Mon Mar 30 18:55:03 UTC 2026","passed","Mon Mar 30 18:55:03 UTC 2026","","Go Test","github.com/specterops/bloodhound/cmd/api/src/api/v2/TestResources_ListADDomainInboundTrusts","TestResources_ListADDomainInboundTrusts"
"Test cases for TestInt64Scan","0","TestInt64Scan","","Mon Mar 30 18:55:07 UTC 2026","passed","Mon Mar 30 18:55:07 UTC 2026","","Go Test","github.com/specterops/bloodhound/cmd/api/src/database/types/null/TestInt64Scan","TestInt64Scan"
"","17","renders disabled prop when flag is not enabled","FeatureFlag","Mon Mar 30 18:59:34 UTC 2026","passed","Mon Mar 30 18:59:34 UTC 2026","","","",""
"","724","should render a create user form","CreateUserDialog","Mon Mar 30 18:56:34 UTC 2026","passed","Mon Mar 30 18:56:35 UTC 2026","","","",""
"Test cases for TestWriteErrorResponse_InvalidFormat","0","TestWriteErrorResponse_InvalidFormat","","Mon Mar 30 18:54:52 UTC 2026","passed","Mon Mar 30 18:54:52 UTC 2026","","Go Test","github.com/specterops/bloodhound/cmd/api/src/api/TestWriteErrorResponse_InvalidFormat","TestWriteErrorResponse_InvalidFormat"
"","19","will update the selected filters based on the values stored in query params when the initialize function is called","usePathfindingFilters","Mon Mar 30 19:00:08 UTC 2026","passed","Mon Mar 30 19:00:08 UTC 2026","","","",""
"","1791","renders","Glyph Select Dialog","Mon Mar 30 19:00:18 UTC 2026","passed","Mon Mar 30 19:00:19 UTC 2026","","","",""
"","22","when password is expired and not on password reset page, redirects to password reset page","AuthenticatedRoute","Mon Mar 30 19:01:40 UTC 2026","passed","Mon Mar 30 19:01:40 UTC 2026","","","",""
"Test cases for TestBuildErrorResponseUnauthorized","1","TestBuildErrorResponseUnauthorized","","Mon Mar 30 18:54:52 UTC 2026","passed","Mon Mar 30 18:54:52 UTC 2026","","Go Test","github.com/specterops/bloodhound/cmd/api/src/api/TestBuildErrorResponseUnauthorized","TestBuildErrorResponseUnauthorized"
"","28","should display a badge when role based filtering is true and show filter banner is true","EntityInfoPanel","Mon Mar 30 18:59:47 UTC 2026","passed","Mon Mar 30 18:59:47 UTC 2026","","","",""
"","61","clicking a disabled header does not toggle content","<DetailsAccordion />","Mon Mar 30 18:57:03 UTC 2026","passed","Mon Mar 30 18:57:03 UTC 2026","","","",""
"","0","takes setSearchParams and availableParams returns a function","searchParams","Mon Mar 30 18:59:11 UTC 2026","passed","Mon Mar 30 18:59:11 UTC 2026","","setParamsFactory","",""
"","0","returns true if value is ''","searchParams","Mon Mar 30 18:59:11 UTC 2026","passed","Mon Mar 30 18:59:11 UTC 2026","","isEmptyParam","",""
"Test cases for TestGenerateRandomBase64String","0","TestGenerateRandomBase64String","","Mon Mar 30 18:55:04 UTC 2026","passed","Mon Mar 30 18:55:04 UTC 2026","","Go Test","github.com/specterops/bloodhound/cmd/api/src/config/TestGenerateRandomBase64String","TestGenerateRandomBase64String"
"","94","disables the JSON button if the JSON is empty","GraphControls","Mon Mar 30 18:56:48 UTC 2026","passed","Mon Mar 30 18:56:48 UTC 2026","","Exporting json","",""
"","624","should not call onSubmit when expired password is not supplied when reset password button clicked","PasswordResetForm","Mon Mar 30 18:58:16 UTC 2026","passed","Mon Mar 30 18:58:17 UTC 2026","","","",""
"Test cases for TestManagementResource_PutUserAuthSecret","6009","TestManagementResource_PutUserAuthSecret","","Mon Mar 30 18:55:03 UTC 2026","passed","Mon Mar 30 18:55:09 UTC 2026","","Go Test","github.com/specterops/bloodhound/cmd/api/src/api/v2/auth/TestManagementResource_PutUserAuthSecret","TestManagementResource_PutUserAuthSecret"
"Test cases for TestAddWhereClauseToNeo4jQuery_NoWhereClause","1","TestAddWhereClauseToNeo4jQuery_NoWhereClause","","Mon Mar 30 18:55:03 UTC 2026","passed","Mon Mar 30 18:55:03 UTC 2026","","Go Test","github.com/specterops/bloodhound/cmd/api/src/api/v2/TestAddWhereClauseToNeo4jQuery_NoWhereClause","TestAddWhereClauseToNeo4jQuery_NoWhereClause"
"Test cases for TestDomainSelectors_GetValidFilterPredicatesAsStrings","0","TestDomainSelectors_GetValidFilterPredicatesAsStrings","","Mon Mar 30 18:55:07 UTC 2026","passed","Mon Mar 30 18:55:07 UTC 2026","","Go Test","github.com/specterops/bloodhound/cmd/api/src/model/TestDomainSelectors_GetValidFilterPredicatesAsStrings","TestDomainSelectors_GetValidFilterPredicatesAsStrings"
"Test cases for TestResources_EndIngestJob","93","TestResources_EndIngestJob","","Mon Mar 30 18:55:03 UTC 2026","passed","Mon Mar 30 18:55:03 UTC 2026","","Go Test","github.com/specterops/bloodhound/cmd/api/src/api/v2/TestResources_EndIngestJob","TestResources_EndIngestJob"
"","567","should display Environmental Targeted Access Control panel when showEnvironmentAccessControls prop is true and read-only role is selected","UpdateUserForm","Mon Mar 30 18:56:14 UTC 2026","passed","Mon Mar 30 18:56:14 UTC 2026","","","",""
"Test cases for TestResources_DeleteSavedQuery_DBError","0","TestResources_DeleteSavedQuery_DBError","","Mon Mar 30 18:55:03 UTC 2026","passed","Mon Mar 30 18:55:03 UTC 2026","","Go Test","github.com/specterops/bloodhound/cmd/api/src/api/v2/TestResources_DeleteSavedQuery_DBError","TestResources_DeleteSavedQuery_DBError"
"Test cases for TestWriteBinaryResponse","1","TestWriteBinaryResponse","","Mon Mar 30 18:54:52 UTC 2026","passed","Mon Mar 30 18:54:52 UTC 2026","","Go Test","github.com/specterops/bloodhound/cmd/api/src/api/TestWriteBinaryResponse","TestWriteBinaryResponse"
"Test cases for TestNormalizeToUTF8","1","TestNormalizeToUTF8","","Mon Mar 30 18:55:29 UTC 2026","passed","Mon Mar 30 18:55:29 UTC 2026","","Go Test","github.com/specterops/bloodhound/packages/go/bomenc/TestNormalizeToUTF8","TestNormalizeToUTF8"
"Test cases for Test_setRawValue","0","Test_setRawValue","","Mon Mar 30 18:55:04 UTC 2026","passed","Mon Mar 30 18:55:04 UTC 2026","","Go Test","github.com/specterops/bloodhound/cmd/api/src/config/Test_setRawValue","Test_setRawValue"
"Test cases for TestGetLimitParamForGraphQuery","1","TestGetLimitParamForGraphQuery","","Mon Mar 30 18:55:28 UTC 2026","passed","Mon Mar 30 18:55:28 UTC 2026","","Go Test","github.com/specterops/bloodhound/cmd/api/src/utils/TestGetLimitParamForGraphQuery","TestGetLimitParamForGraphQuery"
"Test cases for TestResources_GetAssetGroupTags","5","TestResources_GetAssetGroupTags","","Mon Mar 30 18:55:03 UTC 2026","passed","Mon Mar 30 18:55:03 UTC 2026","","Go Test","github.com/specterops/bloodhound/cmd/api/src/api/v2/TestResources_GetAssetGroupTags","TestResources_GetAssetGroupTags"
"","102","should display locally formatted numbers if they are larger than 999","LoadContainer","Mon Mar 30 19:00:50 UTC 2026","passed","Mon Mar 30 19:00:51 UTC 2026","","","",""
"Test cases for TestResources_GetAssetGroupMemberCount_DBError","0","TestResources_GetAssetGroupMemberCount_DBError","","Mon Mar 30 18:55:03 UTC 2026","passed","Mon Mar 30 18:55:03 UTC 2026","","Go Test","github.com/specterops/bloodhound/cmd/api/src/api/v2/TestResources_GetAssetGroupMemberCount_DBError","TestResources_GetAssetGroupMemberCount_DBError"
"","6073","checking a single edge type updates its parent and grandparent","Pathfinding","Mon Mar 30 18:58:04 UTC 2026","passed","Mon Mar 30 18:58:10 UTC 2026","","","",""
"","213","calls setExploreParams with searchType and relationshipQueryItemId when selecting a composition accordion","EdgeInfoContent","Mon Mar 30 18:56:23 UTC 2026","passed","Mon Mar 30 18:56:23 UTC 2026","","EdgeInfoContent support for Deep Linking","",""
"","12","displays CaretDownOutline icon when the sortOrder is undefined","ColumnHeaders","Mon Mar 30 18:58:32 UTC 2026","passed","Mon Mar 30 18:58:32 UTC 2026","","SortableHeader","",""
"","13","disables useAvailableEnvironment and does not attempt calling handleInitialEnvironment if queryOptions.enabled","useInitialEnvironment","Mon Mar 30 18:59:31 UTC 2026","passed","Mon Mar 30 18:59:31 UTC 2026","","","",""
"","872","renders a link to the explore page when member is clicked","GroupManagement","Mon Mar 30 19:01:34 UTC 2026","passed","Mon Mar 30 19:01:34 UTC 2026","","","",""
"Test cases for TestResources_ShareSavedQueriesPermissions_CanUpdateSavedQueriesPermission","6","TestResources_ShareSavedQueriesPermissions_CanUpdateSavedQueriesPermission","","Mon Mar 30 18:55:03 UTC 2026","passed","Mon Mar 30 18:55:03 UTC 2026","","Go Test","github.com/specterops/bloodhound/cmd/api/src/api/v2/TestResources_ShareSavedQueriesPermissions_CanUpdateSavedQueriesPermission","TestResources_ShareSavedQueriesPermissions_CanUpdateSavedQueriesPermission"
"","66","should hide Environmental Targeted Access Control panel when showEnvironmentAccessControls prop is false","CreateUserForm","Mon Mar 30 18:56:48 UTC 2026","passed","Mon Mar 30 18:56:48 UTC 2026","","","",""
"Test cases for TestResources_GetComputerEntityInfo","1","TestResources_GetComputerEntityInfo","","Mon Mar 30 18:55:02 UTC 2026","passed","Mon Mar 30 18:55:02 UTC 2026","","Go Test","github.com/specterops/bloodhound/cmd/api/src/api/v2/TestResources_GetComputerEntityInfo","TestResources_GetComputerEntityInfo"
"","9","does not render when selector data is not defined","Delete Selector Button rendering","Mon Mar 30 19:00:23 UTC 2026","passed","Mon Mar 30 19:00:23 UTC 2026","","","",""
"","618","does not display must be new password error messages when current password is not required","PasswordDialog","Mon Mar 30 18:56:35 UTC 2026","passed","Mon Mar 30 18:56:36 UTC 2026","","","",""
"","934","should call onSave when Save button is clicked and form input is valid","CreateUserDialog","Mon Mar 30 18:56:36 UTC 2026","passed","Mon Mar 30 18:56:37 UTC 2026","","","",""
"","15","renders nothing if flag is enabled and enabled prop is not provided","FeatureFlag","Mon Mar 30 18:59:34 UTC 2026","passed","Mon Mar 30 18:59:34 UTC 2026","","","",""
"","0","filters by low risk level","filterAndSearchEnvironments","Mon Mar 30 18:56:18 UTC 2026","passed","Mon Mar 30 18:56:18 UTC 2026","","risk filters","",""
"Test cases for TestMatches_FailureModel","1","TestMatches_FailureModel","","Mon Mar 30 18:55:07 UTC 2026","passed","Mon Mar 30 18:55:07 UTC 2026","","Go Test","github.com/specterops/bloodhound/cmd/api/src/model/TestMatches_FailureModel","TestMatches_FailureModel"
"","1","EXTENDED ROUNDING when thresholds are set: does not abbreviate numbers < 10000","numberFormatting","Mon Mar 30 18:58:34 UTC 2026","passed","Mon Mar 30 18:58:34 UTC 2026","","","",""
"Test cases for TestRequestWaitDuration_Negative","0","TestRequestWaitDuration_Negative","","Mon Mar 30 18:54:55 UTC 2026","passed","Mon Mar 30 18:54:55 UTC 2026","","Go Test","github.com/specterops/bloodhound/cmd/api/src/api/middleware/TestRequestWaitDuration_Negative","TestRequestWaitDuration_Negative"
"","62","passes the check for at least one permission if the user is missing one of many required permissions","usePermissions","Mon Mar 30 18:57:26 UTC 2026","passed","Mon Mar 30 18:57:26 UTC 2026","","","",""
"","61","sets autoDisplayTable to true if query returns nodes only, searchType = cypher, and and enabled is true","useExploreTableAutoDisplay","Mon Mar 30 18:59:41 UTC 2026","passed","Mon Mar 30 18:59:41 UTC 2026","","","",""
"","1025","should eventually render previously configured SSO providers","SSOConfiguration","Mon Mar 30 18:57:08 UTC 2026","passed","Mon Mar 30 18:57:09 UTC 2026","","","",""
"","875","displays validation error messages when password does not match confirmation","PasswordDialog","Mon Mar 30 18:56:33 UTC 2026","passed","Mon Mar 30 18:56:34 UTC 2026","","","",""
"","377","renders the Import Query Dialog","ImportQueryDialog","Mon Mar 30 19:00:35 UTC 2026","passed","Mon Mar 30 19:00:36 UTC 2026","","","",""
"","0","should compute offset vertices for bezier curves at a given intersection","bezier","Mon Mar 30 19:01:35 UTC 2026","passed","Mon Mar 30 19:01:35 UTC 2026","","","",""
"","6","safely handles removing nonexistent key","useObjectState","Mon Mar 30 18:59:58 UTC 2026","passed","Mon Mar 30 18:59:58 UTC 2026","","","",""
"","286","does not display a “Disable query timeout” checkbox when timeout limit param config is enabled true","ExploreSearch interaction","Mon Mar 30 19:01:18 UTC 2026","passed","Mon Mar 30 19:01:18 UTC 2026","","","",""
"","67","calls setSelected with correct data on click","NoteCell component","Mon Mar 30 18:59:22 UTC 2026","passed","Mon Mar 30 18:59:22 UTC 2026","","","",""
"","21","renders null if network fails to return valid asset group membership list","AssetGroupMenuItem","Mon Mar 30 19:01:12 UTC 2026","passed","Mon Mar 30 19:01:12 UTC 2026","","adding to an asset group","",""
"Test cases for TestClearCache_HA","1","TestClearCache_HA","","Mon Mar 30 18:55:04 UTC 2026","passed","Mon Mar 30 18:55:04 UTC 2026","","Go Test","github.com/specterops/bloodhound/cmd/api/src/daemons/changelog/TestClearCache_HA","TestClearCache_HA"
"","180","renders a preview version","PrivilegeZonesCypherEditor Search component for Zone Management","Mon Mar 30 18:59:37 UTC 2026","passed","Mon Mar 30 18:59:37 UTC 2026","","","",""
"Test cases for TestIntEqual","0","TestIntEqual","","Mon Mar 30 18:55:07 UTC 2026","passed","Mon Mar 30 18:55:07 UTC 2026","","Go Test","github.com/specterops/bloodhound/cmd/api/src/database/types/null/TestIntEqual","TestIntEqual"
"","43","displays the checkbox as checked if the filter params value is 'true'","AssetGroupEdit","Mon Mar 30 18:57:18 UTC 2026","passed","Mon Mar 30 18:57:18 UTC 2026","","Custom Member checkbox filter","",""
"Test cases for TestManagementResource_ListAuthTokens_NonAdmin","0","TestManagementResource_ListAuthTokens_NonAdmin","","Mon Mar 30 18:55:33 UTC 2026","passed","Mon Mar 30 18:55:33 UTC 2026","","Go Test","github.com/specterops/bloodhound/cmd/api/src/api/v2/auth/TestManagementResource_ListAuthTokens_NonAdmin","TestManagementResource_ListAuthTokens_NonAdmin"
"","0","should handle an entity that has an empty name property","Evaluating the entity display name from a given entity","Mon Mar 30 18:57:13 UTC 2026","passed","Mon Mar 30 18:57:13 UTC 2026","","","",""
"Test cases for TestExpireUserAuthSecret_Success","0","TestExpireUserAuthSecret_Success","","Mon Mar 30 18:55:09 UTC 2026","passed","Mon Mar 30 18:55:09 UTC 2026","","Go Test","github.com/specterops/bloodhound/cmd/api/src/api/v2/auth/TestExpireUserAuthSecret_Success","TestExpireUserAuthSecret_Success"
"","1","runs a cypher search when the query param is set to ""cypher""","useExploreGraph","Mon Mar 30 18:56:40 UTC 2026","passed","Mon Mar 30 18:56:40 UTC 2026","","exploreGraphQueryFactory","",""
"Test cases for TestIngestJobs_ValidFilters","0","TestIngestJobs_ValidFilters","","Mon Mar 30 18:55:07 UTC 2026","passed","Mon Mar 30 18:55:07 UTC 2026","","Go Test","github.com/specterops/bloodhound/cmd/api/src/model/TestIngestJobs_ValidFilters","TestIngestJobs_ValidFilters"
"Test cases for TestTextUnmarshalInt64","0","TestTextUnmarshalInt64","","Mon Mar 30 18:55:07 UTC 2026","passed","Mon Mar 30 18:55:07 UTC 2026","","Go Test","github.com/specterops/bloodhound/cmd/api/src/database/types/null/TestTextUnmarshalInt64","TestTextUnmarshalInt64"
"Test cases for TestResources_ExportSavedQueries","16","TestResources_ExportSavedQueries","","Mon Mar 30 18:55:03 UTC 2026","passed","Mon Mar 30 18:55:03 UTC 2026","","Go Test","github.com/specterops/bloodhound/cmd/api/src/api/v2/TestResources_ExportSavedQueries","TestResources_ExportSavedQueries"
"","260","sets the calendar date to match the valid","ManagedDatePicker - value","Mon Mar 30 18:58:30 UTC 2026","passed","Mon Mar 30 18:58:30 UTC 2026","","","",""
"","848","calls the passed in cancel handler when clicking the Cancel button","Glyph Select Dialog","Mon Mar 30 19:00:19 UTC 2026","passed","Mon Mar 30 19:00:20 UTC 2026","","","",""
"","3885","Typing in the search bar filters the results","ExploreTable","Mon Mar 30 18:56:03 UTC 2026","passed","Mon Mar 30 18:56:07 UTC 2026","","","",""
"Test cases for TestResources_ListADDomainContainedComputers","5","TestResources_ListADDomainContainedComputers","","Mon Mar 30 18:55:02 UTC 2026","passed","Mon Mar 30 18:55:02 UTC 2026","","Go Test","github.com/specterops/bloodhound/cmd/api/src/api/v2/TestResources_ListADDomainContainedComputers","TestResources_ListADDomainContainedComputers"
"","663","calls onSave when valid form inputs are provided","PasswordDialog","Mon Mar 30 18:56:36 UTC 2026","passed","Mon Mar 30 18:56:36 UTC 2026","","","",""
"","4339","should render","Pathfinding","Mon Mar 30 18:57:34 UTC 2026","passed","Mon Mar 30 18:57:38 UTC 2026","","","",""
"Test cases for TestTagScanner_NextTopLevelTag","0","TestTagScanner_NextTopLevelTag","","Mon Mar 30 18:55:13 UTC 2026","passed","Mon Mar 30 18:55:13 UTC 2026","","Go Test","github.com/specterops/bloodhound/cmd/api/src/services/upload/TestTagScanner_NextTopLevelTag","TestTagScanner_NextTopLevelTag"
"","443","filters by the selected user","FileIngestFilterDialog","Mon Mar 30 18:56:57 UTC 2026","passed","Mon Mar 30 18:56:58 UTC 2026","","User Select","",""
"","13","when there is no ID in the URL and no tags available, no ID is returned (it is undefined)","usePZQueryParams","Mon Mar 30 18:58:53 UTC 2026","passed","Mon Mar 30 18:58:53 UTC 2026","","","",""
"Test cases for TestManagementResource_ListRoles_PredicateMismatchWithColumn","1","TestManagementResource_ListRoles_PredicateMismatchWithColumn","","Mon Mar 30 18:55:09 UTC 2026","passed","Mon Mar 30 18:55:09 UTC 2026","","Go Test","github.com/specterops/bloodhound/cmd/api/src/api/v2/auth/TestManagementResource_ListRoles_PredicateMismatchWithColumn","TestManagementResource_ListRoles_PredicateMismatchWithColumn"
"","288","The reset password and two-factor authentication options should not appear in profile page if the user is configured for SAML login","UserProfile with SSO User","Mon Mar 30 18:57:28 UTC 2026","passed","Mon Mar 30 18:57:28 UTC 2026","","","",""
"","26","sets autoDisplayTable to false if query returns no results","useExploreTableAutoDisplay","Mon Mar 30 18:59:41 UTC 2026","passed","Mon Mar 30 18:59:41 UTC 2026","","","",""
"Test cases for TestManagementResource_ListPermissions_InvalidFilterPredicate","0","TestManagementResource_ListPermissions_InvalidFilterPredicate","","Mon Mar 30 18:55:09 UTC 2026","passed","Mon Mar 30 18:55:09 UTC 2026","","Go Test","github.com/specterops/bloodhound/cmd/api/src/api/v2/auth/TestManagementResource_ListPermissions_InvalidFilterPredicate","TestManagementResource_ListPermissions_InvalidFilterPredicate"
"","220","toggles a child off","SourceKindsCheckboxes","Mon Mar 30 18:58:01 UTC 2026","passed","Mon Mar 30 18:58:02 UTC 2026","","","",""
"","154","has the correct value for the links in the breadcrumbs","Create Update pages","Mon Mar 30 18:59:37 UTC 2026","passed","Mon Mar 30 18:59:37 UTC 2026","","","",""
"Test cases for TestNewAuditLog_BadAuthContext","0","TestNewAuditLog_BadAuthContext","","Mon Mar 30 18:55:05 UTC 2026","passed","Mon Mar 30 18:55:05 UTC 2026","","Go Test","github.com/specterops/bloodhound/cmd/api/src/database/TestNewAuditLog_BadAuthContext","TestNewAuditLog_BadAuthContext"
"Test cases for TestNewAuditLog_Error","0","TestNewAuditLog_Error","","Mon Mar 30 18:55:05 UTC 2026","passed","Mon Mar 30 18:55:05 UTC 2026","","Go Test","github.com/specterops/bloodhound/cmd/api/src/database/TestNewAuditLog_Error","TestNewAuditLog_Error"
"","0","returns false for arrays with different object references","areArraysSimilar","Mon Mar 30 19:00:22 UTC 2026","passed","Mon Mar 30 19:00:22 UTC 2026","","","",""
"Test cases for TestResources_ListADCSEscalations","3","TestResources_ListADCSEscalations","","Mon Mar 30 18:55:03 UTC 2026","passed","Mon Mar 30 18:55:03 UTC 2026","","Go Test","github.com/specterops/bloodhound/cmd/api/src/api/v2/TestResources_ListADCSEscalations","TestResources_ListADCSEscalations"
"","35","is disabled if no filters are active","AssetGroupEdit","Mon Mar 30 18:57:19 UTC 2026","passed","Mon Mar 30 18:57:19 UTC 2026","","Clear Filters button","",""
"","0","should hide/expand search widget when user clicks minus/plus button","ExploreSearch rendering per tab","Mon Mar 30 19:01:57 UTC 2026","unknown","Mon Mar 30 19:01:57 UTC 2026","","","",""
"Test cases for Test_ValidateGraph","20","Test_ValidateGraph","","Mon Mar 30 18:55:13 UTC 2026","passed","Mon Mar 30 18:55:13 UTC 2026","","Go Test","github.com/specterops/bloodhound/cmd/api/src/services/upload/Test_ValidateGraph","Test_ValidateGraph"
"","404","should disable Cancel and Save buttons while isLoading is true","CreateUserDialog","Mon Mar 30 18:56:39 UTC 2026","passed","Mon Mar 30 18:56:39 UTC 2026","","","",""
"Test cases for TestGenericClone","0","TestGenericClone","","Mon Mar 30 18:55:28 UTC 2026","passed","Mon Mar 30 18:55:28 UTC 2026","","Go Test","github.com/specterops/bloodhound/cmd/api/src/utils/TestGenericClone","TestGenericClone"
"","307","displays a completion of 100% and adds a ""Close"" button that closes the dialog after a successful upload","SchemaUploadDialog","Mon Mar 30 18:57:16 UTC 2026","passed","Mon Mar 30 18:57:16 UTC 2026","","","",""
"Test cases for Test_SetDependency","0","Test_SetDependency","","Mon Mar 30 18:55:30 UTC 2026","passed","Mon Mar 30 18:55:30 UTC 2026","","Go Test","github.com/specterops/bloodhound/packages/go/lab/Test_SetDependency","Test_SetDependency"
"","66","applies the given filters","useFinishedJobs","Mon Mar 30 18:58:05 UTC 2026","passed","Mon Mar 30 18:58:05 UTC 2026","","","",""
"Test cases for TestResources_DeleteSavedQuery_NotAUserAuth","0","TestResources_DeleteSavedQuery_NotAUserAuth","","Mon Mar 30 18:55:03 UTC 2026","passed","Mon Mar 30 18:55:03 UTC 2026","","Go Test","github.com/specterops/bloodhound/cmd/api/src/api/v2/TestResources_DeleteSavedQuery_NotAUserAuth","TestResources_DeleteSavedQuery_NotAUserAuth"
"","134","renders a button for opening the dialog","SchemaUploadDialog","Mon Mar 30 18:57:15 UTC 2026","passed","Mon Mar 30 18:57:15 UTC 2026","","","",""
"Test cases for TestAuth_CreateSSOSession","0","TestAuth_CreateSSOSession","","Mon Mar 30 18:55:03 UTC 2026","passed","Mon Mar 30 18:55:03 UTC 2026","","Go Test","github.com/specterops/bloodhound/cmd/api/src/api/v2/auth/TestAuth_CreateSSOSession","TestAuth_CreateSSOSession"
"Test cases for TestWriteResponseWrapperWithTimeWindowAndPagination","0","TestWriteResponseWrapperWithTimeWindowAndPagination","","Mon Mar 30 18:54:52 UTC 2026","passed","Mon Mar 30 18:54:52 UTC 2026","","Go Test","github.com/specterops/bloodhound/cmd/api/src/api/TestWriteResponseWrapperWithTimeWindowAndPagination","TestWriteResponseWrapperWithTimeWindowAndPagination"
"Test cases for TestGenericMap","0","TestGenericMap","","Mon Mar 30 18:55:28 UTC 2026","passed","Mon Mar 30 18:55:28 UTC 2026","","Go Test","github.com/specterops/bloodhound/cmd/api/src/utils/TestGenericMap","TestGenericMap"
"","50","uses the discardQueryParams prop to discard all query params on the link","AppLink","Mon Mar 30 18:58:57 UTC 2026","passed","Mon Mar 30 18:58:57 UTC 2026","","","",""
"","0","returns empty array when combined filters match nothing","filterAndSearchEnvironments","Mon Mar 30 18:56:18 UTC 2026","passed","Mon Mar 30 18:56:18 UTC 2026","","combined filters","",""
"Test cases for Test_AuthMiddleware","0","Test_AuthMiddleware","","Mon Mar 30 18:54:55 UTC 2026","passed","Mon Mar 30 18:54:55 UTC 2026","","Go Test","github.com/specterops/bloodhound/cmd/api/src/api/middleware/Test_AuthMiddleware","Test_AuthMiddleware"
"Test cases for Test_formatSearchResults_limit","0","Test_formatSearchResults_limit","","Mon Mar 30 18:55:08 UTC 2026","passed","Mon Mar 30 18:55:08 UTC 2026","","Go Test","github.com/specterops/bloodhound/cmd/api/src/queries/Test_formatSearchResults_limit","Test_formatSearchResults_limit"
"Test cases for TestOpenGraphSchemaService_ListExtensions","2","TestOpenGraphSchemaService_ListExtensions","","Mon Mar 30 18:55:11 UTC 2026","passed","Mon Mar 30 18:55:11 UTC 2026","","Go Test","github.com/specterops/bloodhound/cmd/api/src/services/opengraphschema/TestOpenGraphSchemaService_ListExtensions","TestOpenGraphSchemaService_ListExtensions"
"","674","does not allow confirmation while dates are invalid","FileIngestFilterDialog","Mon Mar 30 18:56:56 UTC 2026","passed","Mon Mar 30 18:56:57 UTC 2026","","Date Range Inputs","",""
"Test cases for TestArgon2Digest_Validate","5","TestArgon2Digest_Validate","","Mon Mar 30 18:55:29 UTC 2026","passed","Mon Mar 30 18:55:29 UTC 2026","","Go Test","github.com/specterops/bloodhound/packages/go/crypto/TestArgon2Digest_Validate","TestArgon2Digest_Validate"
"Test cases for TestDisenrollMFA_Admin_SuccessNoPasswordSSO","1515","TestDisenrollMFA_Admin_SuccessNoPasswordSSO","","Mon Mar 30 18:55:43 UTC 2026","passed","Mon Mar 30 18:55:44 UTC 2026","","Go Test","github.com/specterops/bloodhound/cmd/api/src/api/v2/auth/TestDisenrollMFA_Admin_SuccessNoPasswordSSO","TestDisenrollMFA_Admin_SuccessNoPasswordSSO"
"","26","sets input text to value","ManagedDatePicker - value","Mon Mar 30 18:58:30 UTC 2026","passed","Mon Mar 30 18:58:30 UTC 2026","","","",""
