"DESCRIPTION","DURATION IN MS","NAME","PARENT SUITE","START TIME","STATUS","STOP TIME","SUB SUITE","SUITE","TEST CLASS","TEST METHOD"
"","140","Calls the `Base` endpoint for a LocalGroup type node","EntityObjectInformation","Mon Mar 30 18:58:27 UTC 2026","passed","Mon Mar 30 18:58:27 UTC 2026","","","",""
"","7","should not render if open === false","ConfirmUpdateQueryDialog","Mon Mar 30 19:00:20 UTC 2026","passed","Mon Mar 30 19:00:20 UTC 2026","","","",""
"","135","should display the ""My Profile"" title","UserProfile","Mon Mar 30 18:57:28 UTC 2026","passed","Mon Mar 30 18:57:29 UTC 2026","","","",""
"","63","when `selectedItem` is provided, the combobox displays the icon","icon rendering","Mon Mar 30 18:57:24 UTC 2026","passed","Mon Mar 30 18:57:24 UTC 2026","","","",""
"Test cases for TestResources_ListADComputerSessions","1","TestResources_ListADComputerSessions","","Mon Mar 30 18:55:02 UTC 2026","passed","Mon Mar 30 18:55:02 UTC 2026","","Go Test","github.com/specterops/bloodhound/cmd/api/src/api/v2/TestResources_ListADComputerSessions","TestResources_ListADComputerSessions"
"Test cases for TestContextMiddlewareBypassEnabled","0","TestContextMiddlewareBypassEnabled","","Mon Mar 30 18:54:55 UTC 2026","passed","Mon Mar 30 18:54:55 UTC 2026","","Go Test","github.com/specterops/bloodhound/cmd/api/src/api/middleware/TestContextMiddlewareBypassEnabled","TestContextMiddlewareBypassEnabled"
"","287","Trying to view the edge info does not crash the app when selecting an unrecognized edge","EdgeInfoContent","Mon Mar 30 18:56:22 UTC 2026","passed","Mon Mar 30 18:56:22 UTC 2026","","","",""
"","179","does not make feature-flag request if user is not fully authenticated","app","Mon Mar 30 19:01:41 UTC 2026","passed","Mon Mar 30 19:01:41 UTC 2026","","<Inner />","",""
"","79","composes search params from the search prop and use them in the link","AppLink","Mon Mar 30 18:58:57 UTC 2026","passed","Mon Mar 30 18:58:57 UTC 2026","","","",""
"","627","renders a list of asset group members","GroupManagement","Mon Mar 30 19:01:32 UTC 2026","passed","Mon Mar 30 19:01:32 UTC 2026","","","",""
"Test cases for TestGenerateTOTPSecret","1","TestGenerateTOTPSecret","","Mon Mar 30 18:55:03 UTC 2026","passed","Mon Mar 30 18:55:03 UTC 2026","","Go Test","github.com/specterops/bloodhound/cmd/api/src/auth/TestGenerateTOTPSecret","TestGenerateTOTPSecret"
"","0","handles environment with impactValue of 0","filterAndSearchEnvironments","Mon Mar 30 18:56:18 UTC 2026","passed","Mon Mar 30 18:56:18 UTC 2026","","edge cases","",""
"Test cases for TestResources_GetPathfindingResult","10","TestResources_GetPathfindingResult","","Mon Mar 30 18:55:03 UTC 2026","passed","Mon Mar 30 18:55:03 UTC 2026","","Go Test","github.com/specterops/bloodhound/cmd/api/src/api/v2/TestResources_GetPathfindingResult","TestResources_GetPathfindingResult"
"Test cases for Test_CheckAccessToEnvironments","93","Test_CheckAccessToEnvironments","","Mon Mar 30 18:55:03 UTC 2026","passed","Mon Mar 30 18:55:03 UTC 2026","","Go Test","github.com/specterops/bloodhound/cmd/api/src/api/v2/Test_CheckAccessToEnvironments","Test_CheckAccessToEnvironments"
"","334","renders a graph if the query has any node edges","GraphView","Mon Mar 30 19:01:32 UTC 2026","passed","Mon Mar 30 19:01:33 UTC 2026","","","",""
"","241","calls onLayoutChange with the selected layout","GraphControls","Mon Mar 30 18:56:47 UTC 2026","passed","Mon Mar 30 18:56:48 UTC 2026","","Selecting a layout","",""
"","144","displays a table of completed ingest logs","FileIngest","Mon Mar 30 18:59:52 UTC 2026","passed","Mon Mar 30 18:59:52 UTC 2026","","","",""
"Test cases for TestWriteAndValidateJSON_NormalizationError","10","TestWriteAndValidateJSON_NormalizationError","","Mon Mar 30 18:55:13 UTC 2026","passed","Mon Mar 30 18:55:13 UTC 2026","","Go Test","github.com/specterops/bloodhound/cmd/api/src/services/upload/TestWriteAndValidateJSON_NormalizationError","TestWriteAndValidateJSON_NormalizationError"
"","191","navigates to previous history entry when warning dialog is cancelled","EarlyAccessFeatures","Mon Mar 30 19:01:32 UTC 2026","passed","Mon Mar 30 19:01:33 UTC 2026","","","",""
"","7","applies animation class to the title","ProcessingIndicator","Mon Mar 30 19:00:45 UTC 2026","passed","Mon Mar 30 19:00:45 UTC 2026","","","",""
"","152","calls onSort when clicked","ColumnHeaders","Mon Mar 30 18:58:32 UTC 2026","passed","Mon Mar 30 18:58:32 UTC 2026","","SortableHeader","",""
"","4","returns paramValue if it is one of the expected values","useExploreParams","Mon Mar 30 19:00:49 UTC 2026","passed","Mon Mar 30 19:00:49 UTC 2026","","parseSearchType","",""
"","241","renders correctly with requiresCurrentPassword true","PasswordDialog","Mon Mar 30 18:56:31 UTC 2026","passed","Mon Mar 30 18:56:31 UTC 2026","","","",""
"Test cases for Test_ParseGraphSortParameters_Success","0","Test_ParseGraphSortParameters_Success","","Mon Mar 30 18:54:52 UTC 2026","passed","Mon Mar 30 18:54:52 UTC 2026","","Go Test","github.com/specterops/bloodhound/cmd/api/src/api/Test_ParseGraphSortParameters_Success","Test_ParseGraphSortParameters_Success"
"","9","should render when search string matches text entirely","HighlightedText","Mon Mar 30 18:59:58 UTC 2026","passed","Mon Mar 30 18:59:58 UTC 2026","","","",""
"","146","displays Force Password Reset checkbox when showNeedsPasswordReset is true","PasswordDialog","Mon Mar 30 18:56:31 UTC 2026","passed","Mon Mar 30 18:56:31 UTC 2026","","","",""
"","246","should render action list item that handles a function","MainNav","Mon Mar 30 18:56:47 UTC 2026","passed","Mon Mar 30 18:56:47 UTC 2026","","","",""
"Test cases for TestResources_CreateSavedQuery_CreateFailure","0","TestResources_CreateSavedQuery_CreateFailure","","Mon Mar 30 18:55:03 UTC 2026","passed","Mon Mar 30 18:55:03 UTC 2026","","Go Test","github.com/specterops/bloodhound/cmd/api/src/api/v2/TestResources_CreateSavedQuery_CreateFailure","TestResources_CreateSavedQuery_CreateFailure"
"","46","has no checked boxes by default","SourceKindsCheckboxes","Mon Mar 30 18:58:00 UTC 2026","passed","Mon Mar 30 18:58:00 UTC 2026","","","",""
"","10","allows you to cancel filter updates before applying them to the url and reset to the default filter state","usePathfindingFilters","Mon Mar 30 19:00:08 UTC 2026","passed","Mon Mar 30 19:00:08 UTC 2026","","","",""
"Test cases for TestResources_CypherQuery","112","TestResources_CypherQuery","","Mon Mar 30 18:55:03 UTC 2026","passed","Mon Mar 30 18:55:03 UTC 2026","","Go Test","github.com/specterops/bloodhound/cmd/api/src/api/v2/TestResources_CypherQuery","TestResources_CypherQuery"
"Test cases for TestManagementResource_GetSAMLProvider","12","TestManagementResource_GetSAMLProvider","","Mon Mar 30 18:55:48 UTC 2026","passed","Mon Mar 30 18:55:48 UTC 2026","","Go Test","github.com/specterops/bloodhound/cmd/api/src/api/v2/auth/TestManagementResource_GetSAMLProvider","TestManagementResource_GetSAMLProvider"
"Test cases for TestMarshalInt","0","TestMarshalInt","","Mon Mar 30 18:55:07 UTC 2026","passed","Mon Mar 30 18:55:07 UTC 2026","","Go Test","github.com/specterops/bloodhound/cmd/api/src/database/types/null/TestMarshalInt","TestMarshalInt"
"Test cases for TestResources_DeleteSavedQuery_RecordNotFound_EdgeCase","0","TestResources_DeleteSavedQuery_RecordNotFound_EdgeCase","","Mon Mar 30 18:55:03 UTC 2026","passed","Mon Mar 30 18:55:03 UTC 2026","","Go Test","github.com/specterops/bloodhound/cmd/api/src/api/v2/TestResources_DeleteSavedQuery_RecordNotFound_EdgeCase","TestResources_DeleteSavedQuery_RecordNotFound_EdgeCase"
"Test cases for TestServeHTTP_Success","0","TestServeHTTP_Success","","Mon Mar 30 18:54:55 UTC 2026","passed","Mon Mar 30 18:54:55 UTC 2026","","Go Test","github.com/specterops/bloodhound/cmd/api/src/api/middleware/TestServeHTTP_Success","TestServeHTTP_Success"
"Test cases for TestTextUnmarshalFloat","0","TestTextUnmarshalFloat","","Mon Mar 30 18:55:07 UTC 2026","passed","Mon Mar 30 18:55:07 UTC 2026","","Go Test","github.com/specterops/bloodhound/cmd/api/src/database/types/null/TestTextUnmarshalFloat","TestTextUnmarshalFloat"
"","367","renders the Rule Tab content when Rule tab is chosen","Selected Details Tab Content","Mon Mar 30 18:59:54 UTC 2026","passed","Mon Mar 30 18:59:55 UTC 2026","","","",""
"","215","opens and closes the dialog with the cancel button","Tag Form","Mon Mar 30 18:56:09 UTC 2026","passed","Mon Mar 30 18:56:09 UTC 2026","","","",""
"Test cases for Test_TopLevel","1","Test_TopLevel","","Mon Mar 30 18:55:41 UTC 2026","passed","Mon Mar 30 18:55:41 UTC 2026","","Go Test","github.com/specterops/bloodhound/packages/go/schemagen/csgen/Test_TopLevel","Test_TopLevel"
"","1522","Clicking header allows user to sort by column","ExploreTable","Mon Mar 30 18:56:01 UTC 2026","passed","Mon Mar 30 18:56:03 UTC 2026","","","",""
"Test cases for TestAssetGroupMembers_BuildFilteringConditional_Error","0","TestAssetGroupMembers_BuildFilteringConditional_Error","","Mon Mar 30 18:54:51 UTC 2026","passed","Mon Mar 30 18:54:51 UTC 2026","","Go Test","github.com/specterops/bloodhound/cmd/api/src/api/TestAssetGroupMembers_BuildFilteringConditional_Error","TestAssetGroupMembers_BuildFilteringConditional_Error"
"","1685","""Columns"" button allows user to edit column settings","ExploreTable","Mon Mar 30 18:55:59 UTC 2026","passed","Mon Mar 30 18:56:01 UTC 2026","","","",""
"Test cases for TestResources_PreviewSelectors","3","TestResources_PreviewSelectors","","Mon Mar 30 18:55:03 UTC 2026","passed","Mon Mar 30 18:55:03 UTC 2026","","Go Test","github.com/specterops/bloodhound/cmd/api/src/api/v2/TestResources_PreviewSelectors","TestResources_PreviewSelectors"
"","0","should handle an entity that has no name property","Evaluating the entity display name from a given entity","Mon Mar 30 18:57:13 UTC 2026","passed","Mon Mar 30 18:57:13 UTC 2026","","","",""
"Test cases for TestStringValueOrZero","0","TestStringValueOrZero","","Mon Mar 30 18:55:07 UTC 2026","passed","Mon Mar 30 18:55:07 UTC 2026","","Go Test","github.com/specterops/bloodhound/cmd/api/src/database/types/null/TestStringValueOrZero","TestStringValueOrZero"
"","1","should return the edge parts from the key","getEdgeDataFromKey","Mon Mar 30 19:01:50 UTC 2026","passed","Mon Mar 30 19:01:50 UTC 2026","","","",""
"","1","adds email filter if madeBy contains ""@""","createHistoryParams","Mon Mar 30 18:59:45 UTC 2026","passed","Mon Mar 30 18:59:45 UTC 2026","","","",""
"","206","renders a confirm dialg","ConfirmDeleteQueryDialog","Mon Mar 30 19:00:36 UTC 2026","passed","Mon Mar 30 19:00:36 UTC 2026","","","",""
"","102","disables items via itemDisabled and hides the chevron icon visually","<DetailsAccordion />","Mon Mar 30 18:57:02 UTC 2026","passed","Mon Mar 30 18:57:02 UTC 2026","","","",""
"Test cases for Test_ParseGraphSortParameters_InvalidSortColumn","0","Test_ParseGraphSortParameters_InvalidSortColumn","","Mon Mar 30 18:54:52 UTC 2026","passed","Mon Mar 30 18:54:52 UTC 2026","","Go Test","github.com/specterops/bloodhound/cmd/api/src/api/Test_ParseGraphSortParameters_InvalidSortColumn","Test_ParseGraphSortParameters_InvalidSortColumn"
"","61","shows an error notification if there is an error fetching","useFinishedJobs","Mon Mar 30 18:58:05 UTC 2026","passed","Mon Mar 30 18:58:05 UTC 2026","","","",""
"","6","shows the collection methods for the given job","toCollected","Mon Mar 30 19:00:18 UTC 2026","passed","Mon Mar 30 19:00:18 UTC 2026","","","",""
"","1","should compute coordinates along a quadratic bezier curve for a given t value","bezier","Mon Mar 30 19:01:35 UTC 2026","passed","Mon Mar 30 19:01:35 UTC 2026","","","",""
"","605","should call onSubmit when input is valid and Submit button is clicked","UpsertSAMLProviderForm","Mon Mar 30 18:59:30 UTC 2026","passed","Mon Mar 30 18:59:31 UTC 2026","","","",""
"Test cases for TestToolContainer_GetScheduledAnalysisConfiguration_Errors","2","TestToolContainer_GetScheduledAnalysisConfiguration_Errors","","Mon Mar 30 18:54:55 UTC 2026","passed","Mon Mar 30 18:54:55 UTC 2026","","Go Test","github.com/specterops/bloodhound/cmd/api/src/api/tools/TestToolContainer_GetScheduledAnalysisConfiguration_Errors","TestToolContainer_GetScheduledAnalysisConfiguration_Errors"
"","0","No type was provided and no results were available","Getting the text for the disabled item display for a search when there are no results","Mon Mar 30 18:58:40 UTC 2026","passed","Mon Mar 30 18:58:40 UTC 2026","","Empty data states","",""
"Test cases for TestResources_ListADComputerPSRemoteUsers","1","TestResources_ListADComputerPSRemoteUsers","","Mon Mar 30 18:55:02 UTC 2026","passed","Mon Mar 30 18:55:02 UTC 2026","","Go Test","github.com/specterops/bloodhound/cmd/api/src/api/v2/TestResources_ListADComputerPSRemoteUsers","TestResources_ListADComputerPSRemoteUsers"
"","1115","renders","Privilege Zones History Filter Dialog","Mon Mar 30 18:58:07 UTC 2026","passed","Mon Mar 30 18:58:08 UTC 2026","","","",""
"","10","does not render highlight for non-active tag","SelectedHighlight","Mon Mar 30 18:59:50 UTC 2026","passed","Mon Mar 30 18:59:50 UTC 2026","","","",""
"Test cases for TestResources_ListRootCAPKIHierarchy","0","TestResources_ListRootCAPKIHierarchy","","Mon Mar 30 18:55:03 UTC 2026","passed","Mon Mar 30 18:55:03 UTC 2026","","Go Test","github.com/specterops/bloodhound/cmd/api/src/api/v2/TestResources_ListRootCAPKIHierarchy","TestResources_ListRootCAPKIHierarchy"
"Copyright 2021 The Go Authors. All rights reserved.TestConcat was ripped from go1.22 source and should be replaced with the stdlib implementation when we move to 1.22Original source: https:","2","TestConcat","","Mon Mar 30 18:55:42 UTC 2026","passed","Mon Mar 30 18:55:42 UTC 2026","","Go Test","github.com/specterops/bloodhound/packages/go/slicesext/TestConcat","TestConcat"
"","322","renders total rules and accordion sections","RulesAccordion","Mon Mar 30 18:58:44 UTC 2026","passed","Mon Mar 30 18:58:44 UTC 2026","","","",""
"Test cases for TestFoldr","1","TestFoldr","","Mon Mar 30 18:55:42 UTC 2026","passed","Mon Mar 30 18:55:42 UTC 2026","","Go Test","github.com/specterops/bloodhound/packages/go/slicesext/TestFoldr","TestFoldr"
"Test cases for TestManagementResource_ListPermissions_PredicateMismatchWithColumn","0","TestManagementResource_ListPermissions_PredicateMismatchWithColumn","","Mon Mar 30 18:55:09 UTC 2026","passed","Mon Mar 30 18:55:09 UTC 2026","","Go Test","github.com/specterops/bloodhound/cmd/api/src/api/v2/auth/TestManagementResource_ListPermissions_PredicateMismatchWithColumn","TestManagementResource_ListPermissions_PredicateMismatchWithColumn"
"Test cases for TestBoolIsZero","0","TestBoolIsZero","","Mon Mar 30 18:55:07 UTC 2026","passed","Mon Mar 30 18:55:07 UTC 2026","","Go Test","github.com/specterops/bloodhound/cmd/api/src/database/types/null/TestBoolIsZero","TestBoolIsZero"
"","171","renders the QuerySearchFilter component","QuerySearchFilter","Mon Mar 30 18:58:50 UTC 2026","passed","Mon Mar 30 18:58:50 UTC 2026","","","",""
"Test cases for Test_filterNodesToSearchResult_default","0","Test_filterNodesToSearchResult_default","","Mon Mar 30 18:55:08 UTC 2026","passed","Mon Mar 30 18:55:08 UTC 2026","","Go Test","github.com/specterops/bloodhound/cmd/api/src/queries/Test_filterNodesToSearchResult_default","Test_filterNodesToSearchResult_default"
"Test cases for TestManagementResource_UpdateUser_ETAC","3626","TestManagementResource_UpdateUser_ETAC","","Mon Mar 30 18:55:30 UTC 2026","passed","Mon Mar 30 18:55:33 UTC 2026","","Go Test","github.com/specterops/bloodhound/cmd/api/src/api/v2/auth/TestManagementResource_UpdateUser_ETAC","TestManagementResource_UpdateUser_ETAC"
"Test cases for TestResources_ListAuditLogs_OnlySkip","0","TestResources_ListAuditLogs_OnlySkip","","Mon Mar 30 18:55:03 UTC 2026","passed","Mon Mar 30 18:55:03 UTC 2026","","Go Test","github.com/specterops/bloodhound/cmd/api/src/api/v2/TestResources_ListAuditLogs_OnlySkip","TestResources_ListAuditLogs_OnlySkip"
"Test cases for TestCopyMatchExpressionsSorted","1","TestCopyMatchExpressionsSorted","","Mon Mar 30 18:55:10 UTC 2026","passed","Mon Mar 30 18:55:10 UTC 2026","","Go Test","github.com/specterops/bloodhound/cmd/api/src/services/graphify/endpoint/TestCopyMatchExpressionsSorted","TestCopyMatchExpressionsSorted"
"","285","renders a list of pre-built searches","PrebuiltSearchList","Mon Mar 30 18:59:07 UTC 2026","passed","Mon Mar 30 18:59:07 UTC 2026","","","",""
"","295","should handle close event","TagToZoneLabelDialog","Mon Mar 30 18:58:39 UTC 2026","passed","Mon Mar 30 18:58:39 UTC 2026","","","",""
"","761","should display all available roles","CreateUserDialog","Mon Mar 30 18:56:37 UTC 2026","passed","Mon Mar 30 18:56:37 UTC 2026","","","",""
"","588","should render inputs, labels, and action buttons","UpsertSAMLProviderForm","Mon Mar 30 18:59:29 UTC 2026","passed","Mon Mar 30 18:59:30 UTC 2026","","","",""
"Test cases for TestResources_ListADDomainContainedUsers","3","TestResources_ListADDomainContainedUsers","","Mon Mar 30 18:55:02 UTC 2026","passed","Mon Mar 30 18:55:02 UTC 2026","","Go Test","github.com/specterops/bloodhound/cmd/api/src/api/v2/TestResources_ListADDomainContainedUsers","TestResources_ListADDomainContainedUsers"
"","0","An unknown error occurred when fetching the data","Getting the text for the disabled item display for a search when there are no results","Mon Mar 30 18:58:40 UTC 2026","passed","Mon Mar 30 18:58:40 UTC 2026","","Error states","",""
"","432","should call performSearch on keyboard press alt+R","CypherSearch","Mon Mar 30 18:58:19 UTC 2026","passed","Mon Mar 30 18:58:20 UTC 2026","","","",""
"","54","links to the specified route with global params intact when triggered by a splat route","AppLink","Mon Mar 30 18:58:57 UTC 2026","passed","Mon Mar 30 18:58:57 UTC 2026","","","",""
"Test cases for TestResources_ListUsersMinimal","10","TestResources_ListUsersMinimal","","Mon Mar 30 18:55:48 UTC 2026","passed","Mon Mar 30 18:55:48 UTC 2026","","Go Test","github.com/specterops/bloodhound/cmd/api/src/api/v2/auth/TestResources_ListUsersMinimal","TestResources_ListUsersMinimal"
"","16","does not render the tooltip icon when tooltipText prop is not passed","ColumnHeaders","Mon Mar 30 18:58:32 UTC 2026","passed","Mon Mar 30 18:58:32 UTC 2026","","SortableHeader with Tooltip","",""
"","0","returns false if value is 'array'","searchParams","Mon Mar 30 18:59:11 UTC 2026","passed","Mon Mar 30 18:59:11 UTC 2026","","isEmptyParam","",""
"","0","A type and keyword were provided but there were no results available","Getting the text for the disabled item display for a search when there are no results","Mon Mar 30 18:58:40 UTC 2026","passed","Mon Mar 30 18:58:40 UTC 2026","","Empty data states","",""
"","466","handles removing from a tier zero asset group","AssetGroupMenuItem","Mon Mar 30 19:01:12 UTC 2026","passed","Mon Mar 30 19:01:12 UTC 2026","","removing from an asset group","",""
"Test cases for TestActivateMFA_Success","643","TestActivateMFA_Success","","Mon Mar 30 18:55:47 UTC 2026","passed","Mon Mar 30 18:55:48 UTC 2026","","Go Test","github.com/specterops/bloodhound/cmd/api/src/api/v2/auth/TestActivateMFA_Success","TestActivateMFA_Success"
"Test cases for TestManagementResource_GetPermission","38896","TestManagementResource_GetPermission","","Mon Mar 30 18:55:09 UTC 2026","passed","Mon Mar 30 18:55:48 UTC 2026","","Go Test","github.com/specterops/bloodhound/cmd/api/src/api/v2/auth/TestManagementResource_GetPermission","TestManagementResource_GetPermission"
"","111","renders a dash when actor is BloodHoundString","NoteCell component","Mon Mar 30 18:59:22 UTC 2026","passed","Mon Mar 30 18:59:22 UTC 2026","","","",""
"","446","filters by the selected date range","FileIngestFilterDialog","Mon Mar 30 18:56:56 UTC 2026","passed","Mon Mar 30 18:56:56 UTC 2026","","Date Range Inputs","",""
"","81","sets primarySearch, searchType, exploreSearchTab in URL params when the click handler is executed","useEdgeInfoItems","Mon Mar 30 18:58:56 UTC 2026","passed","Mon Mar 30 18:58:56 UTC 2026","","","",""
"","125","shows formatted expiration date (yyyy-MM-dd) when expires_at is set","UserTokenManagementDialog - API Expiration Date column","Mon Mar 30 18:57:05 UTC 2026","passed","Mon Mar 30 18:57:05 UTC 2026","","","",""
"Test cases for TestConvertOUToNode_InheritanceHashes","1","TestConvertOUToNode_InheritanceHashes","","Mon Mar 30 18:55:29 UTC 2026","passed","Mon Mar 30 18:55:29 UTC 2026","","Go Test","github.com/specterops/bloodhound/packages/go/ein/TestConvertOUToNode_InheritanceHashes","TestConvertOUToNode_InheritanceHashes"
"Test cases for TestBoolPointer","0","TestBoolPointer","","Mon Mar 30 18:55:07 UTC 2026","passed","Mon Mar 30 18:55:07 UTC 2026","","Go Test","github.com/specterops/bloodhound/cmd/api/src/database/types/null/TestBoolPointer","TestBoolPointer"
"Test cases for TestDummyHA","0","TestDummyHA","","Mon Mar 30 18:55:04 UTC 2026","passed","Mon Mar 30 18:55:04 UTC 2026","","Go Test","github.com/specterops/bloodhound/cmd/api/src/daemons/changelog/TestDummyHA","TestDummyHA"
"","383","on clicking switch shows modal and when clicking cancel closes it and switch stays disabled","CitrixRDPConfiguration","Mon Mar 30 18:57:22 UTC 2026","passed","Mon Mar 30 18:57:22 UTC 2026","","Click on switch to enable","",""
"","0","reports an API error when the name for the rule is not unique","handleError","Mon Mar 30 18:56:50 UTC 2026","passed","Mon Mar 30 18:56:50 UTC 2026","","","",""
"","0","returns paramValue as EnvironmentAggregation for unknown values (custom types)","useEnvironmentParams","Mon Mar 30 19:00:42 UTC 2026","passed","Mon Mar 30 19:00:42 UTC 2026","","parseEnvironmentAggregation","",""
"Test cases for TestMarshalFloatText","0","TestMarshalFloatText","","Mon Mar 30 18:55:07 UTC 2026","passed","Mon Mar 30 18:55:07 UTC 2026","","Go Test","github.com/specterops/bloodhound/cmd/api/src/database/types/null/TestMarshalFloatText","TestMarshalFloatText"
"","10","fully replaces state","useObjectState","Mon Mar 30 18:59:58 UTC 2026","passed","Mon Mar 30 18:59:58 UTC 2026","","","",""
"","981","should render with a full list of multiple tenants and domains","Simple Environment Selector","Mon Mar 30 18:57:35 UTC 2026","passed","Mon Mar 30 18:57:36 UTC 2026","","","",""
"Test cases for TestResources_CreateSavedQuery_DuplicateName","0","TestResources_CreateSavedQuery_DuplicateName","","Mon Mar 30 18:55:03 UTC 2026","passed","Mon Mar 30 18:55:03 UTC 2026","","Go Test","github.com/specterops/bloodhound/cmd/api/src/api/v2/TestResources_CreateSavedQuery_DuplicateName","TestResources_CreateSavedQuery_DuplicateName"
"Test cases for TestGetPlatformAggregateStats_Success","6","TestGetPlatformAggregateStats_Success","","Mon Mar 30 18:55:03 UTC 2026","passed","Mon Mar 30 18:55:03 UTC 2026","","Go Test","github.com/specterops/bloodhound/cmd/api/src/api/v2/TestGetPlatformAggregateStats_Success","TestGetPlatformAggregateStats_Success"
"","334","handles creating a new zone","Tag Form","Mon Mar 30 18:56:07 UTC 2026","passed","Mon Mar 30 18:56:07 UTC 2026","","","",""
"","186","toggles a child on","SourceKindsCheckboxes","Mon Mar 30 18:58:01 UTC 2026","passed","Mon Mar 30 18:58:01 UTC 2026","","","",""
"Test cases for TestManagementResource_OIDCLoginHandler","7","TestManagementResource_OIDCLoginHandler","","Mon Mar 30 18:55:48 UTC 2026","passed","Mon Mar 30 18:55:48 UTC 2026","","Go Test","github.com/specterops/bloodhound/cmd/api/src/api/v2/auth/TestManagementResource_OIDCLoginHandler","TestManagementResource_OIDCLoginHandler"
"Test cases for TestMarshalTime","0","TestMarshalTime","","Mon Mar 30 18:55:07 UTC 2026","passed","Mon Mar 30 18:55:07 UTC 2026","","Go Test","github.com/specterops/bloodhound/cmd/api/src/database/types/null/TestMarshalTime","TestMarshalTime"
"Test cases for Test_UseHarness","0","Test_UseHarness","","Mon Mar 30 18:55:30 UTC 2026","passed","Mon Mar 30 18:55:30 UTC 2026","","Go Test","github.com/specterops/bloodhound/packages/go/lab/Test_UseHarness","Test_UseHarness"
"","0","returns empty array when environments is undefined","filterAndSearchEnvironments","Mon Mar 30 18:56:18 UTC 2026","passed","Mon Mar 30 18:56:18 UTC 2026","","with empty environments","",""
"Test cases for TestFloatFrom","0","TestFloatFrom","","Mon Mar 30 18:55:07 UTC 2026","passed","Mon Mar 30 18:55:07 UTC 2026","","Go Test","github.com/specterops/bloodhound/cmd/api/src/database/types/null/TestFloatFrom","TestFloatFrom"
"","12","should render a Field when the provided value is 0","Field","Mon Mar 30 19:00:13 UTC 2026","passed","Mon Mar 30 19:00:13 UTC 2026","","","",""
"Test cases for TestManagementResource_ServeMetadata","13","TestManagementResource_ServeMetadata","","Mon Mar 30 18:55:48 UTC 2026","passed","Mon Mar 30 18:55:48 UTC 2026","","Go Test","github.com/specterops/bloodhound/cmd/api/src/api/v2/auth/TestManagementResource_ServeMetadata","TestManagementResource_ServeMetadata"
"","1865","hides the password field and removes the requirement when logged in with SSO","Users","Mon Mar 30 18:57:53 UTC 2026","passed","Mon Mar 30 18:57:55 UTC 2026","","","",""
"","1880","when user performs a pathfinding search, and then clicks the swap button, the start and destination inputs are swapped","Pathfinding: interaction","Mon Mar 30 18:57:57 UTC 2026","passed","Mon Mar 30 18:57:59 UTC 2026","","","",""
"","17","navigates to the specified route with global params intact when triggered by a splat route","AppNavigate","Mon Mar 30 18:59:27 UTC 2026","passed","Mon Mar 30 18:59:27 UTC 2026","","","",""
"","62","applies correct dynamic height based on filtered data","ActiveExtensionsCard","Mon Mar 30 18:56:25 UTC 2026","passed","Mon Mar 30 18:56:25 UTC 2026","","","",""
"","4","handles ISO 8601 formatted date strings and converts it into our standard date display format","Formatting string properties","Mon Mar 30 18:57:13 UTC 2026","passed","Mon Mar 30 18:57:13 UTC 2026","","","",""
